stop_id,stop_code,stop_name,stop_lat,stop_lon,Routes,Direction
6407,3164,Warden Ave at Cataraqui Cres,43.70247,-79.277192,135 | 69,Southbound
6408,681,Burnhamthorpe Rd at Martin Grove Rd West Side,43.648791,-79.54948,50,
6409,493,BLOOR ST WEST AT BAY ST,43.669596,-79.389775,300A | 300B | 300S,
6410,5701,Midland Ave at Emmeline Cres South Side,43.796001,-79.283134,57,Southbound
6411,10628,North Queen St at Eastside Dr,43.619964,-79.552113,123C,Westbound
6412,4983,Dixon Rd at Havenridge Dr West Side,43.697927,-79.543338,352 | 52A | 52B | 52D,Westbound
6413,918,Danforth Ave at Woodycrest Ave,43.679623,-79.341698,300A | 300B | 300S,
6414,13520,McCowan Rd at West Bay Drive,43.88726,-79.289261,129A,Northbound
6415,7969,Military Trail at Bobmar Rd,43.782663,-79.176986,38A,Northwestbound
6416,1299,McCowan Rd at Huntingwood Dr,43.798816,-79.262774,129 | 302,Southbound
6417,2130,Dundas St East at Sherbourne St,43.65822,-79.371303,505,Eastbound
6418,6039,Scarborough Golf Club Rd at Densgrove Rd,43.767633,-79.217915,154,Southbound
6419,5055,The East Mall at The Queensway,43.616743,-79.546582,123B | 123D,Southbound
6420,8679,The West Mall at Holiday Dr,43.649229,-79.568483,112B | 112C,Northbound
6421,8400,Upper Highland Cres at Owen Blvd,43.748517,-79.397726,78,Southbound
6422,3499,Dundas St West at Howland St,43.663985,-79.503463,40A,Westbound
6423,4839,Brimorton Dr at Linville Rd,43.77042,-79.216335,154,Westbound
6424,4255,Kingston Rd at Poplar Rd,43.765656,-79.191176,12D | 334 | 86A | 86B | 86C | 86D | 986,Northeastbound
6425,3132,572 Trethewey Dr,43.696832,-79.491399,32C,Northwestbound
6426,3063,Queen St East at Pape Ave,43.66166,-79.337625,301 | 501 | 503,Westbound
6427,2028,Dufferin St at Chandos Ave,43.671379,-79.440351,29A | 29C | 329,Southbound
6428,4053,Keele St at Yore Rd North Side,43.692148,-79.474206,341 | 41,Northbound
6429,2668,Grandravine Dr at Keele St West Side,43.751972,-79.488762,108A,Westbound
6430,13707,Leslie St at Wicksteed Ave,43.713134,-79.350853,88B,Southbound
6431,3474,Deauville Lane at Grenoble Dr South Side,43.716123,-79.33018,100A | 34C,Southbound
6432,4841,Brimorton Dr at Orton Park Rd West Side,43.77125,-79.210112,154,Westbound
6433,5586,Markham Rd at Tuxedo Crt,43.779611,-79.233182,102,Southbound
6434,5240,Lawrence Ave East at Brockley Dr,43.752209,-79.262362,154 | 354 | 54 | 954,Westbound
6435,11557,Tapscott Rd at Crow Trail,43.807582,-79.23284,134 | 134D,Eastbound
6436,2642,Finch Ave West at Weston Rd East Side,43.752042,-79.541706,336 | 36 | 36A | 36S,Eastbound
6437,1518,Royal York Rd at Strath Humber Crt,43.661189,-79.517388,48 | 73B | 73C | 73D,Northbound
6438,5262,Lawrence Ave East at The Donway West,43.736685,-79.346298,54,Westbound
6439,2891,McNicoll Ave at La Peer Blvd,43.807462,-79.315865,42A,Eastbound
6440,11623,Hupfield Trail at Horseshoe Cres (North),43.812461,-79.220537,132,Northbound
6441,11625,Hupfield Trail at Overlord Cres (East) East Side,43.816082,-79.216834,132,Eastbound
6443,9832,Steeles Ave East at Hillcroft Dr,43.829982,-79.280198,353 | 53,Westbound
6444,488,Bloor St West at Acorn Ave,43.640219,-79.541945,300A | 300B | 300S | 49,
6446,7421,Victoria Park Ave at Pleasant View Dr,43.785815,-79.328126,10 | 169A | 24,Southbound
6447,7395,Van Horne Ave at Victoria Park Ave,43.789053,-79.330117,10 | 169A,Eastbound
6448,8328,Sutherland Dr at Bessborough Dr,43.699459,-79.369617,88A | 88B,Westbound
6449,11550,257 Finchdene Sq,43.82111,-79.23489,134 | 134B | 134D | 339,Westbound
6450,3654,Glencairn Ave at Ennerdale St East Side,43.706656,-79.455415,14,Eastbound
6451,1109,Gerrard St East at Sumach St,43.663061,-79.361596,306 | 506,Eastbound
6452,2575,Finch Ave East at Willowdale Ave,43.781737,-79.406965,339 | 39,Westbound
6453,8229,Steeles Ave East at Leslie St,43.808687,-79.372445,353 | 53 | 953,Westbound
6454,5305,Lawrence Ave East at Pharmacy Ave,43.743031,-79.304863,354 | 54A | 54B,Eastbound
6455,6308,Commander Blvd at Huntingwood Dr,43.797498,-79.269666,169A | 169B,Northbound
6456,7927,Lawson Rd at Centennial Rd,43.787318,-79.151189,38A,Eastbound
6458,6029,Rogers Rd at Kane Ave,43.682166,-79.466387,161,Westbound
6459,897,Danforth Ave at Leyton Ave,43.693398,-79.278057,113 | 20 | 300A | 300B,
6460,309,Bayview Ave at Newton Dr,43.799231,-79.395302,11,
6461,555,Bloor St West at South Kingsway,43.648025,-79.485977,149 | 300A | 300B | 300S,
6462,13482,Lake Shore Blvd West at Thirty Ninth St West Side,43.59282,-79.541218,110B,Westbound
6463,2104,Dufferin St at Billy Bishop Way North Side,43.730328,-79.458326,29 | 329 | 329S,Northbound
6464,746,Caledonia Rd at Summit Ave South Side,43.686437,-79.459522,47B | 47C,
6465,7631,Curity Ave at Cranfield Rd South Side,43.709067,-79.313987,91 | 91D,Southeastbound
6467,7924,Lawson Rd at Cedarview Dr East Side,43.786882,-79.153183,38A,Eastbound
6468,539,Bloor St West at Manning Ave,43.66416,-79.415911,300A | 300B | 300S,
6469,7811,Harbord St at Grace St,43.660015,-79.417409,94A,Westbound
6470,3747,Humber Blvd at Cliff St,43.678455,-79.483624,161,Southwestbound
6471,11232,Northover St at Slater Crt,43.740104,-79.500961,120 | 120S,Southbound
6472,9462,Cosburn Ave at Woodbine Ave,43.696509,-79.317285,87A | 87C,Westbound
6473,3814,Islington Ave at Leduc Dr South Side,43.718169,-79.556712,337 | 37 | 937,Southbound
6475,7498,Signet Dr at Finch Ave West South Side,43.752754,-79.536043,84 | 84S,Southbound
6476,1930,Don Mills Rd at Farmcote Rd North Side,43.74814,-79.346186,25A | 25B | 325,Northbound
6477,4269,Kingston Rd at Whitecap Blvd East Side,43.734323,-79.221794,102A | 102B | 102C | 102D | 12D,Northeastbound
6478,2131,Dundas St East at Sherbourne St,43.658406,-79.370878,505,Westbound
6479,1044,Ellesmere Rd at Dolly Varden Blvd,43.775626,-79.235048,133 | 38A | 38B | 395 | 95A | 95B,Eastbound
6480,2222,The East Mall at West Deane Park Dr South Side,43.659098,-79.569135,111,Southbound
6481,7240,Sheppard Ave East at Scunthorpe Rd,43.793116,-79.241878,385 | 85A | 85B | 85C,Eastbound
6482,7540,Bermondsey Rd at Sunrise Ave,43.716858,-79.31316,91C | 91D,Northbound
6483,6893,The Queensway at Holbrooke Ave,43.626991,-79.500217,80,Westbound
6484,8629,Wellesley St East at Jarvis St,43.666368,-79.378188,94A | 94B,Westbound
6485,8965,Yonge St at Castlefield Ave,43.711692,-79.399293,320 | 320A | 320S | 97A | 97B,Northbound
6486,7102,Scarlett Rd at Scarlettwood Crt North Side,43.692838,-79.517514,79A | 79B,Northbound
6487,8496,Victoria Park Ave at Ruscica Dr,43.734757,-79.306935,24 | 24B | 324,Southbound
6488,6942,Rexdale Blvd at Frost St,43.71244,-79.564054,37A,Westbound
6489,11776,Parkside Dr at Geoffrey St,43.646551,-79.456818,80A,Northbound
6490,6016,Rogers Rd at Caledonia Rd,43.683098,-79.457709,161,Westbound
6491,4380,Kipling Ave at Torlake Cres (South),43.611492,-79.522362,44,Northbound
6492,8062,Rangoon Rd at Eringate Dr,43.66233,-79.576648,112,Southbound
6493,5631,Martin Grove Rd at Porterfield Rd,43.722128,-79.584782,46,Northbound
6494,5057,Eastdale Ave at Secord Ave,43.693358,-79.30024,87A | 87C,Southbound
6495,8247,Steeles Ave East at Willowdale Ave,43.799392,-79.414344,353 | 53,Westbound
6497,8804,Willowdale Ave at Finch Ave East,43.781711,-79.407284,98 | 98B,Southbound
6498,3858,Opposite 4355-4363 Jane St,43.763886,-79.519352,335 | 35A,Southbound
6499,4731,Wynford Dr at Wynford Heights Cres South Side,43.726234,-79.327495,100A | 34B | 34C,Southbound
6500,6961,Rockcliffe Blvd at Lambton Ave,43.682267,-79.491548,71,Northbound
6501,8763,Weston Rd at Rogers Rd,43.681291,-79.476257,89 | 989,Northwestbound
6502,759,Carlton St at Sherbourne St,43.663289,-79.372902,506,
6503,8404,Vaughan Rd at Arlington Ave,43.688867,-79.431524,90A,Northwestbound
6504,8342,The Links Rd at Lord Seaton Rd,43.752371,-79.401446,78,Northbound
6506,5393,Lawrence Ave West at Pimlico Rd West Side,43.707563,-79.482732,352 | 52A | 52B | 52D | 52F | 52G,Westbound
6507,1392,Neilson Rd at Oakmeadow Blvd (North),43.791189,-79.213692,133 | 334 | 334S,Southbound
6508,5229,Lawrence Ave East at Barrymore Rd,43.754129,-79.251669,154 | 354 | 54A | 54B,Eastbound
6509,6183,The Westway at Brougham Cres,43.686483,-79.552452,52G,Westbound
6510,4245,Kingston Rd at Midland Ave West Side,43.710974,-79.248508,12A | 12B | 12D | 12S | 302 | 69,Southwestbound
6511,5042,East Ave at Tudor Glen Cres,43.789975,-79.135627,85A,Southbound
6512,815,College St at Beverley St,43.658547,-79.396367,306 | 506,
6513,2122,Dundas St East at Ontario St,43.658752,-79.368653,505,Eastbound
6514,13312,Scarlett Rd at Eileen Ave,43.667889,-79.500203,189 | 79B,Northbound
6515,2274,Eglinton Ave East at Hoyle Ave,43.710445,-79.379721,334 | 334S | 34A | 34C | 354 | 51 | 54A | 54B | 56,Eastbound
6517,2455,Evans Ave at Treeview Dr,43.613429,-79.536462,15 | 315,Eastbound
6518,11183,Coxwell Ave at Queen St East,43.665944,-79.316311,22 | 31 | 322 | 322S,Northbound
6519,9180,Norfinch Dr at Finch Ave West,43.756148,-79.52451,84,Southbound
6520,6000,Pharmacy Ave at Eglinton Ave East,43.726007,-79.297712,67 | 70,Southbound
6521,13329,Morningview Trail at Littles Rd,43.814615,-79.202266,131 | 131S,Westbound
6522,5290,Lawrence Ave East at McCowan Rd Scarbourough General Hospita,43.755304,-79.245927,154 | 354 | 54A | 54B | 954,Eastbound
6523,10830,3480 McNicoll Ave,43.823145,-79.252552,42,Westbound
6524,3384,Brown's Line at Jellicoe Ave,43.5964,-79.542659,110A | 123B | 123C | 315,Northbound
6525,7116,Senlac Rd at Ellerslie Ave,43.768707,-79.426784,98,Southbound
6526,6174,Weston Rd at Coral Gable Dr,43.735517,-79.538468,165 | 36B | 384 | 84A,Northbound
6527,6466,Huntingwood Dr at Warden Ave,43.785629,-79.310658,169A | 169B,Westbound
6528,11760,Runnymede Rd at Bloor St West North Side,43.651863,-79.476445,71 | 77,Northbound
6529,2502,Finch Ave East at Cherokee Blvd,43.793524,-79.337194,339 | 39A | 39B | 39C,Eastbound
6530,14325,Markham Rd at Edward Jeffreys Ave,43.896348,-79.265198,102,Southbound
6531,1962,Don Mills Rd at Clock Tower Rd,43.734675,-79.342942,25A | 25B | 325 | 354,Southbound
6532,4391,Kipling Ave at Wingrove Hill,43.654293,-79.540646,45A | 45B | 46,Northbound
6533,4543,Progress Ave at Brimley Rd,43.775084,-79.263355,43B,Eastbound
6534,8880,Wilson Ave at Ridge Rd East Side,43.723886,-79.493795,118 | 119 | 165 | 165S | 396 | 96A | 96B | 96D,Eastbound
6535,6333,Crescent Rd at Mt Pleasant Rd,43.678222,-79.380131,82,Westbound
6536,9556,Opposite 715 Milner Ave,43.79698,-79.206377,132,Westbound
6537,965,Donlands Ave at Mortimer Ave,43.687481,-79.340084,56A,
6538,8275,Steeles Ave West at Gerry Fitzgerald Dr,43.785992,-79.4749,353 | 60,Eastbound
6539,1350,124 Milner Ave,43.78482,-79.248381,132,Westbound
6540,3896,Jane St at Giltspur Dr North Side,43.734857,-79.511818,120 | 335 | 35A | 35B,Northbound
6541,3666,Glencairn Station,43.709595,-79.441316,14,Westbound
6542,8372,Tournament Dr at The Links Rd,43.75069,-79.401724,78,Westbound
6543,3021,Pine St at Lawrence Ave West,43.701353,-79.507916,32C | 79A | 79B | 79S,Northbound
6546,7185,Sheppard Ave East at Greenbriar Rd,43.76856,-79.380202,185 | 385,Westbound
6547,443,Birchmount Rd at Ranstone Gardens,43.73857,-79.281097,17A | 17B | 17C | 17S,
6548,8556,Warden Ave at Danube Dr,43.743648,-79.294219,68,Southbound
6549,8702,Opposite 3689 Weston Rd,43.763041,-79.5451,165 | 165S,Southbound
6550,9601,Nugget Ave at Shorting Rd,43.796508,-79.250731,131,Westbound
6551,5138,Laird Dr at Commercial Rd North Side,43.708794,-79.362723,56A,Northbound
6552,2549,Finch Ave East at Au Large Blvd - Seneca College,43.793985,-79.349573,339 | 39 | 939A | 939B | 939C,Westbound
6553,11250,Finch Ave West at Walkway to Farr Ave,43.743725,-79.579543,336 | 36B,Westbound
6555,3381,Brooklawn Ave at Sloley Rd,43.719584,-79.23492,69,Southbound
6556,1669,Yonge St at Chaplin Cres,43.698394,-79.39676,320 | 97A | 97B | 97C,Southbound
6557,7049,Runnymede Rd at Bloor St West South Side,43.650853,-79.47626,77,Southbound
6558,6413,Grantbrook St at Hendon Ave,43.77799,-79.432092,98,Northbound
6559,5657,Martin Grove Rd at Winterton Dr,43.672311,-79.56199,46,Northbound
6560,7697,Ellesmere Rd at Midland Ave,43.768149,-79.270795,395 | 95 | 995 | 996 | 996S,Westbound
6561,3371,Broadview Ave at Danforth Ave,43.676342,-79.359041,304 | 504 | 505 | 62 | 8,Southbound
6562,4270,Kingston Rd at Wood Glen Rd,43.684071,-79.27612,117 | 12A | 12B | 12D | 302,Northeastbound
6563,4217,Kingston Rd at Cliffside Dr,43.703801,-79.252646,12A | 12B | 12D | 302 | 69,Northeastbound
6564,13657,Main St Markham North at Springdale Ave,43.885943,-79.262748,102,Southbound
6566,2267,Eglinton Ave East at Don Valley Pkwy West Side,43.722716,-79.331944,334 | 34 | 34B,Westbound
6567,896,Danforth Ave at Jones Ave,43.679958,-79.339988,300A | 300B | 300S,
6568,1284,Martin Ross Ave at Flint Rd,43.77284,-79.480089,107D,Westbound
6569,5622,Martin Grove Rd at Jeffcoat Dr,43.718704,-79.583171,46,Northbound
6570,5417,Lawrence Ave West at Westona St West Side,43.697257,-79.527859,352 | 52F | 52G,Westbound
6571,4606,Spadina Rd at Archer Rd,43.696032,-79.415645,33,Northbound
6572,7863,Humber College Blvd at John Garland Blvd,43.733547,-79.593827,336 | 96A | 96B | 96D | 96S,Eastbound
6573,4787,Avenue Rd at Lytton Blvd,43.713851,-79.411727,52A | 52B | 52D | 52F | 61,Northbound
6574,6049,Secord Ave at Barrington Ave,43.692775,-79.302012,87A | 87C,Westbound
6575,9839,Brenyon Way at John Tabor Trail,43.805533,-79.211291,132,Northwestbound
6577,227,Bathurst St at York Downs Dr,43.747065,-79.436285,160 | 307 | 7,
6578,9838,Brenyon Way at Walkway to John Tabor Trail,43.803534,-79.208118,132,Northbound
6579,5922,O'Connor Dr at Binswood Ave West Side,43.698634,-79.325691,70 | 8,Westbound
6580,3338,Belfield Rd at Martin Grove Rd,43.702132,-79.575453,45B,Westbound
6581,9371,Christie St at Benson Ave,43.67969,-79.424806,126,Northbound
6582,2570,Finch Ave East at Warden Ave,43.79697,-79.315476,339 | 39 | 939A | 939B | 939C,Westbound
6583,6085,Sheppard Ave West at Oakdale Rd,43.737157,-79.523585,384 | 84A | 84C | 84D | 99,Westbound
6584,5833,Mt Pleasant Rd at Merton St,43.698052,-79.386302,74A,Northbound
6585,11246,Littles Rd at Morningview Trail,43.814739,-79.202628,131 | 131S,Southbound
6586,7080,Scarlett Rd at Crane Ave,43.69422,-79.519078,79A | 79B,Southbound
6587,3866,Jane St at Beverly Hills Dr,43.719192,-79.508348,335 | 35A | 35B,Southbound
6588,10118,Opposite 88 Park Lawn Rd,43.624424,-79.484086,66,Northwestbound
6589,3303,St Regis Cres (South) at Bakersfield St,43.755202,-79.480719,107A,Eastbound
6590,11774,Parkside Dr at Algonquin Ave,43.643073,-79.45541,80A,Northbound
6591,10841,Markham Rd at Nashdene Rd,43.820321,-79.246455,102 | 134B | 902,Southbound
6594,4618,West Service Rd at St Albans Rd North Side,43.639364,-79.534744,44,Northbound
6595,1609,Supertest Rd at Flint Rd,43.775464,-79.480838,,Westbound
6596,4365,Kipling Ave at Rathburn Rd,43.659936,-79.543403,45 | 945,Southbound
6597,478,Bloor St East at Church St,43.670877,-79.383423,300A | 300B | 300S,
6598,14055,St Clair Ave East at Warden Ave West Side,43.712074,-79.281556,8,Westbound
6599,6244,Bannatyne Dr at Dunlace Dr,43.761706,-79.372227,115,Northwestbound
6601,8026,Parkwoods Village Dr at Combermere Dr North Side,43.758376,-79.319508,395 | 95,Northwestbound
6602,5725,Midland Ave at Millbridge Gate South Side,43.762342,-79.269279,57,Southbound
6603,5630,Martin Grove Rd at Nottinghill Gate South Side,43.672069,-79.562193,46,Southbound
6604,4789,Avenue Rd at Melrose Ave,43.729775,-79.418522,124 | 162 | 61,Northbound
6606,13436,Underhill Dr at Roanoke Rd North Side,43.742154,-79.325202,91C | 91D,Northbound
6607,4404,Lansdowne Ave at Lappin Ave,43.664789,-79.445593,47A | 47B | 47C,Northbound
6608,8566,Warden Ave at Finch Ave East,43.796921,-79.316007,324 | 68 | 968,Southbound
6609,9779,Sheppard Ave East at Water Tower Gate,43.803267,-79.194779,385 | 85 | 985,Westbound
6610,12034,McNicoll Ave at Kennedy Rd,43.812285,-79.30168,42,Westbound
6611,7496,Arrow Rd at Deerhide Cres (South),43.74799,-79.530999,84,Southbound
6613,13454,Sheppard Ave East at Buchan Crt,43.772377,-79.358775,185 | 385,Eastbound
6614,4554,Progress Ave at Midland Ave,43.772768,-79.273338,43B,Eastbound
6615,2142,Dundas St West at Bay St,43.655582,-79.384014,505,Eastbound
6616,7191,1900 Sheppard Ave East,43.775751,-79.335749,167A | 167B | 169B | 24B | 385 | 85,Westbound
6617,8389,Upper Canada Dr at Aldershot Cres,43.754477,-79.404327,78,Northeastbound
6619,6659,Pharmacy Ave at Alvinston Rd North Side,43.723908,-79.296781,67A | 67B,Northbound
6620,1738,Bingham Ave at Kingston Rd,43.680832,-79.285215,322 | 322S | 503,Southbound
6621,6417,Henrietta St at Castleton Ave,43.670324,-79.486237,71 | 79A,Westbound
6622,2213,The East Mall at Keane Ave,43.648739,-79.560303,111,Southbound
6623,3669,Greenwood Ave at Athletic Ave,43.669611,-79.327576,31,Southbound
6624,5957,Ossington Ave at College St,43.654463,-79.422802,363 | 363S | 63,Southbound
6626,633,Brimley Rd at Gully Dr,43.74353,-79.251113,21C,
6627,699,175 Caledonia Rd,43.680022,-79.456679,47B | 47C,
6628,8930,Woodbine Ave at Queen St East North Side,43.669361,-79.305922,92,Northbound
6629,6934,Rannock St at Pharmacy Ave,43.728834,-79.299053,67 | 67B,Eastbound
6630,416,Birchmount Rd at Foxridge Dr South Side,43.721543,-79.274496,17,
6632,7704,Ellesmere Rd at Neilson Rd - Scarborough Heatlh Network Cent,43.782441,-79.205092,133 | 154 | 38A | 38B | 395 | 938 | 95A | 95B | 995,Eastbound
6633,817,College St at Borden St,43.657064,-79.405017,506,
6635,1496,Rathburn Rd at Ravenscrest Dr,43.658494,-79.549408,48,Westbound
6636,4362,Kipling Ave at The Queensway South Side,43.620472,-79.526733,44 | 944,Southbound
6637,9657,Graydon Hall Dr at Graydon Hall Pl,43.764832,-79.344085,122,Westbound
6638,6954,Rockcliffe Blvd at Alliance Ave,43.677021,-79.489486,71,Southbound
6639,4111,Kennedy Rd at Cardwell Ave,43.785629,-79.289243,343 | 43A,Northbound
6640,9157,Lawrence Ave East at Mildenhall Rd,43.72831,-79.38669,124 | 162 | 352,Eastbound
6641,2262,EGLINTON AVE EAST AT DON MILLS RD,43.720195,-79.339256,334 | 334S | 34A,Eastbound
6642,2223,The East Mall at West Deane Park Dr,43.65915,-79.56893,111,Northbound
6643,6602,Middlefield Rd at McCowan Rd,43.799166,-79.260706,130A | 130B,Westbound
6645,10242,Middlefield Rd at Ingleton Blvd South Side,43.826901,-79.265054,130A,Southbound
6646,4608,Spadina Rd at Burton Rd,43.69299,-79.414567,33,Southbound
6647,4873,140 Church St,43.707374,-79.514059,59B,Westbound
6648,295,Bayview Ave at Forest Heights Blvd,43.758165,-79.386317,11,
6649,9043,Yonge St at Shaftesbury Ave North Side - Summerhill Station,43.68239,-79.391664,320 | 320A | 320S | 97C,Northbound
6650,6267,Brown's Line at Coules Crt (North) North Side,43.608822,-79.548079,123B | 123C | 315,Northbound
6651,2468,Faywood Blvd at Faith Ave,43.739215,-79.447563,104,Southbound
6652,2980,Overlea Blvd at Leaside Park Dr East Side,43.703699,-79.350961,100A | 25A | 25B | 325 | 72 | 88A,Eastbound
6653,7161,Sheppard Ave East at Brian Dr West Side,43.775295,-79.331712,167A | 167B | 169B | 24B | 385 | 85 | 904 | 985,Westbound
6655,2878,McNicoll Ave at Birchmount Rd West Side,43.808556,-79.311781,42,Westbound
6656,4541,Progress Ave at Schick Crt,43.774415,-79.266923,43,Westbound
6657,4024,Keele St at Rogers Rd North Side,43.682632,-79.471716,341 | 41 | 941,Northbound
6659,7621,Clayson Rd at Wilson Ave North Side,43.718363,-79.523211,119,Northbound
6663,3671,Greenwood Ave at Danforth Ave,43.681306,-79.332193,31,Northbound
6664,3719,215 Horner Ave,43.60771,-79.517705,110A | 110B,Eastbound
6665,11555,Tapscott Rd at Melford Dr (North) South Side,43.81059,-79.235664,134 | 134D,Southbound
6666,4737,York Gate Blvd at Jane St West Side,43.761915,-79.519393,35B,Westbound
6667,5928,O'Connor Dr at Glebemount Ave East Side,43.69902,-79.323174,70 | 8,Eastbound
6668,10125,Park Lawn Rd at Park Lane,43.633116,-79.492224,66B,Southbound
6669,5134,Kipling Ave at Wingrove Hill South Side,43.654019,-79.540794,45 | 46,Southbound
6670,11085,100 Carrier Dr,43.739353,-79.612727,96A | 96D,Northbound
6671,7031,Royal York Rd at Symons St,43.607652,-79.494895,76A,Southbound
6672,774,Christie St at Lambertlodge Ave South Side,43.6735,-79.422347,126,
6673,683,Burnhamthorpe Rd at Mulgrove Dr,43.64406,-79.568974,50,
6674,4920,Craigton Dr at Victoria Park Ave East Side,43.726926,-79.302403,70,Eastbound
6675,3160,Warden Ave at Firvalley Crt,43.703737,-79.277715,135 | 69,Southbound
6679,4617,Spadina Rd at Strathearn Blvd,43.690876,-79.413518,33,Northbound
6680,3681,Greenwood Ave at Kerr Rd,43.666185,-79.325941,31,Northbound
6681,6993,Royal York Rd at Eglinton Ave West,43.682095,-79.526306,73B | 73C | 73D,Northbound
6682,5255,Lawrence Ave East at Crockford Blvd,43.745931,-79.291536,354 | 54A | 54B,Eastbound
6683,1854,Danforth Rd at Marsh Rd,43.71181,-79.26286,113 | 300B | 300S,Southwestbound
6684,6288,Carlaw Ave at Eastern Ave,43.658457,-79.339088,72C,Southbound
6685,356,Bellamy Rd North at Farmbrook Rd,43.749566,-79.232189,9,
6686,11529,Opposite 29 Valley Woods Rd,43.753842,-79.333227,91,Southbound
6687,7036,Royal York Rd at Van Dusen Blvd,43.64425,-79.510141,15 | 315 | 76A | 76B | 76C,Southbound
6688,3999,Keele St at Gulliver Rd,43.699701,-79.476145,341 | 41 | 941,Southbound
6689,7475,279 Yorkland Blvd (North),43.773357,-79.334456,167A | 24B,Westbound
6690,6653,Parliament St at Winchester St,43.665766,-79.368485,365 | 65,Northbound
6692,6605,Morningside Ave at Lavinia Ave East Side,43.645239,-79.476587,77,Eastbound
6693,1892,Dawes Rd at Ferris Rd South Side,43.705884,-79.295669,23,Southbound
6694,6599,Middlefield Rd at Opposite Walkway to Bushcroft Grove,43.799133,-79.260164,130A | 130B,Northbound
6695,121,Bathurst St at Dewbourne Ave,43.699054,-79.424867,307 | 7,
6696,1682,Albion Rd at Kipling Ave,43.739548,-79.580563,73,Eastbound
6697,5835,Mt Pleasant Rd at Moore Ave,43.693467,-79.384469,74A,Northbound
6698,6894,The Queensway at Islington Ave,43.623384,-79.515045,80A | 80B,Eastbound
6700,5958,Ossington Ave at Davenport Rd South Side,43.674344,-79.430882,363 | 363S | 63,Southbound
6701,2183,Dundas St West at Rusholme Rd,43.649541,-79.42655,505,Westbound
6702,2167,Dundas St West at Howard Park Ave,43.652232,-79.448522,505,Southeastbound
6703,6740,Pharmacy Ave at Rannock St,43.728963,-79.298694,67A,Northbound
6704,899,Danforth Ave at Linnsmore Cres,43.682126,-79.329668,300A | 300B | 300S,
6705,5159,Lake Shore Blvd West at Twenty Seventh St,43.596328,-79.525043,301 | 501 | 508,Eastbound
6706,1150,Howard Park Ave at Indian Rd,43.650555,-79.455063,306 | 506,Eastbound
6707,6534,Gunns Loop at St Clair Ave West,43.671855,-79.471606,189 | 340,bound
6708,7005,Royal York Rd at Lawrence Ave West,43.696011,-79.532473,73C | 73D,Northbound
6709,9726,Martin Grove Rd at Brunello Gate,43.755992,-79.601499,396 | 46 | 927B | 927D,Northbound
6710,4982,Dixon Rd at Golfwood Heights,43.698722,-79.539741,352 | 52A | 52B | 52D,Westbound
6711,9645,Brimley Rd at Comrie Ter (South),43.724683,-79.243151,12A | 12B | 12S | 302,Southbound
6712,3760,Islington Ave at Aylesbury Rd,43.666259,-79.532744,337 | 37A | 37B,Northbound
6713,2196,Dundas St West at Wilmar Rd,43.634928,-79.541384,111 | 112B | 112C | 123B | 123C | 123D | 123F,Southwestbound
6714,3344,Kingston Rd at Victoria Park Ave East Side,43.680773,-79.28358,117 | 12A | 12B | 12D | 302,Eastbound
6715,9697,Gerrard St East at Blantyre Ave West Side,43.687401,-79.284571,135,Westbound
6716,324,Bayview Ave at Tudor Gate North Side,43.743657,-79.383183,11A,
6719,10859,Signal Hill Ave at Steinway Blvd North Side,43.750913,-79.623994,60D | 960D,Northbound
6720,1923,Don Mills Rd at The Donway West (South),43.732335,-79.342295,25A | 25B | 325 | 354,Southbound
6721,8921,Woodbine Ave at Kewbeach Ave,43.665506,-79.304809,92,Northbound
6722,1110,Gerrard St East at Sumach St,43.66327,-79.361269,506,Westbound
6724,8888,Wilson Ave at William Cragg Dr,43.722678,-79.500338,118 | 119 | 165 | 396 | 96A | 96B | 96D,Westbound
6725,2520,Finch Ave East at Linus Rd East Side,43.791934,-79.357687,339 | 39A | 39B | 39C,Eastbound
6726,5204,Opposite 104 Lansdowne Ave,43.644009,-79.437865,47A | 47B | 47C,Northbound
6727,9828,Steeles Ave East at Brimley Rd,43.828058,-79.287519,353 | 53A | 53B | 953A,Eastbound
6728,6913,The Queensway at Royal York Rd,43.626216,-79.502764,80A | 80B,Eastbound
6729,5485,Leslie St at Tangmere Rd South Side,43.735579,-79.356361,51,Southbound
6730,952,Davenport Rd at Primrose Ave,43.671832,-79.446126,127,
6731,2171,Dundas St West at Lansdowne Ave,43.650206,-79.43948,505,Westbound
6732,10534,Warden Ave at Bamburgh Cir (North),43.816083,-79.324402,324 | 68A | 68B,Northbound
6734,12063,Humberline Dr at Finch Ave West,43.735484,-79.617875,96B | 96S,Southbound
6735,4813,Brimley Rd at Alexmuir Blvd South Side,43.810796,-79.279726,21C,Southbound
6736,10865,Brimley Rd at Steeles Ave East,43.82845,-79.287341,21C,Southbound
6738,11081,Humber College Blvd at Carrier Dr South Side,43.7371,-79.610515,96A | 96S,Southbound
6739,7803,Harbord St at Bathurst St,43.661421,-79.409894,94,Eastbound
6740,11158,Commander Blvd at North Wind Pl,43.794875,-79.264701,169A | 169B,Eastbound
6741,9300,65 Skyway Ave,43.686617,-79.5857,112 | 112C,Northbound
6742,104,Bathurst St at Carscadden Dr,43.765547,-79.441098,160 | 307 | 7,
6743,9208,Calvington Dr at Dalsby Rd,43.729396,-79.501809,120,Eastbound
6745,4350,Kipling Ave at Olivewood Rd,43.635401,-79.532553,44,Northbound
6746,3445,470 Coronation Dr,43.764539,-79.168984,86,Westbound
6747,8474,Victoria Park Ave at Janet Blvd,43.740849,-79.309156,24A | 24B | 324,Northbound
6748,3704,160 Horner Ave - Toronto South Detention Centre,43.609901,-79.515026,110A | 110B,Southbound
6749,5109,Gary Dr at Meadow Oak Pl West Side,43.70907,-79.527969,59A,Westbound
6750,6900,1610 The Queensway,43.617112,-79.544131,80,Westbound
6751,4778,Avenue Rd at Glencairn Ave,43.716059,-79.41251,52 | 61,Southbound
6752,7247,Sheppard Ave East at Shaughnessy Blvd,43.77391,-79.353107,185 | 385,Westbound
6753,6312,Commander Blvd at North Wind Pl West Side,43.794994,-79.26481,169A | 169B,Westbound
6754,1884,Dawes Rd at Beth St,43.704583,-79.296235,23,Northbound
