stop_id,stop_code,stop_name,stop_lat,stop_lon,Routes,Direction,Accessibility,Type
2751,2751,Kennedy Rd at Danforth Rd,43.714994,-79.261065,113,Westbound,1,Bus
1265,1265,Maniza Rd at Gilley Rd,43.735734,-79.464573,184,Westbound,1,Bus
2119,2119,Dundas St East at Jarvis St,43.657163,-79.374378,305 | 505,Westbound,2,Streetcar
8960,8960,Yonge St at Briar Hill Ave,43.713729,-79.399948,320 | 97,Southbound,1,Bus
5552,5552,Markham Rd at Blakemanor Blvd,43.750967,-79.22208,102 | 902,Northbound,1,Bus
7797,7797,Grandravine Dr at Derrydown Rd,43.753035,-79.491497,108,Westbound,1,Bus
5325,5325,Lawrence Ave East at Underwriters Rd,43.746625,-79.288269,354 | 54,Eastbound,1,Bus
4895,4895,Commissioners St at Logan Ave,43.65142,-79.337972,114 | 72,Northbound,1,Bus
6260,6260,Berry Rd at Minstrel Dr,43.635106,-79.497939,66,Southbound,1,Bus
5437,5437,Leslie St at Dexter Blvd South Side,43.799373,-79.370328,51,Southbound,1,Bus
8816,8816,Willowdale Ave at Otonabee Ave,43.795867,-79.412905,98,Eastbound,2,Bus
604,604,100 Bridgeland Ave,43.726123,-79.461156,47,Southbound,1,Bus
6847,6847,Queen St West at Ossington Ave,43.644283,-79.41869,301 | 501,Westbound,1,Streetcar
9811,9811,McCowan Rd at Steeles Ave East,43.831169,-79.275424,129 | 302,Northbound,1,Bus
6157,6157,Waterbury Dr at Clarion Rd,43.685022,-79.571152,52,Westbound,1,Bus
1483,1483,Rathburn Rd at Islington Ave,43.662151,-79.53199,48,Eastbound,1,Bus
1645,1645,William R Allen Rd at Overbrook Pl,43.760867,-79.464927,104 | 105 | 329,Northbound,1,Bus
719,719,Caledonia Rd at Glengrove Ave,43.706301,-79.465166,47,Northbound,1,Bus
2034,2034,Dufferin St at College St,43.652658,-79.432662,29 | 329 | 929,Southbound,1,Bus
3804,3804,Islington Ave at Judson St North Side,43.614039,-79.508392,110 | 337,Northbound,2,Bus
4401,4401,Lansdowne Ave at Dupont St,43.666612,-79.446297,47,Northbound,1,Bus
3976,3976,Keele St at Diana Dr South Side,43.740824,-79.48559,101 | 341 | 41,Southbound,2,Bus
3609,3609,Opposite 625 Finch Ave West,43.771704,-79.454303,336 | 36,Westbound,1,Bus
2328,2328,Eglinton Ave West at Bemersyde Dr,43.678401,-79.545008,32 | 332 | 405,Eastbound,1,Bus
481,481,Bloor St East at Jarvis St,43.671464,-79.38077,300,Eastbound,1,Bus
14310,14310,McCowan Rd at Southdale Dr South Side,43.86503,-79.284087,129,Northbound,1,Bus
6846,6846,Queen St West at Ossington Ave,43.64406,-79.418976,301 | 501,Eastbound,1,Streetcar
5495,5495,Lloyd Manor Rd at Beaverbrook Ave,43.661742,-79.547757,46,Southbound,1,Bus
9466,9466,Cosburn Ave at Linsmore Cres,43.69285,-79.334238,322 | 87,Eastbound,1,Bus
5873,5873,Oak St at Weston Rd,43.708091,-79.532567,59,Eastbound,2,Bus
7585,7585,Opposite 215 Carlingview Dr,43.683178,-79.594033,112 | 332,Northbound,2,Bus
1348,1348,Mill Rd at Toledo Rd,43.634066,-79.57709,49,Eastbound,1,Bus
978,978,4610 Dufferin St,43.77216,-79.467924,105 | 329,Northbound,1,Bus
3790,3790,Islington Ave at Fenley Dr South Side,43.692803,-79.544904,337 | 37,Southbound,2,Bus
4468,4468,Markham Rd at Milner Ave,43.789364,-79.236737,102,Northbound,1,Bus
4637,4637,St Regis Cres North at Ceramic Rd East Side,43.756479,-79.483595,101,Southbound,1,Bus
9153,9153,3400 Keele St,43.747616,-79.487209,341 | 41,Southbound,1,Bus
6393,6393,Foxwell St at Duern St,43.670893,-79.495862,189 | 79,Southbound,1,Bus
2078,2078,Dufferin St at Playfair Ave,43.710983,-79.454179,29 | 329,Southbound,1,Bus
9642,9642,Brimley Rd at Lombardy Cres,43.731931,-79.246177,12 | 302,Southbound,1,Bus
2568,2568,Finch Ave East at Opposite Walkway East of Birchmount Rd,43.799792,-79.303031,339 | 39,Eastbound,1,Bus
778,778,Christie St at Yarmouth Rd North Side,43.670279,-79.420936,126,Northbound,1,Bus
8283,8283,Steeles Ave West at Islington Ave,43.764537,-79.574602,60 | 960,Westbound,1,Bus
3340,3340,Belfield Rd at McCulloch Ave West Side,43.702639,-79.573099,45,Northbound,1,Bus
3385,3385,Brown's Line at Jellicoe Ave South Side,43.596288,-79.542878,110 | 123 | 315,Northbound,1,Bus
8538,8538,Warden Ave at Bowater Dr,43.781056,-79.308879,324 | 68,Northbound,1,Bus
9513,9513,Sheppard Ave East at Victoria Park Ave West Side,43.775213,-79.323709,167 | 169 | 385 | 85 | 904 | 985,Northbound,1,Bus
1025,1025,Dupont St at Shaw St,43.670463,-79.426696,26,Eastbound,1,Bus
11783,11783,Parkside Dr at Geoffrey St,43.646725,-79.457071,80,Westbound,2,Bus
12176,12176,Dufferin St at Finch Ave West South Side,43.768007,-79.466943,104 | 105 | 329,Northbound,1,Bus
3216,3216,Yonge St at Charles St East,43.668556,-79.385974,320 | 97,Northbound,1,Bus
11116,11116,Bloor St East at Yonge St East Side,43.670297,-79.386126,300,Eastbound,1,Bus
8213,8213,Steeles Ave East at Bestview Dr,43.80629,-79.383217,353 | 53,Eastbound,1,Bus
2330,2330,Eglinton Ave West at Municipal Dr - York Civic Centre,43.689752,-79.477026,164 | 32 | 332,Westbound,1,Bus
5279,5279,Lawrence Ave East at Kennedy Rd East Side,43.74948,-79.274276,154 | 354 | 54 | 954,Eastbound,1,Bus
3887,3887,Jane St at Eglinton Ave West South Side,43.68404,-79.498872,335 | 35 | 935,Southbound,1,Bus
6753,6753,Pharmacy Ave at Steeles Ave East South Side,43.81629,-79.336392,167,Northbound,1,Bus
1155,1155,Howard Park Ave at Roncesvalles Ave,43.651592,-79.45081,306 | 506,Westbound,2,Streetcar
732,732,Caledonia Rd at Leswyn Rd,43.7159,-79.467783,47,Southbound,1,Bus
14187,14187,Warden Ave at Frey Cres,43.74345,-79.293834,68,Northbound,1,Bus
609,609,227 Bridgeland Ave,43.724537,-79.467678,47,Northbound,1,Bus
6159,6159,Waterbury Dr at Redgrave Dr North Side,43.683214,-79.569859,52,Westbound,1,Bus
13901,13901,Sheppard Ave East at Walkway to Murison Blvd,43.801068,-79.203406,385 | 85,Eastbound,2,Bus
3964,3964,Keele St at Calvington Dr South Side,43.733145,-79.483707,101 | 120 | 341 | 41,Southbound,1,Bus
1805,1805,Cummer Ave at Conacher Dr,43.791392,-79.397163,42,Eastbound,1,Bus
6806,6806,Queen St East at Kingston Rd,43.667398,-79.312137,301 | 501,Westbound,1,Streetcar
8534,8534,Warden Ave at Bertrand Ave,43.732909,-79.28951,68,Northbound,1,Bus
2970,2970,1415 Morningside Ave,43.810785,-79.203418,116 | 131,Eastbound,1,Bus
598,598,Bloor St West at Windermere Ave,43.65008,-79.480567,149 | 300,Eastbound,1,Bus
9551,9551,150 Murison Blvd,43.800154,-79.204657,132,Eastbound,1,Bus
5193,5193,Lake Shore Blvd West at Mimico Ave,43.613855,-79.489387,301 | 501 | 507 | 508,Westbound,1,Streetcar
4815,4815,Brimley Rd at Brimley Woods Park,43.80931,-79.278836,21,Northbound,1,Bus
584,584,Bloor St West at Shaw St,43.662583,-79.423134,300,Westbound,1,Bus
5492,5492,Leslie St at York Mills Rd,43.75271,-79.359741,51,Northbound,1,Bus
2540,2540,Finch Ave East at Pineway Blvd,43.789319,-79.373112,339 | 39,Eastbound,1,Bus
11344,11344,5373 Finch Ave East,43.811161,-79.250966,339 | 39 | 939,Eastbound,1,Bus
7690,7690,Ellesmere Rd at Dewey Dr,43.76023,-79.304551,395 | 95,Eastbound,1,Bus
8545,8545,Warden Ave at Canadian Rd,43.758595,-79.300254,68,Southbound,1,Bus
5480,5480,Leslie St at Steeles Ave East,43.808146,-79.372255,51,Northbound,1,Bus
365,365,Bellamy Rd North at Nelson St,43.746466,-79.230879,9,Northbound,1,Bus
30,30,Annette St at High Park Ave,43.662799,-79.46939,26,Eastbound,1,Bus
8447,8447,Victoria Park Ave at Dawes Rd South Side,43.70621,-79.29498,24 | 324,Southbound,1,Bus
3023,3023,Post Rd at Bayview Ave,43.736627,-79.380514,162,Westbound,2,Bus
1782,1782,Cosburn Ave at Westlake Cres West Side,43.697384,-79.310489,404 | 87,Eastbound,1,Bus
7026,7026,Royal York Rd at Royaleigh Ave,43.698515,-79.533557,352 | 405 | 73,Northbound,2,Bus
12132,12132,Queen's Plate Dr (West) at Rexdale Blvd North Side,43.719322,-79.603233,37 | 927,Northbound,1,Bus
10262,10262,Dufferin St at Briar Hill Ave,43.702243,-79.451968,29 | 329,Northbound,1,Bus
6935,6935,240 Rexdale Blvd,43.713177,-79.577655,37,Northbound,1,Bus
3399,3399,Calvington Dr at Roding St,43.731336,-79.49321,120,Eastbound,1,Bus
2506,2506,Finch Ave East at Don Mills Rd East Side,43.792619,-79.354183,939,Eastbound,1,Bus
7222,7222,Sheppard Ave East at Neilson Rd,43.797935,-79.21787,385 | 85 | 985,Eastbound,1,Bus
8209,8209,3381 Steeles Ave East,43.81478,-79.344182,353 | 53,Eastbound,1,Bus
3196,3196,Woodbine Ave at Barker Ave,43.694244,-79.316363,404 | 91 | 93,Northbound,1,Bus
6332,6332,Crescent Rd at Mt Pleasant Rd East Side,43.678128,-79.380209,82,Eastbound,1,Bus
1474,1474,Rathburn Rd at Edenwood Dr,43.658373,-79.549223,48,Eastbound,1,Bus
8338,8338,Sweeney Dr at Sloane Ave West Side,43.735703,-79.312716,91,Northbound,1,Bus
5900,5900,Oakwood Ave at Earlsdale Ave,43.685104,-79.438004,161 | 363 | 63,Southbound,1,Bus
8278,8278,Steeles Ave West at Hidden Trail,43.788495,-79.463345,353 | 60 | 960,Eastbound,1,Bus
3197,3197,Woodbine Ave at Barker Ave South Side,43.693898,-79.316444,404 | 91 | 93,Southbound,1,Bus
6268,6268,Brown's Line at Coules Crt (North) South Side,43.608085,-79.548111,123 | 315,Northbound,1,Bus
7537,7537,195 Bermondsey Rd,43.723838,-79.314381,91,Northbound,2,Bus
11095,11095,Scarborough Golf Club Rd at Mossbank Dr,43.76743,-79.217576,154 | 406,Northbound,1,Bus
8349,8349,11 Thorncliffe Park Dr,43.704287,-79.348715,325 | 403 | 72 | 88,Northbound,2,Bus
1897,1897,Dawes Rd at Gower St,43.702372,-79.297052,23 | 404,Southbound,1,Bus
6331,6331,Crescent Rd at Lamport Ave,43.677942,-79.378216,82,Westbound,1,Bus
4831,4831,Brimley Rd at Port Royal Trail (South),43.821421,-79.284532,21,Southbound,1,Bus
4264,4264,Kingston Rd at Sharpe St,43.706529,-79.25137,12 | 302 | 69,Northbound,1,Bus
8310,8310,Steeles Ave West at Torresdale Ave,43.790688,-79.453166,353 | 60 | 960,Eastbound,1,Bus
214,214,Bathurst St at Vesta Dr,43.703148,-79.425728,307 | 33 | 7,Northbound,1,Bus
9182,9182,Oakdale Rd at Finch Ave West South Side - Humber Reactivation Care,43.755152,-79.524025,84,Eastbound,1,Bus
1048,1048,Ellesmere Rd at Markham Rd,43.776245,-79.232002,133 | 38 | 395 | 938 | 95 | 995,Northbound,1,Bus
9498,9498,75 Thorncliffe Park Dr,43.70495,-79.341952,325 | 403 | 72 | 88,Northbound,1,Bus
8129,8129,Spadina Ave at Queen St West South Side,43.64822,-79.396223,310 | 510,Southbound,1,Streetcar
3915,3915,Jane St at Pritchard Ave,43.669436,-79.492679,335 | 35,Northbound,1,Bus
3851,3851,Islington Ave at Vanhill Ave,43.75723,-79.569647,337 | 37 | 937,Northbound,1,Bus
6241,6241,Bannatyne Dr at Beaverhall Dr,43.758947,-79.365919,115,Eastbound,2,Bus
8969,8969,Yonge St at Chatsworth Dr,43.722068,-79.401694,320 | 97,Southbound,1,Bus
2649,2649,Glenorchy Rd at Royal Oak Dr South Side,43.727035,-79.364629,162,Eastbound,1,Bus
4091,4091,Kennedy Rd at Huntingwood Dr,43.795259,-79.293699,343 | 43,Southbound,1,Bus
5265,5265,Lawrence Ave East at Fortune Gate,43.76116,-79.219676,154 | 354 | 54 | 954,Eastbound,1,Bus
3580,3580,1118 Finch Ave West,43.767126,-79.475169,336 | 36,Westbound,1,Bus
8276,8276,Steeles Ave West at Gaudaur Rd East Side,43.767387,-79.56018,166 | 60 | 960,Eastbound,1,Bus
86,86,6030 Bathurst St,43.787654,-79.446634,160 | 307 | 7,Northbound,1,Bus
5322,5322,Lawrence Ave East at Townley Ave,43.742834,-79.30707,354 | 54,Eastbound,1,Bus
2594,2594,Finch Ave West at Driftwood Ave,43.758188,-79.513256,336 | 806,Westbound,1,Bus
9133,9133,Glenorchy Rd at Royal Oak Dr,43.726897,-79.364252,162,Westbound,1,Bus
2544,2544,Finch Ave East at Ravel Rd,43.790454,-79.365186,339 | 39,Eastbound,1,Bus
2518,2518,Finch Ave East at Leslie St East Side,43.789867,-79.367095,339 | 39 | 939,Eastbound,1,Bus
4901,4901,Coxwell Ave at Cosburn Ave,43.69424,-79.328168,70,Westbound,1,Bus
5153,5153,Lake Shore Blvd West at Thirteenth St,43.599445,-79.511706,110 | 301 | 501 | 507 | 508,Southbound,1,Bus
4900,4900,Coxwell Ave at Barker Ave North Side,43.692127,-79.327069,322 | 70,Eastbound,1,Bus
7237,7237,Sheppard Ave East at Rouge River Dr,43.804795,-79.186784,385 | 85 | 985,Eastbound,1,Bus
10935,10935,Union Station,43.645652,-79.37921,310 | 509 | 510,Northbound,1,Streetcar
6376,6376,The Esplanade at Lower Sherbourne St,43.648887,-79.367679,121 | 75,Northbound,2,Bus
7309,7309,Sherbourne St at Bloor St East - Sherbourne Station,43.672155,-79.376648,75,Northbound,1,Bus
11670,11670,Sheppard Ave East at Meadowvale Rd West Side,43.808291,-79.171598,385 | 85 | 985,Eastbound,1,Bus
12052,12052,Progress Ave at Milner Ave,43.789947,-79.23395,134,Northbound,1,Bus
6945,6945,Rexdale Blvd at Kipling Ave,43.71191,-79.566462,37,Northbound,2,Bus
222,222,Bathurst St at Wilson Ave South Side,43.736782,-79.43401,307 | 400 | 7,Southbound,1,Bus
2208,2208,The East Mall at Eglinton Ave West South Side,43.671379,-79.57119,111,Southbound,2,Bus
13717,13717,Ridgecrest Rd at Major Mackenzie Dr East South Side,43.900348,-79.304527,129,Northbound,1,Bus
9442,9442,Danforth Rd at Warden Ave,43.696759,-79.274854,113 | 300,Eastbound,1,Bus
2676,2676,Guildwood Pkwy at Schubert Dr,43.750274,-79.186319,116 | 334,Eastbound,1,Bus
13637,13637,Markham Rd at 14Th Ave,43.856591,-79.255581,102,Northbound,1,Bus
1622,1622,Warden Ave at Cataraqui Cres,43.702311,-79.276824,135 | 68 | 69,Northbound,2,Bus
10777,10777,Spadina Ave at Bremner Blvd North Side,43.641232,-79.393194,310 | 510,Northbound,1,Streetcar
691,691,Burnhamthorpe Rd at Renforth Dr,43.643187,-79.572682,50,Eastbound,1,Bus
9469,9469,Ellesmere Rd at Calthorpe Ave,43.788307,-79.180898,395 | 95,Eastbound,1,Bus
5273,5273,Lawrence Ave East at Greencedar Circt East Side,43.758141,-79.232683,154 | 354 | 54,Eastbound,1,Bus
2238,2238,Eglinton Ave East at Bayview Ave,43.710886,-79.377428,334 | 34 | 354 | 51 | 54 | 56,Northbound,1,Bus
861,861,Cosburn Ave at Pape Ave,43.689304,-79.34897,322 | 87,Eastbound,1,Bus
6388,6388,Flemington Rd at Stockton Rd,43.72094,-79.449408,109,Southbound,2,Bus
512,512,Alness St at Flint Rd,43.781977,-79.478384,107,Southbound,1,Bus
6707,6707,Pharmacy Ave at Glendinning Ave,43.8116,-79.333977,167,Northbound,1,Bus
6834,6834,Queen St West at Dufferin St,43.642115,-79.428787,301 | 501,Eastbound,1,Streetcar
2484,2484,Finch Ave East at Baldoon Rd,43.815123,-79.232554,134 | 339,Northbound,1,Bus
8665,8665,328 The West Mall,43.637279,-79.563759,112,Southbound,2,Bus
13632,13632,Markham Rd at Steeles Ave East,43.836408,-79.250894,102 | 902,Northbound,1,Bus
8953,8953,Yonge St at Alcorn Ave - Summerhill Station,43.682197,-79.391779,320 | 97,Southbound,1,Bus
5579,5579,Markham Rd at Progress Ave South Side,43.78118,-79.233832,102 | 902,Southbound,1,Bus
634,634,Brimley Rd at Largo Lane South Side,43.747098,-79.252804,21,Southbound,1,Bus
399,399,Birchmount Rd at Danforth Rd,43.706853,-79.267969,117,Northbound,1,Bus
10303,10303,Dovercourt Rd at Shanly St,43.664221,-79.430371,161,Westbound,1,Bus
13896,13896,Middlefield Rd at Orator Gate North Side,43.808245,-79.256455,130,Northbound,1,Bus
13421,13421,Leslie St at Eastern Ave,43.661387,-79.32928,83,Northbound,1,Bus
3908,3908,Jane St at Maple Leaf Dr,43.709123,-79.505308,335 | 35 | 935,Northbound,1,Bus
4952,4952,Danforth Rd at Hollyhedge Dr South,43.75106,-79.244317,16 | 302,Northbound,1,Bus
2920,2920,Midland Ave at Wolfe Ave,43.727211,-79.255132,20,Westbound,1,Bus
2007,2007,Driftwood Ave at Wilmont Dr,43.759758,-79.515958,108,Westbound,1,Bus
11089,11089,Opposite 209 Carrier Dr,43.747076,-79.614869,96,Westbound,2,Bus
687,687,Burnhamthorpe Rd at Old Burnhamthorpe Rd (West),43.640511,-79.582059,50,Eastbound,1,Bus
5368,5368,Lawrence Ave West at Elm Rd West Side,43.723052,-79.412392,352 | 52,Westbound,2,Bus
11739,11739,Ninth St at Birmingham St,43.602332,-79.508392,110,Northbound,2,Bus
8453,8453,Victoria Park Ave at Eglinton Ave East,43.724882,-79.302914,24 | 324 | 924,Southbound,1,Bus
10556,10556,Warden Ave at Highway 7,43.855913,-79.334113,68,Southbound,1,Bus
4321,4321,Kipling Ave at Henley Cres,43.730588,-79.575998,45 | 945 | 96,Southbound,1,Bus
4381,4381,Kipling Ave at Torlake Cres (South),43.611649,-79.522735,44,Southbound,2,Bus
10537,10537,Warden Ave at Masseyfield Gate,43.823658,-79.325363,68,Northbound,1,Bus
8466,8466,Victoria Park Ave at Greylawn Cres (South),43.748458,-79.311836,24 | 324,Northbound,1,Bus
3469,3469,Davenport Rd at Old Weston Rd,43.671082,-79.462147,127 | 168,Northbound,2,Bus
9609,9609,Bushby Dr at McCowan Rd - McCowan Rt Station,43.774745,-79.251924,134 | 9 | 903,Northbound,1,Bus
5711,5711,Midland Ave at Kilcullen Castle Gate North Side,43.809931,-79.289989,57,Northbound,1,Bus
6371,6371,Ellesmere Rd at Victoria Park Ave East Side,43.757877,-79.314607,395 | 95 | 995 | 996,Eastbound,1,Bus
8781,8781,220 Wicksteed Ave,43.713161,-79.347867,88,Southbound,1,Bus
8492,8492,Victoria Park Ave at Pawnee Ave,43.798178,-79.333828,24 | 39,Southbound,1,Bus
7500,7500,Arrow Rd at Lido Rd,43.741466,-79.530633,119 | 84 | 99,Southbound,1,Bus
8633,8633,Wellesley St West at Parliament Building,43.663208,-79.391858,94,Eastbound,1,Bus
1685,1685,1530 Albion Rd - Albion Centre,43.740641,-79.585511,73,Northbound,1,Bus
4261,4261,Kingston Rd at Sandown Ave,43.708964,-79.249854,12 | 302 | 69,Northbound,1,Bus
3459,3459,Crow Trail at Crittenden Sq,43.812209,-79.233305,134,Southbound,1,Bus
2800,2800,Kingston Rd at Waverley Rd,43.676824,-79.304185,322 | 503,Eastbound,1,Bus
3051,3051,Queen St East at Jarvis St,43.653797,-79.373076,301 | 501,Westbound,1,Streetcar
11252,11252,Passmore Ave at Silver Star Blvd,43.820112,-79.297805,343 | 43,Southbound,1,Bus
8700,8700,Weston Rd at Bushey Ave,43.683845,-79.483343,89,Southbound,1,Bus
7917,7917,Laurentide Dr at Three Valleys Dr,43.751768,-79.336782,191 | 91,Southbound,1,Bus
12165,12165,Ellis Ave at Lake Shore Blvd West North Side,43.636808,-79.465565,80,Westbound,1,Bus
7310,7310,Sherbourne St at Carlton St,43.66305,-79.372904,75,Northbound,1,Bus
3198,3198,Woodbine Ave at Cosburn Ave,43.696303,-79.31725,404 | 91 | 93,Northbound,2,Bus
43,43,Annette St at Willard Ave,43.659022,-79.485011,26,Westbound,1,Bus
7330,7330,Sherbourne St at Shuter St,43.656015,-79.369955,75,Northbound,1,Bus
7446,7446,Weston Rd at Walsh Ave,43.716396,-79.537036,73 | 89 | 989,Northbound,1,Bus
6715,6715,Pharmacy Ave at Innismore Cres,43.736208,-79.301876,67,Southbound,1,Bus
9284,9284,Antibes Dr at Bathurst St,43.780933,-79.445119,125,Eastbound,1,Bus
5158,5158,Lake Shore Blvd West at Twenty Sixth St,43.596668,-79.524268,301 | 501 | 507 | 508,Westbound,1,Streetcar
1087,1087,Gerrard St East at De Grassi St,43.666207,-79.348755,306 | 506,Eastbound,2,Streetcar
824,824,College St at Dovercourt Rd,43.653509,-79.426497,306 | 506,Eastbound,2,Streetcar
7371,7371,Stephen Dr at Cloverhill Rd North Side,43.635359,-79.48627,66,Northbound,1,Bus
3247,3247,Yonge St at Wellington St West,43.648025,-79.377521,19 | 320 | 97,Southbound,1,Bus
5355,5355,Lawrence Ave West at Lorindale Ave East Side,43.724699,-79.403671,352 | 52,Eastbound,2,Bus
9472,9472,Ellesmere Rd at Conlins Rd,43.788024,-79.182973,395 | 905 | 95,Eastbound,1,Bus
5336,5336,Lawrence Ave West at Avenue Rd,43.722424,-79.41525,352 | 52 | 952,Westbound,1,Bus
9977,9977,Humber Blvd at Weston Rd,43.683149,-79.480157,161 | 171,Northbound,2,Bus
13629,13629,Markham Rd at McNicoll Ave,43.823823,-79.247559,102 | 134 | 902,Northbound,1,Bus
355,355,Bellamy Rd North at Ellesmere Rd,43.774032,-79.241521,9,Northbound,1,Bus
7048,7048,Runnymede Rd at Annette St,43.66018,-79.48013,71 | 79,Southbound,1,Bus
9129,9129,1183 Finch Ave West,43.765108,-79.483034,336 | 36,Eastbound,1,Bus
773,773,Christie St at Follis Ave North Side,43.668608,-79.420307,126,Northbound,1,Bus
6832,6832,Queen St West at Dovercourt Rd,43.643567,-79.422228,301 | 501,Westbound,1,Streetcar
2219,2219,The East Mall at Talgarth Rd,43.662526,-79.570449,111,Northbound,1,Bus
3514,3514,Dundas St West at Pacific Ave,43.665505,-79.46845,340 | 40,Eastbound,1,Bus
3608,3608,625 Finch Ave West,43.771463,-79.454512,336 | 36,Eastbound,1,Bus
7365,7365,St Phillips Rd at Riverview Heights North Side,43.703316,-79.531666,73,Northbound,1,Bus
2711,2711,Islington Ave at Barkwin Dr,43.738105,-79.565505,337 | 37 | 937,Northbound,1,Bus
11582,11582,Townsley Loop at Townsley St,43.674041,-79.463577,127,Eastbound,1,Bus
3864,3864,Jane St at San Romanoway North Side,43.759352,-79.518034,335 | 35,Northbound,2,Bus
8827,8827,Willowdale Ave at Wedgewood Dr,43.790112,-79.410605,98,Eastbound,2,Bus
9780,9780,Steeles Ave East at Kennedy Rd,43.823486,-79.307333,353 | 53 | 953,Eastbound,1,Bus
4876,4876,Church St at Elm St,43.706758,-79.516166,59,Eastbound,1,Bus
9451,9451,Cosburn Ave at Greenwood Ave,43.691898,-79.338016,322 | 87,Eastbound,1,Bus
5912,5912,Oakwood Ave at Rogers Rd,43.687221,-79.438826,363 | 63,Southbound,1,Bus
2416,2416,Eglinton Ave West at Walkway to Rangoon Rd,43.670474,-79.577739,32 | 332,Eastbound,1,Bus
764,764,Central Park Rdwy at Islington Ave,43.648248,-79.525282,50,Eastbound,1,Bus
8526,8526,Walsh Ave at Wilson Ave,43.715641,-79.532544,118 | 165 | 396 | 96,Northbound,1,Bus
6108,6108,St Clair Ave East at Herron Ave East Side,43.710956,-79.285543,8,Northbound,1,Bus
364,364,Bellamy Rd North at Nelson St South Side,43.746267,-79.2311,9,Southbound,1,Bus
7081,7081,Scarlett Rd at Delemere Ave,43.6703,-79.502543,79,Southbound,2,Bus
4950,4950,Danforth Rd at Gordonridge Pl East Side,43.727826,-79.252323,16 | 300,Northbound,1,Bus
5391,5391,Lawrence Ave West at Olympia Dr East Side,43.705431,-79.491251,352 | 52,Eastbound,1,Bus
655,655,Broadview Ave at Browning Ave,43.680882,-79.357665,100 | 25 | 322 | 62 | 8 | 87,Northbound,1,Bus
8688,8688,3395 Weston Rd,43.747195,-79.541201,165,Northbound,1,Bus
592,592,Bloor St West at Symington Ave,43.657389,-79.447578,300 | 402,Southbound,1,Bus
12163,12163,Lake Shore Blvd West at Colborne Lodge Dr,43.637568,-79.459315,80,Eastbound,1,Bus
9548,9548,Milner Ave at Burrows Hall Blvd,43.794705,-79.219718,132,Eastbound,1,Bus
8887,8887,Wilson Ave at William Cragg Dr,43.722389,-79.500473,118 | 119 | 165 | 396 | 96,Northbound,2,Bus
8289,8289,Steeles Ave West at Klondike Dr,43.768972,-79.552407,166 | 60 | 960,Eastbound,1,Bus
11547,11547,Crow Trail at Baldoon Rd,43.813203,-79.232078,134,Northbound,1,Bus
9799,9799,McCowan Rd at Walkway to Historic Ter,43.820193,-79.272839,129 | 302,Northbound,1,Bus
7159,7159,Sheppard Ave East at Breckon Gate,43.80027,-79.20723,385 | 85 | 985,Eastbound,2,Bus
3252,3252,York Mills Rd at Birchwood Ave,43.746313,-79.392079,115 | 122 | 395 | 95,Eastbound,1,Bus
996,996,Dupont St at Bathurst St,43.673032,-79.414476,26,Eastbound,1,Bus
5018,5018,Dundas St West at Jane St,43.665598,-79.491412,40 | 55,Southbound,1,Bus
5181,5181,Lake Shore Blvd West at Kipling Ave,43.598331,-79.516749,110 | 301 | 501 | 507 | 508,Southbound,1,Bus
4578,4578,Roncesvalles Ave at Howard Park Ave,43.651156,-79.450841,304 | 504,Westbound,2,Streetcar
6761,6761,Pharmacy Ave at Teesdale Place,43.697134,-79.285559,67,Southbound,1,Bus
5803,5803,Mt Pleasant Rd at Belsize Dr,43.702552,-79.387956,74,Southbound,1,Bus
2342,2342,Eglinton Ave West at Duplex Ave,43.706175,-79.400656,13 | 32 | 332 | 61,Northbound,1,Bus
4282,4282,Kipling Ave at Beaconhill Rd,43.753672,-79.587255,337 | 45 | 945,Southbound,1,Bus
10119,10119,Park Lawn Rd at Gardiner Expressway (Wb On Ramp),43.626981,-79.487429,66,Northbound,1,Bus
8707,8707,Weston Rd at Clouston Ave,43.694911,-79.506782,89,Southbound,1,Bus
5979,5979,Ossington Ave at Queen St West,43.644501,-79.419048,363 | 63,Southbound,1,Bus
1317,1317,McCowan Rd at Sheppard Ave East,43.789465,-79.258561,129 | 130 | 131 | 169 | 302 | 939,Northbound,1,Bus
7381,7381,Van Horne Ave at Bickerton Cres,43.788106,-79.334411,10 | 169,Eastbound,1,Bus
1212,1212,Kingston Rd at Neilson Ave West Side,43.7234,-79.23469,102 | 12 | 9,Southbound,1,Bus
5289,5289,Lawrence Ave East at McCowan Rd West Side Scarborough General Hospital,43.755437,-79.246651,154 | 354 | 54 | 954,Eastbound,1,Bus
1638,1638,The West Mall at The Queensway,43.611806,-79.562012,123 | 80,Northbound,1,Bus
4383,4383,Kipling Ave at Tyre Ave,43.645111,-79.53695,45 | 46,Southbound,2,Bus
5738,5738,Midland Ave at Rural Ave North Side,43.787473,-79.279241,57,Northbound,1,Bus
6340,6340,24 Davean Dr,43.762073,-79.36752,115,Westbound,1,Bus
1983,1983,The Donway East at Greenland Rd - Donway Place,43.734213,-79.340141,162 | 403,Southbound,1,Bus
710,710,Caledonia Rd at Castlefield Ave,43.698305,-79.463329,47,Northbound,2,Bus
8352,8352,Thorncliffe Park Dr (East) at Overlea Blvd,43.706926,-79.343188,325 | 403 | 72 | 88,Northbound,1,Bus
2474,2474,Faywood Blvd at Sheppard Ave West,43.752486,-79.451677,104,Northbound,1,Bus
7261,7261,555 Sheppard Ave West,43.756023,-79.435093,384 | 84,Eastbound,1,Bus
4705,4705,Washburn Way at Berner Trail,43.800727,-79.226279,134,Northbound,1,Bus
6730,6730,Opposite 2036 Pharmacy Ave,43.779418,-79.319082,167,Northbound,1,Bus
8106,8106,Sloane Ave at Elvaston Dr North Side,43.730221,-79.309635,91,Northbound,1,Bus
10544,10544,8601 Warden Ave,43.857684,-79.334237,68,Northbound,1,Bus
1308,1308,McCowan Rd at Milner Ave North Side,43.785961,-79.256495,129 | 130 | 131 | 169 | 302,Northbound,1,Bus
2918,2918,Midland Ave at Verdun Ave,43.728502,-79.255665,20,Westbound,1,Bus
1710,1710,Bayview Ave at Arjay Cres,43.740168,-79.382719,11,Southbound,1,Bus
10844,10844,Tapscott Rd at McNicoll Ave West Side,43.825661,-79.244275,134,Northbound,1,Bus
5411,5411,Lawrence Ave West at Welland Rd,43.720066,-79.4263,352 | 52,Westbound,1,Bus
1340,1340,Mill Rd at Markland Dr North Side - Silverthorne C.I.,43.636821,-79.580761,48 | 50,Eastbound,2,Bus
6919,6919,The Queensway at Stephen Dr,43.630183,-79.484391,80,Eastbound,1,Bus
9850,9850,Brenyon Way at Foregate Ave,43.80183,-79.207533,132,Westbound,1,Bus
5826,5826,Mt Pleasant Rd at Lawrence Ave East North Side,43.726749,-79.39643,103,Northbound,1,Bus
5199,5199,2111 Lake Shore Blvd West,43.629066,-79.478151,301 | 501 | 507 | 508,Eastbound,1,Streetcar
8909,8909,Woodbine Ave at Cassels Ave South Side,43.678652,-79.309964,92,Southbound,2,Bus
7616,7616,Clayson Rd at Bartor Rd,43.728609,-79.525817,119,Westbound,1,Bus
2176,2176,Dundas St West at Ossington Ave,43.64943,-79.42049,305 | 505,Westbound,2,Streetcar
1328,1328,419 Midland Ave North Side,43.712292,-79.248584,20,Eastbound,1,Bus
14248,14248,Angus Glen Community Centre Loop at Major Mackenzie Dr East,43.89459,-79.337366,68,Northbound,2,Bus
11455,11455,Ferris Rd at Ferris Cres,43.703036,-79.303363,23,Northbound,1,Bus
