stop_id,stop_code,stop_name,stop_lat,stop_lon,Routes,Direction
5869,13699,Opposite 327 Dixon Rd,43.695236,-79.555207,352 | 52A | 52B | 52D,Westbound
5871,136,Bathurst St at Finch Ave West,43.773623,-79.44272,160 | 307 | 7,
5872,9065,Yonge St at York Mills Rd North Side - York Mills Station,43.744863,-79.40666,320 | 320S | 97A | 97B,Northbound
5873,7546,Beth Nealson Dr at Wicksteed Ave,43.713018,-79.346254,88A,Northbound
5874,11575,Thistle Down Blvd at Albion Rd,43.736103,-79.560691,118,Southwestbound
5876,963,Donlands Ave at Glebeholme Blvd,43.682783,-79.338167,56A,
5877,6211,Williamson Rd at Southwood Dr,43.674124,-79.296434,64,Eastbound
5878,7271,Sheppard Ave West at Chesswood Dr,43.755399,-79.474597,106 | 107B | 107D | 108A | 108B | 384 | 84,Eastbound
5879,3377,Brooklawn Ave at Barkdene Hills,43.71686,-79.233802,69 | 69S,Southbound
5880,3240,Yonge St at Richmond St East,43.651579,-79.378823,320 | 320A | 320S | 97C,Northbound
5881,1438,Oriole Pkwy at Gormley Ave,43.693805,-79.401999,13A | 13B,Southbound
5882,5809,Mt Pleasant Rd at Mt Pleasant Cemetery,43.694928,-79.385302,74,Southbound
5883,2817,Lawrence Ave East at Mildenhall Rd,43.728507,-79.386361,124 | 162 | 352,Westbound
5884,1079,Gerrard St East at Ashdale Ave,43.67239,-79.321719,506,Westbound
5885,5847,Mt Pleasant Rd at Teddington Park Ave,43.733864,-79.399593,74A,Northbound
5886,13925,St Regis Cres at Keele St East Side,43.754624,-79.487752,108A,Eastbound
5887,4387,Kipling Ave at The Westway,43.685458,-79.554422,45A | 45B | 945,Northbound
5888,905,Danforth Ave at Pape Ave,43.679046,-79.344736,300A | 300B | 300S,
5889,2546,Finch Ave East at Sandhurst Cir (East),43.808701,-79.263003,339 | 39A | 39B | 939C,Eastbound
5890,8738,Weston Rd at Kenhar Dr South Side,43.761317,-79.544728,165 | 165S,Southbound
5891,5877,550 Oakdale Rd,43.750135,-79.526856,84,Southbound
5892,3710,Horner Ave at Belvia Rd,43.605324,-79.528711,110A | 110B,Eastbound
5895,5175,2155 Lake Shore Blvd West,43.625705,-79.479741,301 | 501 | 508,Northeastbound
5896,463,Birchmount Rd at Highway 401 - Walkway North of Rolark,43.77185,-79.293899,17A | 17B | 17C | 17S,
5897,5680,Midland Ave at Artillery St,43.818006,-79.293639,57,Northbound
5898,8942,Yonge Blvd at Felbrigg Ave,43.736621,-79.409779,97B,Northwestbound
5899,1323,Midland Ave at Aylesworth Ave North Side,43.714067,-79.249318,20,Northbound
5900,6258,Berry Rd at Cloverhill Rd,43.636958,-79.490027,66,Westbound
5901,3850,Islington Ave at Vanhill Ave,43.757355,-79.570029,37 | 937,Southbound
5902,7250,Sheppard Ave East at Victoria Park Ave,43.775039,-79.323295,167B | 385 | 85A | 85B | 85C,Eastbound
5903,1896,Dawes Rd at Gower St North Side,43.702604,-79.296851,23,Northbound
5904,1182,Jones Ave at Boultbee Ave,43.672735,-79.337193,83,Southbound
5905,5527,MacDonell Ave at Queen St West North Side,43.640726,-79.437986,47A | 47B | 47C,Northbound
5906,706,Caledonia Rd at Bridgeland Ave,43.72337,-79.469507,47B,
5907,1878,Davisville Ave at Mt Pleasant Rd,43.700197,-79.387156,11A | 11C | 28,Eastbound
5909,5529,Main St at Benlamond Ave,43.681139,-79.299088,64,Southbound
5911,6457,Huntingwood Dr at Midland Ave West Side,43.796985,-79.284069,169A | 169B,Westbound
5912,3695,High Park Ave at Annette St,43.662743,-79.469101,30A,Northbound
5913,9292,43 Drewry Ave,43.78659,-79.419446,125,Eastbound
5914,577,Bloor St West at Riverview Gardens,43.648688,-79.485483,149 | 300A | 300B | 300S,
5915,384,Birchmount Rd at Bonniewood Rd,43.727596,-79.276913,17A | 17B | 17C | 17S,
5916,372,Birchmount Rd at Allanford Rd,43.774149,-79.2949,17A | 17B | 17C | 17S,
5917,6748,Pharmacy Ave at Sherwood Ave,43.73998,-79.303217,67A,Northbound
5918,7146,Sheppard Ave East at Aragon Ave,43.779428,-79.304454,385 | 85A | 85B | 85C,Eastbound
5919,6859,Queen St West at University Ave - Osgoode Station,43.65097,-79.386257,301 | 501,Westbound
5920,2361,Eglinton Ave West at Hilltop Rd,43.70065,-79.427436,32A | 32C | 32D | 332,Westbound
5921,718,Caledonia Rd at Glencairn Ave,43.704857,-79.464897,47B | 47C,
5922,4301,777 Kipling Ave,43.629265,-79.529938,44,Northbound
5923,7753,72 Fifeshire Rd,43.758335,-79.389137,78,Southbound
5924,7015,Royal York Rd at Newcastle St,43.617438,-79.498765,76 | 76S | 80,Northbound
5925,9813,Sheppard Ave East at Vandorf St,43.802813,-79.154995,85 | 85B,Northwestbound
5926,5905,Oakwood Ave at Vaughan Rd,43.692326,-79.440768,363 | 363S | 63,Southbound
5927,8427,Victoria Park Ave at O'Connor Dr South Side,43.722825,-79.30202,24 | 24B | 324 | 91D | 924,Southbound
5929,2152,Dundas St West at Brock Ave,43.649937,-79.4355,505,Westbound
5931,2971,Morningside Ave at Walkway to McKnight Dr,43.810567,-79.203682,116 | 116S | 131,Southbound
5932,6617,Neptune Dr at Rajah St,43.731733,-79.438991,109B | 109C,Eastbound
5933,4341,Kipling Ave at New Toronto St South Side,43.60359,-79.519313,44,Southbound
5934,13442,Lambton Ave at Weston Rd,43.683946,-79.484819,71,Eastbound
5936,2399,Eglinton Ave West at Renforth Dr East Side,43.666543,-79.587065,32S | 332,Eastbound
5937,925,Davenport Rd at Avenue Rd West Side,43.674696,-79.397061,19,
5938,6651,Parliament St at Wellesley St East North Side,43.668507,-79.369582,365 | 65 | 94,Northbound
5939,3015,Park Lane Cir at Lawrence Ave East,43.732022,-79.372322,162,Southbound
5940,4988,Dixon Rd at Islington Ave,43.697362,-79.54593,352 | 52A | 52B | 52D | 952,Westbound
5941,6676,Pharmacy Ave at Chester Le Blvd (South),43.796481,-79.327366,167A | 167B,Southbound
5943,3502,Dundas St West at Indian Grove,43.665429,-79.462163,340 | 40A | 40B,Westbound
5944,3754,Islington Ave at Albion Rd,43.736655,-79.56489,337 | 37B | 937,Northbound
5947,13642,Main St Markham North at Robinson St,43.877739,-79.260689,102D,Northbound
5949,11605,Middlefield Rd at Steeles Ave East,43.832509,-79.267626,130A | 130B,Northbound
5950,4466,Markham Rd at Eglinton Ave East,43.74298,-79.21863,102A | 102B | 102C | 102D | 902,Northbound
5951,3709,Toronto South Detention Centre,43.609554,-79.514632,110A | 110B,Northbound
5952,3894,Jane St at Frith Rd,43.746533,-79.515127,335 | 35A | 35B | 935 | 99,Southbound
5953,12044,Moore Park Ave at Fargo Ave,43.792727,-79.424353,97A | 97B,Westbound
5956,13131,Queens Quay West at Lower Spadina Ave East Side,43.637757,-79.391176,509,Eastbound
5957,13450,Lambton Ave at Cashman Cres (East),43.683564,-79.487045,71,Westbound
5958,8982,Yonge St at Ellerslie Ave,43.772295,-79.413801,320 | 320S | 97A | 97B,Southbound
5959,13370,Queens Quay West at Lower Spadina Ave West Side,43.637528,-79.392624,509,Westbound
5960,10786,Oriole Pkwy at Hillsdale Ave West,43.701735,-79.404644,13,Northbound
5961,440,Birchmount Rd at Pinegrove Ave,43.6981,-79.264342,117 | 20,
5962,2956,Morningside Ave at McLevin Ave,43.809027,-79.203015,116 | 116S | 131,Southbound
5963,8726,Weston Rd at Garyray Dr,43.767534,-79.545753,165,Northbound
5964,5748,Midland Ave at Treewood St,43.753548,-79.265625,57,Northbound
5965,9671,Rexdale Blvd at Precision Rd,43.715839,-79.59029,37,Southeastbound
5966,7143,Sheppard Ave East at Ambrose Rd,43.770526,-79.371147,185 | 385,Westbound
5967,6835,Queen St West at Dunn Ave,43.640919,-79.434664,301 | 501,Eastbound
5968,9279,Antibes Dr (North) at Plum Treeway (South) North Side,43.781845,-79.446507,125,Northbound
5969,3642,Glencairn Ave at Caledonia Rd East Side,43.704671,-79.464333,14,Eastbound
5970,6850,Queen St West at Shaw St,43.64456,-79.416511,301 | 501 | 63,Eastbound
5971,12054,Progress Ave at Sheppard Ave East,43.794411,-79.234769,134B | 134D,Northbound
5972,7594,CARNFORTH DR AT LAWRENCE AVE EAST,43.74095,-79.314144,91C | 91D,Northbound
5973,5413,Lawrence Ave West at Weston Rd  West Side,43.700019,-79.517036,352 | 52A | 52B | 52D | 52F | 52G | 79A | 79B | 952,Westbound
5974,8250,Steeles Ave East at Woodbine Ave,43.814178,-79.348291,353 | 53 | 953,Westbound
5975,6440,Huntingwood Dr at Dibgate Blvd,43.79835,-79.27023,169A | 169B,Westbound
5976,11243,Littles Rd at Birrell Ave,43.817234,-79.204301,131,Northbound
5977,3010,Park St at Claremore Ave,43.710245,-79.256332,20,Westbound
5978,8067,Renforth Dr at Eglinton Ave West South Side,43.665826,-79.586989,112,Southbound
5979,1403,Neilson Rd at Silverbell Grove,43.804102,-79.217089,133 | 334,Northbound
5980,5307,Lawrence Ave East at Cedarbrae Mall,43.758704,-79.229975,154 | 354 | 54A | 54B,Eastbound
5981,5903,Oakwood Ave at Eglinton Ave West,43.696886,-79.442511,363 | 63A,Northbound
5982,3913,Jane St at Page Ave,43.663971,-79.490342,335 | 35A | 35B | 55,Northbound
5983,9168,Leslie St at Thorny Vineway,43.787707,-79.367312,51,Northbound
5984,5963,Ossington Ave at Dundas St West North Side,43.649724,-79.420791,363 | 63A | 63B,Northbound
5985,5202,Lake Shore Blvd West at Superior Ave,43.615108,-79.48869,301 | 501 | 508 | 80 | 80S,Southwestbound
5987,7706,Ellesmere Rd at Oakley Blvd East Side,43.768395,-79.268369,395 | 95A | 95B,Eastbound
5988,1017,Dupont St at Manning Ave East Side,43.672099,-79.418732,26,Eastbound
5989,6265,Brian Ave at Margaret Ave,43.78653,-79.334248,10 | 169A,Northbound
5990,6938,Rexdale Blvd at Brydon Dr,43.711667,-79.57103,37A,Northwestbound
5991,9320,6900 Airport Rd - International Centre - North Entrance,43.701831,-79.640204,52,Southeastbound
5992,9579,McLevin Ave at Empringham Dr East Side,43.809704,-79.210692,131,Eastbound
5993,403,Birchmount Rd at Eglinton Ave East,43.729686,-79.277693,17A | 17B | 17C | 17S,
5994,1232,Lawrence Ave East at Wanless Cres (West),43.727365,-79.391895,124 | 162 | 352,Westbound
5995,210,Bathurst St at Tichester Rd South Side,43.685088,-79.41918,307 | 7,
5996,9867,Sheffield St at Densley Ave South Side,43.704666,-79.470535,59A | 59B,Southbound
5997,10858,22 Steinway Blvd,43.751547,-79.621338,60D | 960D,Westbound
5998,329,Bayview Ave at York Mills Rd,43.748322,-79.384408,11,
5999,8379,Underhill Dr at Brookbanks Dr,43.753391,-79.327649,91C | 91D,Northbound
6000,377,1792 Birchmount Rd,43.765388,-79.291431,17,
6001,5192,Lake Shore Blvd West at Mimico Ave,43.613542,-79.489314,301 | 501 | 508,Northeastbound
6002,7126,Senlac Rd at Park Home Ave South Side,43.765968,-79.425603,98,Southbound
6003,2612,FINCH AVE WEST AT KEELE ST,43.763298,-79.49133,336,Eastbound
6004,2151,Dundas St West at Brock Ave,43.649845,-79.435731,505,Eastbound
6006,1491,Rathburn Rd at Martin Grove Rd,43.656925,-79.555395,48,Eastbound
6007,11535,John Garland Blvd at Jamestown Cres (West),43.732437,-79.58675,96A | 96D | 96S,Eastbound
6008,14316,Meadowvale Rd at Lavery Trail,43.795871,-79.164864,395 | 86A | 86C | 986,Northbound
6009,127,Bathurst St at Dundas St West  - Toronto Western Hospital,43.652475,-79.406185,307 | 511,
6010,7083,Scarlett Rd at East Dr,43.676906,-79.506183,79A | 79B,Southbound
6011,6546,Marlee Ave at Lawrence Ave West,43.71525,-79.446207,109B | 109C,Northbound
6012,4980,Dixon Rd at Dixington Cres East Side,43.697806,-79.542843,352 | 52 | 52G,Eastbound
6014,8814,Willowdale Ave at Northwood Dr,43.791598,-79.411507,98 | 98B,Southbound
6015,8160,St Clair Ave West at Deer Park Cres East Side,43.687341,-79.397451,512,Eastbound
6016,9702,Gerrard St East at Osborne Ave,43.684674,-79.297221,135,Westbound
6017,2672,Grandravine Dr at Sentinel Rd,43.751779,-79.495535,108A,Westbound
6018,4399,Lansdowne Ave at Brandon Ave North Side,43.669248,-79.447348,47A | 47B | 47C,Northbound
6019,4370,Kipling Ave at Rexdale Blvd,43.711527,-79.566413,45A | 945,Northbound
6020,6111,St Clair Ave East at Inglewood Dr East Side,43.689602,-79.386639,74A | 88A | 88B,Eastbound
6021,13426,Prince Edward Dr South at Berry Rd,43.634976,-79.499704,66A | 66B,Southbound
6022,8647,Wellesworth Dr at Dixfield Dr (North),43.656891,-79.577284,112B | 112C,Northbound
6023,13895,Ossington Ave at Dupont St,43.670395,-79.429239,363 | 363S | 63,Southbound
6024,4302,Kipling Ave at Dixon Rd,43.694479,-79.558887,45 | 945,Southbound
6025,11271,Opposite 840 Tandridge Cres,43.729235,-79.548451,118,Eastbound
6026,249,Bay St at Gerrard St West,43.6586,-79.38502,19,
6027,7772,Gentian Dr at Renforth Dr,43.665005,-79.58541,112B | 112C,Westbound
6028,9098,Steeprock Dr at Chesswood Dr East Side,43.757368,-79.474606,107A,Eastbound
6030,620,Brimley Rd at Britwell Ave,43.755975,-79.255807,21C,
6031,5737,Midland Ave at Romulus Dr,43.746772,-79.263388,57,Southbound
6032,8847,Wilson Ave at Clyde Ave,43.738595,-79.426958,165 | 396 | 96A | 96B | 96D,Eastbound
6034,6669,Pharmacy Ave at Beverly Glen Blvd,43.801691,-79.329506,167A | 167B,Northbound
6035,2269,Eglinton Ave East at Falcon St West Side,43.709167,-79.386703,334 | 34 | 354 | 51 | 54 | 56A,Westbound
6036,6176,Weston Rd at Fern Ave,43.70235,-79.523516,89,Northwestbound
6038,839,College St at Ossington Ave,43.654255,-79.42294,306 | 506,
6039,2640,Finch Ave West at Westmore Dr,43.734502,-79.601178,36 | 36A | 927B | 927D,Eastbound
6040,4771,Avenue Rd at Douglas Ave,43.72381,-79.416345,124 | 162 | 61,Southbound
6041,11021,King St West at Sudbury St,43.641064,-79.417183,304 | 504 | 504C | 508,Westbound
6043,14266,Staines Rd at Seasons Dr South Side,43.830149,-79.223612,133 | 353 | 53A | 939C | 953A,Southbound
6044,8587,Warden Ave at Manhattan Dr,43.752109,-79.297613,68,Southbound
6046,5535,Main St at Lyall Ave North Side,43.680659,-79.298542,64,Northbound
6047,8985,Yonge St at Fairlawn Ave,43.730953,-79.403849,320 | 97A | 97B,Southbound
6048,344,Bellamy Rd North at Braeburn Blvd South Side,43.749205,-79.232357,9,
6049,6254,Bergamot Ave at Rexdale Blvd North Side,43.713873,-79.559697,37,Northbound
6050,10129,88 Park Lawn Rd,43.624275,-79.48426,66B | 80 | 80S,Southeastbound
6051,13460,Progress Ave at Bellamy Rd North East Side,43.780176,-79.243159,134B | 134D,Eastbound
6052,7188,Sheppard Ave East at Havenview Rd,43.791493,-79.249464,385 | 85A | 85B | 85C | 985B,Eastbound
6053,3705,Horner Ave at Thirtieth St,43.604156,-79.533871,110A,Eastbound
6054,3188,Wilmington Ave at Sheppard Ave West North Side,43.753273,-79.452521,104,Northbound
6056,7683,Ellesmere Rd at Borough Approach East,43.771125,-79.255707,395 | 95A | 95B,Eastbound
6057,7928,Lawson Rd at Clyde Rd,43.785603,-79.159012,38A,Eastbound
6058,987,Dundas St West at Sorauren Ave,43.651247,-79.445756,306 | 505 | 506,
6059,7120,Senlac Rd at Finch Ave West,43.775862,-79.429872,98,Northbound
6060,1836,Danforth Ave at Pharmacy Ave,43.692436,-79.283201,113 | 20 | 300A | 300B | 300S,Westbound
6061,8734,Weston Rd at Jane St,43.691391,-79.501346,89 | 989,Southeastbound
6062,2026,Dufferin St at Castlefield Ave,43.700952,-79.451951,29A | 29C | 329 | 929,Southbound
6063,10860,Signal Hill Ave at Steeles Ave West,43.752776,-79.624819,60 | 60D | 960 | 960D,Northbound
6064,9641,Brimley Rd at Danforth Rd,43.735285,-79.247571,12A | 12B | 12S | 300B | 300S | 302,Southbound
6065,2584,Finch Ave West at Ardwick Blvd (West),43.747602,-79.562474,336 | 36 | 36A,Eastbound
6066,8253,Steeles Ave West at Adesso Dr,43.77444,-79.526647,60B | 60D | 84 | 960B | 960D,Westbound
6068,3255,York Mills Rd at Cedarwood Ave West Side,43.745953,-79.394494,115 | 122 | 395 | 95,Westbound
6069,9325,Industry St at Bertal Rd South Side,43.691655,-79.48926,171 | 71,Eastbound
6070,8093,Sheppard Ave East at Yonge St East Side,43.761625,-79.409843,185 | 385 | 98,Eastbound
6071,9181,Norfinch Dr at Finch Ave West North Side,43.756568,-79.524486,84D,Northbound
6072,3767,Islington Ave at Bergamot Ave,43.716748,-79.555736,337 | 37B | 937,Northbound
6073,1501,580 Rathburn Rd - Seneca School,43.650674,-79.581797,48,Westbound
6074,1298,McCowan Rd at Horfield Ave,43.728523,-79.23404,9,Southbound
6075,9961,Varsity Rd at Doran Ave,43.661987,-79.499144,55,Northwestbound
6076,4547,Progress Ave at Estate Dr East Side,43.781324,-79.23551,134B | 134D,Eastbound
6077,5741,Midland Ave at Sheppard Ave East,43.785521,-79.278841,57,Southbound
6078,3536,Eastern Ave at Minto St East Side (Post Office),43.662898,-79.323253,31,Eastbound
6079,9696,Gerrard St East at Rathmore Ave West Side,43.688004,-79.281828,135,Westbound
6080,280,Bayview Ave at Burleigh Heights Dr North Side,43.77972,-79.390855,11A,
6082,7886,Keele St at Dundas St West,43.665275,-79.464376,189 | 341 | 41 | 89 | 941 | 989,Northbound
6083,1850,300 Danforth Rd,43.701506,-79.271864,113 | 300B | 300S,Southwestbound
6084,6742,Pharmacy Ave at Rosita Cres North Side,43.712137,-79.291805,67A | 67B,Northbound
6085,7553,Birchmount Rd at Kingston Rd,43.693136,-79.26245,117 | 12A | 69,Southbound
6086,5444,Leslie St at Francine Dr South Side,43.804428,-79.371619,51,Southbound
6087,6661,Pharmacy Ave at Arnall Ave,43.807108,-79.331997,167A | 167B,Northbound
6088,3151,Tuscan Gate at Sheppard Ave West,43.752921,-79.483158,107B | 107D | 108A,Southbound
6089,4974,Opposite 950 Dixon Rd,43.686507,-79.598336,332 | 352 | 52 | 52G,Eastbound
6090,8771,Weston Rd at Sunset Trail,43.72174,-79.537093,165,Northbound
6091,4327,Kipling Ave at Horner Ave,43.607333,-79.520921,44 | 944,Southbound
6092,8553,Warden Ave at Danforth Ave,43.694237,-79.273479,135 | 69,Northbound
6094,6929,Ranee Ave at Mikado Ave,43.724612,-79.442678,109B | 109C | 109S,Westbound
6095,12078,McCowan Rd at Highway 401,43.782557,-79.255208,129A | 129B | 130A | 130B | 131 | 132 | 169A | 169B | 302,Northbound
6096,7414,Victoria Park Ave at Farm Greenway,43.764563,-79.318432,24 | 24B | 324,Southbound
6097,9858,McCowan Rd at Nugget Ave,43.792208,-79.260059,129 | 130A | 130B | 169A | 169B | 302,Southbound
6098,2522,Finch Ave East at Longmore St,43.782077,-79.404565,339 | 39A | 39B | 39C,Eastbound
6100,1895,Dawes Rd at Goodwood Park Crt,43.695251,-79.297513,23,Southbound
6101,5669,McCowan Rd at Hollyhedge Dr (North) South Side,43.753308,-79.244715,16 | 302,Southbound
6102,460,Birchmount Rd at Vauxhall Dr,43.758838,-79.289314,17A | 17B | 17C | 17S,
6103,6091,Sheppard Ave West at Weston Rd,43.733919,-79.537904,384 | 84A | 984A,Westbound
6104,5843,Mt Pleasant Rd at Soudan Ave,43.706182,-79.389421,74,Southbound
6105,5445,Leslie St at Francine Dr,43.804785,-79.371406,51,Northbound
6106,2618,Finch Ave West at Milady Rd,43.747162,-79.564529,336 | 36 | 36A,Eastbound
6107,9829,Steeles Ave East at Strawberry Hills Dr,43.829662,-79.280495,353 | 53A | 53B,Eastbound
6108,6194,The Westway at Kipling Ave East Side,43.68565,-79.554169,52 | 52G,Eastbound
6109,9051,Yonge St at Sherwood Ave,43.713409,-79.39965,320 | 320A | 320S | 97A | 97B,Northbound
6110,7761,Finch Ave West at Weston Rd West Side,43.752093,-79.542932,336 | 36B,Westbound
6111,6218,Albion Rd at Bankfield Dr South Side,43.73072,-79.554499,118 | 73,Southbound
6112,8910,Woodbine Ave at Cassels Ave,43.678748,-79.309809,92,Northbound
6114,14276,2900 Warden Ave - Bridlewood Mall,43.799239,-79.31716,324 | 68,Southbound
6115,1987,The Donway West at Don Mills Rd,43.740692,-79.344717,162,Eastbound
6116,5483,Leslie St at Talwood Dr (South) South Side,43.738289,-79.357015,51,Southbound
6117,11570,Thistle Down Blvd at Kenhill Dr,43.741274,-79.553785,118,Eastbound
6118,11077,Carrier Dr at Albion Rd,43.745809,-79.614347,96A | 96D | 96S,Southbound
6119,6597,Middlefield Rd at Richmond Park Blvd,43.814165,-79.259442,130A | 130B,Northbound
6121,4665,Tapscott Rd at Washburn Way,43.804389,-79.2244,131 | 134 | 134D,Eastbound
6122,607,161 Bridgeland Ave,43.72518,-79.46476,47B,
6123,2526,Finch Ave East at Markham Rd,43.813199,-79.242764,134B | 339 | 39 | 939C,Westbound
6124,8516,Victoria Park Ave at Tempo Ave,43.806522,-79.337577,24,Southbound
6125,8677,546 The West Mall,43.651651,-79.569908,112,Southbound
6126,9647,Brimley Rd at St Clair Ave East,43.721067,-79.241646,12A | 12B | 12S | 302,Southbound
6127,657,Broadview Ave at Mortimer Ave North Side,43.684347,-79.356745,100A | 25A | 25B | 322 | 8 | 87A | 87C,
6128,13962,Roywood Dr at Fortrose Cres (East),43.765953,-79.326021,122,Westbound
6130,4179,King St West at Niagara St,43.642987,-79.407539,304 | 504 | 504C | 508,Westbound
6131,7429,Victoria Park Ave at Terraview Blvd,43.764448,-79.317956,24A | 24B | 324,Northbound
6132,2632,1685 Finch Ave West - St Wilfreds School,43.760174,-79.503471,336 | 36 | 36A,Eastbound
6133,311,Bayview Ave at Post Rd North Side,43.736777,-79.381847,11A,
6134,6255,Berry Rd at Ballacaine Dr,43.635805,-79.495229,66,Westbound
6135,3035,Queen St East at Carlaw Ave,43.660953,-79.340208,301 | 501 | 503,Eastbound
6136,4945,Danforth Rd at Glenshephard Dr East West Side,43.731729,-79.250118,16 | 300B | 300S,Southwestbound
6137,11773,Parkside Dr at The Queensway North Side,43.639879,-79.45406,80A,Northbound
6138,163,Bathurst St at Laurelcrest Ave,43.74451,-79.435903,160 | 307 | 7,
6139,2165,Dundas St West at Gladstone Ave,43.649633,-79.429626,505,Westbound
6140,3438,Cliff St at Cordella Ave,43.679451,-79.484146,161 | 161S,Northbound
6141,14107,Staines Rd at Warbler Cir,43.82671,-79.221682,133 | 353 | 53A | 939C | 953A,Southbound
6142,6695,Pharmacy Ave at Donside Dr North Side,43.70172,-79.287305,67A | 67B,Northbound
6143,3808,Islington Ave at The Kingsway North Side,43.668756,-79.533874,337 | 37A | 37B,Northbound
6145,328,Bayview Ave at York Mills Rd,43.747851,-79.383934,11A,
6146,757,Carlton St at Parliament St,43.664144,-79.36819,306 | 506,
6147,3665,Glencairn Station,43.709467,-79.441148,14,Eastbound
6148,1147,Highview Ave at South Edgely Ave,43.700554,-79.262195,20,Eastbound
6149,1358,Milner Ave at Executive Crt,43.786435,-79.242431,132,Eastbound
6150,1500,Opposite 580 Rathburn Rd - Seneca School,43.650602,-79.581583,48,Eastbound
6151,666,Burnhamthorpe Rd at Ashbourne Dr,43.649315,-79.54632,50,
6152,391,Birchmount Rd at Cass Ave,43.779043,-79.297223,17,
6153,2212,The East Mall at Keane Ave North Side,43.649208,-79.560313,111,Northbound
6154,241,Bay St at Davenport Rd,43.672664,-79.390611,19,
6155,717,Caledonia Rd at Glencairn Ave,43.704493,-79.464646,47B | 47C,
6156,6135,St Clair Ave East at Pharmacy Ave West Side,43.709892,-79.291396,8,Westbound
6157,9368,McCowan Rd at Finch Ave East,43.80821,-79.266727,129 | 302,Southbound
6159,3492,Dundas St West at Chestnut Hills Cres,43.653186,-79.524855,40A,Southwestbound
6160,7275,Sheppard Ave West at Dufferin St - Sheppard West Station,43.750543,-79.462607,106 | 107A | 107B | 107D | 108A | 108B | 384 | 84A | 84C | 84D,Westbound
6161,1366,115 Milner Ave,43.784655,-79.248371,132,Eastbound
6162,9552,Murison Blvd at Breckon Gate,43.799756,-79.206259,132,Westbound
6163,2147,Dundas St West at Beverley St,43.653887,-79.393723,505,Westbound
6164,11167,The Esplanade at Lower Sherbourne St,43.649115,-79.367145,121,Westbound
6165,1497,Rathburn Rd at Remington Dr,43.660612,-79.539257,48,Eastbound
6166,223,Bathurst St at Wilson Ave,43.737575,-79.434232,7,
6167,7032,Royal York Rd at Thompson Ave,43.641883,-79.509219,15 | 315 | 76A | 76B | 76C,Southbound
6171,895,Danforth Ave at Jones Ave,43.679738,-79.340249,300A | 300B | 300S,
6173,6722,Pharmacy Ave at Lawrence Ave East,43.743024,-79.304422,67A,Northbound
6174,13672,Bathurst St at Fort York Blvd,43.638684,-79.400466,511,Northbound
6175,1481,Rathburn Rd at Haliburton Ave,43.658996,-79.546523,48,Eastbound
6177,11044,Kipling Ave at Finch Ave West,43.743452,-79.582397,45 | 945,Southbound
6178,13445,Lambton Ave at Guestville Ave,43.683172,-79.488786,71,Westbound
6179,9659,Graydon Hall Dr at Don Mills Rd,43.761915,-79.346799,122,Westbound
6180,4646,Symington Ave at Antler St,43.663834,-79.450371,168,Northbound
6181,4286,Kipling Ave at Belfield Rd - Etobicoke North GO Station,43.705019,-79.563774,45 | 945,Southbound
6182,82,Bathurst St at Ardmore Rd South Side,43.693576,-79.422648,307 | 7,
6183,8626,Wellesley St East at Church St,43.66561,-79.381083,94,Eastbound
6185,9550,715 Milner Ave,43.796774,-79.206658,132,Eastbound
6186,8383,Underhill Dr at Doonaree Dr South Side,43.745369,-79.32597,91 | 91D,Southbound
6189,2493,Finch Ave East at Bridletowne Circle (East),43.797371,-79.312495,339 | 39A | 39B,Eastbound
6191,17,Anglesey Blvd at Royal York Rd,43.665778,-79.519819,48,
6192,7592,Carluke Cres at Fifeshire Rd (East) West Side,43.760717,-79.388601,78,Westbound
6193,9159,1121 Leslie St,43.722327,-79.348968,51 | 54A | 54B,Northbound
6195,563,Bloor St West at Palmerston Blvd,43.664504,-79.413751,300A | 300B | 300S,
6196,1918,Don Mills Rd at Cliffwood Rd (South),43.804969,-79.354936,25A | 25C | 325,Southbound
6198,7567,Brookbanks Dr at Valley Woods Rd,43.752304,-79.331617,91C | 91D,Westbound
6199,3201,Woodbine Ave at Milverton Blvd,43.689268,-79.314445,91 | 91D | 93,Southbound
6200,945,Davenport Rd at Lightbourn Ave,43.672478,-79.443566,127,
6201,3779,Islington Ave at Duncanwoods Dr North Side,43.754994,-79.568713,337 | 37B | 937,Northbound
6202,926,Davenport Rd at Avenue Rd,43.674582,-79.396689,19,
6203,2896,McNicoll Ave at Mogul Dr,43.800092,-79.351105,42,Westbound
6204,11054,Crosby Ave at Varsity Rd,43.662023,-79.499594,55,Northeastbound
6206,8550,Warden Ave at Cloverleaf Gate,43.773195,-79.305546,68,Southbound
6207,3953,Keele St at Arrowsmith Ave,43.704338,-79.477212,341 | 41,Southbound
6208,1831,Danforth Ave at August Ave,43.692909,-79.281089,113 | 20 | 300A | 300B | 300S,Westbound
6209,11073,McNicoll Ave at Morbank Dr,43.809319,-79.308617,42,Westbound
6210,2109,101 Duncan Mill Rd,43.761629,-79.355567,122,Eastbound
6211,307,Bayview Ave at McKee Ave,43.778139,-79.390729,11,
6212,6191,The Westway at Islington Ave,43.688783,-79.542618,52G,Westbound
6213,426,Birchmount Rd at Huntingwood Dr,43.790601,-79.302489,17,
6214,3396,Calvington Dr at Lexfield Ave,43.730029,-79.499106,120,Eastbound
6215,5713,Midland Ave at Lawrence Ave East,43.751707,-79.265301,57,Southbound
6216,1516,Royal York Rd at Kingsgrove Blvd,43.653862,-79.514294,48 | 73,Southbound
6217,6110,St Clair Ave East at Hodder St,43.706615,-79.30791,8,Westbound
6218,2159,Dundas St West at Dovercourt Rd,43.649513,-79.424553,505,Westbound
6219,5774,Mortimer Ave at Dewhurst Blvd,43.686947,-79.342315,62,Eastbound
6220,10236,Maybrook Dr at Passmore Ave,43.827861,-79.261674,130B | 42A,Northbound
6222,4084,Kennedy Rd at Flora Dr,43.748488,-79.274791,343 | 43,Southbound
6223,5778,Mortimer Ave at Dunkirk Rd,43.691303,-79.323192,62,Westbound
6225,2066,Dufferin St at King St West,43.638781,-79.427202,29 | 329 | 329S | 929,Northbound
