stop_id,stop_code,stop_name,stop_lat,stop_lon,Routes,Direction
28636,16092,Yonge St at Castlefield Ave South Side,43.711635,-79.399535,320 | 97A | 97B,
28637,16094,Yonge St at Carlton St North Side - College Station,43.661798,-79.383158,320 | 320A | 320S | 97C,
28638,16095,Bathurst St at Timberlane Dr,43.748461,-79.43666,160 | 307 | 7,
28641,16127,Durnford Rd at Durness Ave,43.800394,-79.150948,95A,
28642,16128,Durnford Rd at Tallpines Park South Side,43.798663,-79.150156,95A,
28643,16190,Islington Ave at Dundas St West South Side,43.650745,-79.526258,337 | 37 | 937,
28646,16194,Opposite 3574 Eglinton Ave West,43.686262,-79.492179,32 | 32D | 32S | 332,
28647,16195,3574 Eglinton Ave West,43.68642,-79.49232,32A | 32D | 332,
30146,16233,Sheppard Ave West at Quilter Rd,43.759994,-79.418241,384 | 84A | 84C | 84D | 98,
30147,16232,Sheppard Ave West at Pewter Rd,43.759662,-79.418889,384 | 84 | 98,
30148,16238,Murray Ross Pkwy at Columbia Gate,43.766223,-79.494362,341 | 41,
30149,16239,Hollinger Rd at Dohme Ave,43.712661,-79.314332,91C | 91D,
30150,16240,Sheppard Ave West at Sentinel Rd,43.743701,-79.491195,106 | 108B | 384 | 84 | 984,
30151,16243,Eglinton Ave West at Jane St West Side,43.68446,-79.499316,32A | 32D | 332,
30152,16245,The Queensway at Algie Ave,43.618966,-79.536056,80,
30153,16246,The Queensway at Algie Ave East Side,43.618841,-79.535733,80A | 80B,
30764,15080,Spadina Station at Bus Bay 3,43.66732,-79.403612,510 | 510B,bound
30810,16247,Steeles Ave East at Midland Ave East Side,43.825932,-79.296916,353 | 53A | 53B | 953A,
30811,16248,Kipling Ave at Rowntree Rd North Side,43.751231,-79.585822,45A | 945,
31490,16249,Dynamic Dr at Passmore Ave South Side,43.829556,-79.253438,42A,
31491,16250,Lawrence Ave East at Centennial Rd East Side,43.777376,-79.146048,354 | 54A | 954,
31492,16251,Morning Star Dr at Goreway Dr,43.720611,-79.642243,52B,
31493,16253,Old Stock Yards Rd at West Toronto St,43.669401,-79.470176,189,
31494,16254,West Toronto St at Old Stock Yards Rd,43.669375,-79.46984,189,
31495,16252,Morningside Ave at Passmore Ave - Amazon Fulfillment Centre,43.835793,-79.242093,102 | 102B | 102C | 102S | 53 | 53B | 902 | 902S | 953 | 953A,
31496,16255,Steeles Ave East at Morningside Ave,43.838216,-79.243873,353 | 53A,
31497,16256,Morningside Ave at Passmore Ave,43.833489,-79.241136,102B | 102C | 53B | 953 | 953A,
32129,5996,Parliament St at Mill St,43.650273,-79.36228,365 | 65,Southbound
32179,16257,Scarlett Rd at Eglinton Ave West North Side,43.684511,-79.511722,79A | 79B,
32180,12545,Kingston Rd at Ellesmere Rd,43.793758,-79.154476,95 | 95S,Southwestbound
32181,12544,Kingston Rd at Ellesmere Rd,43.793856,-79.153976,95A,Northeastbound
32182,16259,Bay St at Scollard St,43.672256,-79.39068,19,
32183,16260,Yonge St at Gould St,43.65756,-79.381539,320 | 97C,
32185,16263,Jack Layton Way at Blue Rodeo Dr,43.666089,-79.353523,121,
32877,16265,Dynamic Dr at McNicoll Ave North Side,43.823692,-79.251527,102C,
32892,16281,Castlemore Ave at Hammersly Blvd,43.90365,-79.270447,102D,
33545,16282,40 Rivalda Rd,43.737767,-79.535136,384 | 84 | 84A,
33546,16286,Bartor Rd at 2233 Sheppard Ave West,43.731343,-79.526097,119,
34741,9919,Princes Blvd at Ontario Dr,43.6326,-79.4199,29C | 329,Eastbound
34744,14371,Lower Sherbourne St at Queens Quay East,43.645353,-79.365679,75,Southbound
34797,16280,326 Humber College Blvd,43.736751,-79.610184,96A,
34800,16284,Princes' Blvd at Ontario Dr,43.632147,-79.419285,29 | 329 | 329S,
34801,16285,Nova Scotia Ave at Manitoba Dr,43.635203,-79.41849,29C | 329,
34802,16287,Midland Ave at Finch Corridor Trail South Side,43.812339,-79.291329,57,
34803,16288,Midland Ave at Finch Corridor Trail,43.812554,-79.291229,57,
34804,16325,Cummer Ave at Snowcrest Ave (West),43.793775,-79.387673,42,
34805,16326,Cummer Ave at Beardmore Ave,43.794806,-79.382857,42,
34809,5815,Mt Pleasant Rd at Eglinton Ave East,43.708562,-79.390321,74,Southbound
35455,15444,Carlaw Ave at Langley Ave,43.669636,-79.34346,325 | 325S | 72 | 72S,Northbound
35458,16327,St Clair Ave East at Marilyn Cres West Side,43.704919,-79.316768,93,
35459,16332,Eglinton Ave East at Mount Pleasant Rd,43.708284,-79.390426,334 | 334S | 34A | 34C | 354 | 51 | 54A | 54B | 56,
35467,14368,Opposite 35 Carl Hall Rd,43.747125,-79.479171,101,Westbound
36072,15318,Wilson Station at Bus Bay 4,43.734937,-79.451122,165,bound
36109,16129,Locust Lodge Gardens at Stanley Greene Blvd,43.733692,-79.477866,101 | 128,
36110,16130,Downsview Park Blvd at Stanley Greene Blvd,43.73611,-79.479303,101 | 128,
36111,16131,Stanley Greene Blvd at Downsview Park Blvd,43.736155,-79.479067,101 | 128,
36112,16132,Keele St at Whitburn Cres South Side,43.736581,-79.484577,128,
36117,16335,Scarborough Centre Station at Bus Bay 8,43.774807,-79.256381,38A | 38B | 938,
36121,16341,Kingston Rd at Highland Creek Overpass,43.78471,-79.16865,86 | 986,
36122,16339,Eglinton Ave East at South Service Rd East Side,43.732759,-79.265317,116 | 12A | 12B | 20 | 21C | 300B | 300S | 334 | 57 | 86A | 86C | 86D,
36123,16340,South Service Rd at Eglinton Ave East East Side,43.732365,-79.265629,334 | 334S | 343 | 43,
36125,16344,Keele St at Downsview Park Blvd North Side,43.737298,-79.484528,101,
36126,16345,Downsview Park Trail at Downsview Park Station,43.753599,-79.477497,101,
36127,16346,Carl Hall Rd at Centennial College,43.747945,-79.475307,101,
36128,2414,Eglinton Ave West at Trethewey Dr/Keele St,43.690375,-79.474368,32A | 32C | 32D | 332,Westbound
36134,,CD-LESC,43.658545,-79.32556,,
36760,,LESLIE BARNS,43.657496,-79.325886,,
36777,16333,Scarborough Centre Station at Bus Bay 6,43.774771,-79.256867,904,
36778,16334,Scarborough Centre Station at Bus Bay 7,43.774789,-79.256643,133,
36780,16347,Milner Ave at Markham Rd East Side,43.789622,-79.236396,902,
36785,803,Church St at Richmond St East,43.652637,-79.375624,301 | 501,
37368,14764,Scarborough Centre Station at Bus Bay 5,43.774583,-79.257626,129A | 129B,bound
37421,16351,The Queensway at Milton St,43.627673,-79.496938,80,
37422,16353,Lawrence Ave East at Tremont Cres (East) East Side,43.73577,-79.34961,162 | 54A | 54B,
37424,12314,Church St at Queen St East,43.653061,-79.375613,301 | 501, Eastbound
37426,16355,Willowdale Ave at Spring Garden Ave,43.766461,-79.400824,98 | 98B,
37427,16356,O'Connor Dr at Coxwell Ave,43.697862,-79.329357,8,
38651,15063,Leslie St at Queen St East,43.662722,-79.329892,31,Northbound
38652,15064,Eastern Ave at Knox Ave,43.662595,-79.325198,31,Westbound
38653,15066,Eastern Ave at Woodfield Rd,43.663677,-79.320465,31,Westbound
38654,15067,Eastern Ave at Woodfield Rd,43.663516,-79.320615,31,Eastbound
38658,15240,Eastern Ave at Leslie St,43.661646,-79.329382,31,Westbound
38701,16241,St. Albans Rd at West Service Rd,43.639095,-79.534199,40A | 45A,
38704,16331,Eglinton Ave W at Yonge St,43.706643,-79.398574,332,
38709,12415,Eastern Ave at Coxwell Ave,43.665602,-79.316143,31,Westbound
38713,16362,Finch Ave West at Wilmington Ave West Side,43.770093,-79.46177,104,
38714,16363,Wilmington Ave at Maxwell St,43.765417,-79.458211,104,
38715,16364,Wilmington Ave at Artisan Dr,43.765354,-79.45841,104,
38716,16365,Bayview Ave at Eglinton Ave East,43.711198,-79.377293,11,
39365,16144,Leslie St at Overland Dr North Side,43.730017,-79.353875,51 | 54A | 54B,
39366,16149,Overland Dr at Papebirch Dr East,43.732364,-79.348477,162 | 162S,
39367,16200,Eglinton Ave West at Chaplin Cres East Side,43.702758,-79.416849,32 | 332,
39368,16201,Eglinton Ave West at Gilgorm Rd,43.702919,-79.416849,32A | 32C | 32D | 332,
39371,16283,Carlaw Ave at Lake Shore Blvd East,43.654704,-79.337093,72 | 72S,
39375,16367,Dufferin St at Eglinton Ave West,43.695556,-79.450105,29 | 329 | 329S | 929,
39376,16369,Finch Ave East at Tapscott Rd East Side,43.814291,-79.236357,134B | 339 | 39A | 39B | 939C,
39377,16368,Finch Ave East at Tapscott Rd West Side,43.81414,-79.23788,134B | 339 | 39 | 939C,
39381,3413,Chaplin Cres at Eglinton Ave West North Side,43.703026,-79.417896,14,Northwestbound
39382,8420,Vaughan Rd at St Clair Ave West,43.682997,-79.420583,90,Southbound
40023,15283,Coxwell Station at Bus Bay 3,43.684049,-79.323051,31,bound
40031,16380,Cordova Ave at Central Park Roadway,43.647913,-79.527061,40A,
40032,15306,St Clair Station at Lower Platform Bus Bay 4,43.68768,-79.392714,74 | 74A,bound
40036,16381,Kennedy Station at Bus Bay 11,43.731826,-79.264047,903A | 903B | 904 | 939A | 939B | 939S,
40037,16385,Bloor St W at Brule Terrace,43.647735,-79.489765,149 | 300A | 300B | 300S,
40038,16386,Bloor St W at Brule Terrace,43.647842,-79.489342,149 | 300A | 300B | 300S,
40040,16388,Yonge St at King St East,43.649485,-79.378003,97C,
40044,,CD-RONC,43.639444,-79.447778,,
41036,16330,Eglinton Ave W at Blackthorn Ave West Side,43.691944,-79.465697,32A | 32C | 32D | 332,
41040,16373,Kennedy Rd at Lawrence Ave East East Side,43.749958,-79.274988,129A | 129B | 131 | 133 | 38A | 38B | 903A | 903B | 904 | 938 | 939A | 939B | 939S,
41041,16374,Ellesmere Rd at Midland Ave East Side,43.767989,-79.270397,129A | 129B | 131 | 133 | 38A | 38B | 903A | 903B | 904 | 938 | 939A | 939B | 939S,
41042,16375,Midland Ave at Ellesmere Rd South Side,43.767469,-79.271159,129 | 131 | 133 | 38A | 38B | 903A | 903B | 904 | 938 | 939A | 939B,
41043,16376,Midland Ave at Lawrence Ave East South Side,43.750766,-79.265001,129 | 131 | 133 | 154 | 38A | 38B | 903A | 903B | 904 | 938 | 939A | 939B | 954,
41044,16377,Kennedy Rd at Ellesmere Rd North Side,43.766455,-79.281124,343 | 43A | 43B | 43C,
41045,16378,Brimley Rd at Ellesmere Rd,43.769818,-79.261129,21C,
41047,16390,Kennedy Station at Bus Bay 12 (Platform B),43.731978,-79.263574,133 | 334 | 334S | 38A | 38B | 938,
41048,16391,Kennedy Station at Bus Bay 13 (Platform B),43.732014,-79.263424,113 | 131 | 20 | 300B | 300S,
41049,16392,Kennedy Station at Bus Bay 14 (Platform B),43.732067,-79.263249,21C | 334 | 334S | 57,
41050,16398,Lawrence Ave West at Avenue Rd East Side,43.722297,-79.415066,124 | 162,
41052,16402,The Queensway at Glendale Ave - St Joseph's Health Centre,43.639553,-79.451838,301 | 501 | 508,
41053,16403,Marine Parade Dr at Silver Moon Dr,43.624651,-79.477619,66 | 66B | 80 | 80S,
41054,16404,Lawrence Ave West at Avenue Rd West Side,43.722216,-79.416162,52A | 52B | 52D | 52F | 952,
41683,16406,Bloor St West at Royal York Rd,43.647491,-79.511164,149 | 300A | 300B | 300S,
41684,16407,Bloor St West at Prince Edward Dr,43.648823,-79.505278,149 | 300A | 300B | 300S,
41685,16408,Bloor St West at The Kingsway West Side,43.650065,-79.499803,149 | 300A | 300B | 300S | 66A | 66B,
41686,16422,Middlefield Rd at Select Ave North Side,43.829747,-79.266431,130A | 130B,
41687,16423,Middlefield Rd at Select Ave South Side,43.82903,-79.26632,130A | 130B,
42316,16424,Dundas St West at Wimbleton Rd,43.657052,-79.520184,40A,
42319,16393,Kennedy Station at Bus Bay 15 (Platform B),43.731996,-79.262851,129 | 129A | 129B,
42320,16394,Kennedy Station at Bus Bay 16 (Platform B),43.731861,-79.262789,343 | 43 | 43A | 43B | 43C,
42323,16425,4425 Chesswood Dr,43.76146,-79.477471,107B | 107D,
42324,16426,4425 Chesswood Dr,43.76154,-79.477658,107A,
42325,12338,College St at Augusta Ave,43.657485,-79.403078,506,Westbound
42328,16429,Queen St West at Roncesvalles Ave East Side,43.638812,-79.445427,301 | 501,
42329,16444,Keele St at Paxtonia Blvd North Side,43.729457,-79.482646,120 | 128 | 341 | 41,
42330,16453,Kennedy Station Drop-off Platform,43.732229,-79.263511,113 | 129 | 131 | 133 | 154 | 20 | 21C | 38A | 38B | 43 | 57 | 86 | 903A | 903B | 904 | 938 | 939A | 939B,
42331,2340,Eglinton Ave West at Dufferin St,43.69558,-79.450496,32 | 32D | 32S | 332,Eastbound
42336,7258,Sheppard Ave East at Yonge St,43.761655,-79.410599,185 | 385 | 98 | 98B,Westbound
42337,15964,Eglinton Ave West at Black Creek Dr,43.688535,-79.482595,32A | 32D | 332,Westbound
42339,16436,Commissioners St at New Cherry St East Side,43.644957,-79.353119,114,
42340,16437,Commissioners St at Cherry St West Side,43.645226,-79.352883,114,
42341,16432,New Cherry St at Lake Shore Blvd East,43.648354,-79.35633,114,
42342,16433,New Cherry St at Lake Shore Blvd East South Side,43.648372,-79.356591,114,
42343,16434,New Cherry St at Commissioners St North Side,43.645244,-79.353854,114,
42344,16439,Commissioners St at Munition St,43.646821,-79.349272,114,
42345,16441,Commissioners St at Don Roadway East Side,43.648702,-79.344429,114,
42346,16443,Commissioners St at Don Roadway,43.648791,-79.344715,114,
42347,16449,Commissioners St at Munition St,43.646167,-79.350318,114,
42348,16452,King St West at The Queensway,43.638355,-79.445925,508,
42349,16454,Bathurst St at Nassau St - Toronto Western Hospital,43.654724,-79.406874,307 | 511,
42351,16460,Black Creek Dr at Eglinton Ave West,43.68857,-79.483056,171 | 71,
42354,16482,Bloor St West at Acorn Ave,43.640547,-79.541534,300A | 300B | 49,
42356,16484,Beecroft Rd at Sheppard Ave West North Side,43.761367,-79.413167,384 | 84 | 984,
42357,16485,Don Mills Rd at Van Horne Ave South Side,43.786746,-79.353082,10 | 169A | 25A | 25C | 325 | 925,
42358,16486,Commissioners St at Bouchette St East Side,43.650779,-79.339548,114 | 72 | 72S,
42360,2341,Eglinton Ave West at Dufferin St,43.695788,-79.450072,32A | 32C | 32D | 332,Westbound
42362,14635,Broadview Station at Bus Bay 2,43.677011,-79.358044,100A,bound
42363,9951,Bathurst Street at St Clair Avenue West,43.682754,-79.41807,307 | 7 | 90,Northbound
42364,15887,Centennial College Bus Terminal,43.785912,-79.229343,102 | 102A | 902,bound
42366,16463,Victoria Park Ave at Conroy Ave,43.701697,-79.293013,24 | 24B | 324,
42367,16487,Ossington Ave at Salvador Allende Ct,43.672291,-79.430031,363 | 363S | 63,
42368,16488,Davenport Rd at Bartlett Ave North,43.673829,-79.438152,127,
42369,16489,Davenport Rd at Bartlett Ave North,43.673605,-79.438438,127,
42371,16520,Queen St East at Wineva Ave East Side,43.671048,-79.295031,301 | 501,
42372,16521,Pape Ave at Lipton Ave,43.679709,-79.345236,72C,
42373,16524,300 Bay St,43.649243,-79.380617,19,
42374,16525,Park Lawn Rd at Gardiner Expressway (Eb Off ramp),43.626024,-79.486183,66,
42375,16526,Lawrence Ave East at Elinor Ave,43.743935,-79.300902,354 | 54A | 54B,
42376,16527,Lawrence Ave East at Townley Ave,43.742522,-79.30756,354 | 54A | 54B,
42377,16528,Lawrence Ave East at Elinor Ave,43.744212,-79.300378,354 | 54,
42384,15070,Spadina Ave at Bremner Blvd,43.640523,-79.39274,310 | 510,Northbound
42385,15072,Spadina Ave at Richmond St West,43.647754,-79.395729,310 | 510,Northbound
42386,15073,Spadina Ave at Nassau St,43.65581,-79.398906,310 | 510,Northbound
42387,15074,Spadina Ave at Willcoks St,43.661268,-79.401112,310 | 510,Northbound
42388,15075,Spadina Ave at Sussex Ave,43.664619,-79.402445,310 | 510,Northbound
42389,15076,Spadina Ave at Willcocks St,43.661321,-79.40171,310 | 510B,Southbound
42390,15077,Spadina Ave at Sullivan St,43.650935,-79.397498,310 | 510B,Southbound
42391,15078,Spadina Ave at King St West,43.645496,-79.395355,310 | 510B,Southbound
42392,15079,Spadina Station at Bus Bay 1,43.667383,-79.403837,510,bound
42393,13156,Spadina Ave at College St,43.658024,-79.400339,310 | 510B,Southbound
42394,13155,Spadina Avenue at College Street,43.657898,-79.399741,310 | 510,Northbound
42395,13157,Spadina Ave at Dundas St West,43.652844,-79.397885,310 | 510,Northbound
42396,13158,Spadina Ave at Dundas St West,43.652988,-79.398159,310 | 510B,Southbound
42397,13160,Spadina Ave at Harbord St,43.663078,-79.402395,310 | 510B,Southbound
42398,13162,Spadina Ave at Nassau St,43.65598,-79.399529,310 | 510B,Southbound
42399,13163,Spadina Ave at Queen St West,43.648722,-79.396103,310 | 510,Northbound
42400,13164,Spadina Ave at Queen St West,43.648785,-79.396651,310 | 510B,Southbound
42401,13165,Spadina Ave at Sullivan,43.650864,-79.396963,310 | 510,Northbound
42402,15082,Spadina Ave at Bloor St West,43.666549,-79.403577,310 | 510,Northbound
42404,15139,Queens Quay West at Lower Spadina Ave,43.637781,-79.391731,310,Westbound
42405,15397,Spadina Ave at Harbord St North Side,43.6634,-79.402109,310 | 510,Northbound
42406,15960,Eglinton Ave East at Victoria Park Ave,43.724594,-79.30288,334 | 334S | 34A | 34B | 91D,Eastbound
42407,15965,Eglinton Ave East at Leslie St,43.716868,-79.350353,334 | 334S | 34A | 34C | 354,Eastbound
42408,16123,Eglinton Ave East at Donlea Dr,43.711708,-79.373605,334 | 334S | 34A | 34C | 354 | 51 | 54A | 54B | 56,
42409,16522,Jane St at Bloor St West (Jane Station),43.649468,-79.484652,335 | 35A | 35B | 935,
42410,16523,Jane St at Folkes St (Jane Station),43.651215,-79.485364,26 | 55,
42411,16529,McCowan Rd at 300 Consilium Pl,43.778273,-79.253643,129A | 129B | 130A | 130B | 131 | 132 | 134B | 134D | 169A | 169B | 302,
42412,16530,Spadina Ave at Front St West,43.642856,-79.394194,310 | 510B,
42413,16533,Spadina Ave at Sussex Ave South Side,43.66432,-79.402783,310 | 510B,
42414,16532,Rees St at Lake Shore Blvd West South Side,43.639185,-79.386836,310,
42415,16534,Lower Simcoe St at Queens Quay West North Side,43.639884,-79.382853,310,
42416,16535,Queens Quay West at Lower Simcoe St,43.639669,-79.382583,310,
42417,16536,Queens Quay West at Rees St,43.638954,-79.386457,310,
42418,16537,Dan Leckie Way at Queens Quay West,43.636777,-79.396872,510B,
42419,16539,Eglinton Ave East at Sinnott Rd,43.729455,-79.280578,334 | 34 | 34B,
42420,16540,Bayview Ave at Broadway Ave,43.713761,-79.377455,11A | 11C,
42421,16541,Cummer Ave at Becky Cheung Ct,43.789093,-79.408279,42,
42422,16542,Thorncliffe Park Dr at Pat Moore Dr,43.709482,-79.344724,88B,
42427,16546,Avenue Rd at Elgin Ave,43.672193,-79.395636,13A | 13B,
42430,13161,Spadina Ave at King St West,43.645425,-79.394795,310 | 510,Northbound
42433,15330,Don Mills Station at Bus Bay 13,43.775799,-79.346887,10,bound
42434,15982,Lake Shore Blvd West at Mimico Ave,43.613243,-79.489484,76 | 76A | 76S,Northeastbound
42436,16547,Orton Park Rd at Brimorton Dr North Side,43.771689,-79.208772,154,
42437,16548,Orton Park Rd at Brimorton Dr,43.771528,-79.208885,154,
42438,16549,Orton Park Rd at Botany Hill Rd North Side,43.776667,-79.210855,154,
42439,16550,Orton Park Rd at Slan Ave,43.776344,-79.210906,154,
42440,16551,Opposite 350 Orton Park Rd - Henry Hudson Senior Public Scho,43.778393,-79.214954,154,
42441,16552,350 Orton Park Rd - Henry Hudson Senior Public School,43.778249,-79.214892,154,
42442,16553,Orton Park Rd at Ellesmere Rd,43.779623,-79.216997,154,
42443,16554,Orton Park Rd at Ellesmere Rd South Side,43.779426,-79.217085,154,
42444,16555,The Queensway and Penhurst Ave,43.626693,-79.500682,76B | 80A,
42445,16556,Lansdowne Ave at Paton Rd North Side,43.660913,-79.443619,47A | 47B | 47C,
42446,15289,Greenwood Station at Bus Bay 1,43.682447,-79.330264,31,bound
42454,15807,Birchmount Rd at McNabb St South Side,43.834783,-79.319487,17,Southbound
42455,15854,Varsity Rd at Grandpark Crt North Side,43.661584,-79.498468,55,Northwestbound
42456,16471,73 Railside Rd,43.736856,-79.323371,91D,
42457,16472,74 Railside Rd,43.736946,-79.323521,91D,
42458,16558,1775 Weston Rd,43.699172,-79.513271,89,
42459,13134,Rathburn Rd at Martin Grove Rd,43.657072,-79.555617,48,Westbound
42460,16572,Davenport Rd at Bathurst St,43.676768,-79.416336,127,
42461,16573,138 Bellamy Rd North,43.742109,-79.230061,9,
42462,16574,7075 Markham Rd,43.837999,-79.251101,102D,
42463,16575,Birchmount Rd at Aviva Way,43.847793,-79.323845,17A,
42464,15304,St Clair Station at Bay 1,43.687832,-79.392913,,bound
42465,16578,Adelaide St West at Yonge St,43.650274,-79.378551,301 | 501,
42474,16187,Mt Pleasant Rd at Ranleigh Ave,43.728727,-79.397845,74,
42475,16188,Mt Pleasant Rd at Roslin Ave,43.730537,-79.398531,74,
42476,16189,Mt Pleasant Rd at Snowdon Ave,43.732151,-79.399155,74,
42477,16620,Broadview Ave at Don Valley Dr North Side,43.690789,-79.355308,100A | 25A | 25B | 8,
42478,16621,Broadview Ave at Don Valley Dr,43.690627,-79.35537,100A | 25A | 25B | 8,
42479,16622,O'Connor Dr at Beechwood Dr East Side,43.692697,-79.352853,100A | 25A | 25B | 8,
42480,16623,O'connor Dr at Hopedale Ave,43.692948,-79.352006,100A | 25A | 25B | 8,
42481,16624,John Garland Blvd at Jamestown Cres West,43.732561,-79.586226,96A | 96D,
42482,16625,John Garland Blvd at Jamestown Cres East,43.733749,-79.582677,96A | 96D | 96S,
42483,16626,Eglinton Ave East at Ionview Rd West Side,43.731393,-79.271701,334 | 34 | 34B,
42484,6473,Islington Ave at Rexdale Blvd,43.714779,-79.555145,337 | 37 | 937,
42485,16627,327 Kipling Avenue,43.59965,-79.517464,110C | 110S,
42486,16628,Birmingham St at Fourteenth St,43.601625,-79.513487,110C | 110S,
42487,16629,Birchmount Rd at Aviva Way,43.847649,-79.324058,17,
42488,16630,Eglinton Ave West at Heddington Ave,43.703386,-79.413996,32 | 332,
42489,16631,Eglinton Ave West at Bicknell Ave (York Civic Ctr),43.689569,-79.477328,32 | 32D | 32S | 332,
42490,16633,Huntingwood Dr at Kimberdale Cres,43.787492,-79.307814,169A | 169B,
42491,16634,Huntingwood Dr at Kimberdale Cres West Side,43.787536,-79.307963,169A | 169B,
42492,16635,Huntingwood Dr at Harfleur Rd West Side,43.791082,-79.299726,169A | 169B,
42499,13874,Richmond St West at York St,43.650603,-79.38422,501,
42500,16644,160 York St,43.649868,-79.384448,501,
42502,16636,Warden Station at Temporary Bus Bay 1,43.709817,-79.280007,117 | 69,
42503,16637,Warden Station at Temporary Bus Bay 2,43.709925,-79.279858,17 | 17A | 17B | 17C | 17S,
42504,16639,Warden Station at Temporary Bus Bay 4,43.710364,-79.279471,117 | 135 | 69,
42505,16640,Warden Station at Temporary Bus Bay 5,43.710463,-79.280181,16 | 9,
42506,16641,Warden Station at Temporary Bus Bay 6,43.710553,-79.28033,102 | 102A | 102B | 102C | 102D | 902,
42507,16642,Warden Station at Temporary Bus Bay 7,43.710687,-79.280392,8,
42508,16643,Warden Station at Temporary Bus Bay 8,43.710795,-79.28043,68 | 68A | 68B | 968,
42509,9610,Bushby Dr at McCowan Rd East Side,43.774587,-79.251655,9 | 903A,
42510,16645,McCowan Rd at Town Centre Crt South Side,43.774229,-79.252204,133 | 16 | 302 | 38A | 38B,
42511,16646,McCowan Rd at Bushby Dr,43.774435,-79.252079,302,
42512,16647,Sheppard Ave East at Kenneth Ave,43.76301,-79.404502,185 | 385 | 98 | 98B,
42513,16648,Eglinton Ave West at Wincott Dr,43.678585,-79.545262,32A | 332,
1,7978,Millwood Rd at McRae Dr South Side,43.704652,-79.367698,88A,Eastbound
2,155,Bathurst St at Horsham Ave,43.768449,-79.441504,160 | 307 | 7,
3,1514,Royal York Rd at King Georges Rd,43.650225,-79.512691,48 | 73,Southbound
4,2593,Finch Ave West at Driftwood Ave,43.757924,-79.513523,336 | 36 | 36A,Eastbound
5,1231,Lawrence Ave East at Wanless Cres (West),43.727149,-79.392116,124 | 162 | 352,Eastbound
7,4090,Kennedy Rd at Huntingwood Dr,43.79502,-79.293198,343 | 43A,Northbound
8,9236,Shorncliffe Ave at Newbridge Rd South Side,43.625815,-79.542151,123B | 123C | 123D,Southbound
9,8611,Warden Ave at Tower Dr,43.754307,-79.298221,68A | 68B,Northbound
10,9248,Thirtieth St at Alhena Ave,43.602452,-79.532974,110B,Southbound
11,423,Birchmount Rd at Harvest Moon Dr,43.823801,-79.317854,17A,
12,3388,Brown's Line at Woodbury Rd,43.599389,-79.544276,110A | 123B | 123C | 315,Southbound
13,6713,Pharmacy Ave at Huntingwood Dr,43.781783,-79.32034,167A | 167B,Southbound
14,6743,Pharmacy Ave at Rosscowan Gate South Side,43.784997,-79.321745,167A | 167B,Southbound
16,8377,Underhill Dr at Broadlands Blvd,43.744031,-79.326011,91C | 91D,Northbound
17,4629,St Clair Ave East at Santamonica Blvd,43.712912,-79.276699,102A | 102B | 102C | 102D | 117 | 16 | 17A | 17B | 17C | 17S | 9,Eastbound
18,1999,Driftwood Ave at Finch Ave West,43.757895,-79.513233,108A | 108B,Northbound
19,6946,Rexdale Blvd at Martin Grove Rd,43.713759,-79.581288,37,Southeastbound
20,8813,Willowdale Ave at Northwood Dr,43.791424,-79.411164,98,Northbound
21,10763,Dovercourt Rd at Geary Ave North Side,43.671083,-79.433224,161,Northbound
22,9285,Drewry Ave at Marthon Cres (East),43.781792,-79.441105,125,Eastbound
23,3022,Post Rd at Bayview Ave East Side,43.736369,-79.381338,162,Eastbound
24,6864,Queens Quay West at Rees St West Side,43.63876,-79.387157,509,Westbound
25,11045,Albion Rd at Finch Ave West,43.741208,-79.588821,73C,Northwestbound
26,10239,Middlefield Rd at Passmore Ave,43.827006,-79.264802,130A,Northbound
29,2829,Lesmill Rd at Valleybrook Dr West Side,43.757793,-79.355475,122,Westbound
30,6445,Huntingwood Dr at Garrybrook Dr,43.789178,-79.30715,169A | 169B,Westbound
31,3471,Davenport Rd at Osler St,43.670383,-79.459172,127 | 168,Westbound
32,8939,Yonge Blvd at Dunster Ave North Side,43.739877,-79.413594,97B,Northwestbound
33,9654,185 Graydon Hall Dr,43.764226,-79.342218,122,Southbound
34,2241,Eglinton Ave East at Beachell St,43.742332,-79.222161,116 | 334 | 86A | 86B | 86C | 86D,Eastbound
35,3998,Keele St at Greenbrook Dr South Side,43.696812,-79.475456,341 | 41,Southbound
36,828,College St at Elizabeth St,43.660394,-79.387562,306 | 506,
37,4431,Le Page Crt at Keele St East Side,43.758093,-79.488998,107B | 107D,Eastbound
40,1180,Jones Ave at Baird Ave,43.676657,-79.338684,83,Northbound
42,2057,Dufferin St at Gordon St,43.646696,-79.430224,29 | 329 | 329S,Northbound
44,2441,Evans Ave at Gair Dr,43.610092,-79.551991,123B | 123C | 123D | 15 | 315,Westbound
45,2837,Longbourne Dr at Redgrave Dr,43.679218,-79.57013,111,Westbound
46,13916,Huntingwood Rd at Ridgecrest Dr,43.78437,-79.31528,169A | 169B,Eastbound
48,7734,Elmhurst Dr at Muncey Ave,43.724247,-79.55368,396 | 96A | 96B | 96D | 96S,Eastbound
50,2726,Islington Ave at Norseman St,43.634118,-79.51889,110A | 110B | 110C | 337,Northbound
51,12019,McNicoll Ave at Midland Ave,43.814437,-79.292415,42A,Eastbound
52,3191,Wilson Heights Blvd at Clifton Ave,43.75896,-79.463205,104,Southbound
53,6006,Progress Ave at Estate Dr (West),43.781041,-79.23775,134 | 134D,Westbound
54,9787,Steeles Ave East at Midland Ave,43.826099,-79.297089,353 | 53 | 953,Westbound
56,303,Bayview Ave at Hillcrest Ave,43.772666,-79.389534,11,
57,3174,Willowridge Rd at Richgrove Dr,43.675751,-79.568602,111,Southbound
