stop_id,stop_code,stop_name,stop_lat,stop_lon,Routes,Direction,Accessibility,Type
6452,6452,Huntingwood Dr at Kilkenny Dr East Side,43.783511,-79.31712,169,Eastbound,1,Bus
4336,4336,Kipling Ave at Learmont Dr,43.690196,-79.556942,45,Southbound,1,Bus
2904,2904,McNicoll Ave at Victoria Park Ave West Side,43.804006,-79.336971,42,Westbound,1,Bus
10575,10575,900 The East Mall,43.669572,-79.572436,111,Southbound,1,Bus
13560,13560,Danforth Ave at Donlands Ave,43.680298,-79.337426,300,Eastbound,1,Bus
13946,13946,Lake Shore Blvd West at First St,43.60214,-79.498592,301 | 501 | 507 | 508,Eastbound,1,Streetcar
2660,2660,Gordon Baker Rd at Victoria Park Ave West Side,43.810497,-79.340056,39,Eastbound,1,Bus
4030,4030,Keele St at Sheppard Ave West South Side,43.744425,-79.486485,101 | 341 | 41 | 941,Southbound,1,Bus
596,596,Bloor St West at The West Mall,43.635815,-79.562124,300 | 49,Westbound,1,Bus
5834,5834,Mt Pleasant Rd at Merton St,43.698396,-79.386638,74,Southbound,1,Bus
2590,2590,Finch Ave West at Chesswood Dr,43.766456,-79.477022,336 | 36,Eastbound,1,Bus
6677,6677,Pharmacy Ave at Christina Cres (South),43.760657,-79.310807,67,Northbound,1,Bus
3939,3939,Jane St at William Cragg Dr,43.72265,-79.509187,335 | 35,Southbound,1,Bus
10530,10530,4150 Midland Ave,43.823372,-79.29622,343 | 43 | 57,Southbound,1,Bus
5820,5820,Mt Pleasant Rd at Glengowan Rd,43.720724,-79.395167,103,Northbound,1,Bus
3651,3651,Glencairn Ave at Dufferin St,43.707171,-79.452667,14,Westbound,2,Bus
10011,10011,McCowan Rd at South Unionville Ave,43.861033,-79.28314,129,Northbound,1,Bus
7806,7806,Harbord St at Crawford St,43.659183,-79.420771,94,Eastbound,1,Bus
14297,14297,Barkdene Hills at Larwood Blvd,43.715589,-79.237791,69,Northbound,1,Bus
2643,2643,Finch Ave West at Weston Rd,43.752276,-79.542034,119 | 336,Westbound,1,Bus
335,335,Bedford Rd at Lowther Ave North Side,43.670643,-79.398208,26,Westbound,1,Bus
1159,1159,Hullmar Dr at Wheelwright Cres (East),43.773332,-79.524072,35,Southbound,1,Bus
2153,2153,Dundas St West at Chestnut St,43.655136,-79.386129,305 | 306 | 505 | 506,Eastbound,2,Streetcar
8512,8512,Victoria Park Ave at Surrey Ave North Side,43.736617,-79.307405,24 | 324,Northbound,1,Bus
8182,8182,St Clair Ave West at Russell Hill Rd West Side,43.685262,-79.408389,312 | 512,Westbound,1,Streetcar
9505,9505,46 Norelco Dr,43.765844,-79.534096,84,Eastbound,1,Bus
5161,5161,Lake Shore Blvd West at Twenty Ninth St,43.595809,-79.528185,301 | 501 | 507 | 508,Westbound,1,Streetcar
5702,5702,Midland Ave at Finch Ave East,43.803574,-79.286069,57,Northbound,1,Bus
5203,5203,Lake Shore Blvd West at Symons St,43.608629,-79.490452,301 | 501 | 507 | 508,Westbound,1,Streetcar
9042,9042,Yonge St at Rowanwood Ave,43.679043,-79.390286,320 | 97,Northbound,1,Bus
2730,2730,Islington Ave at Saybrook Ave,43.636325,-79.519856,110 | 337,Northbound,1,Bus
3466,3466,Davenport Rd at Laughton Ave,43.670202,-79.45596,127 | 168,Southbound,1,Bus
4790,4790,Avenue Rd at Melrose Ave,43.729983,-79.41884,61,Northbound,1,Bus
6004,6004,Princess Margaret Blvd at Martin Grove Rd,43.66642,-79.559225,46,Northbound,1,Bus
8311,8311,Steeles Ave West at Thurman Rd,43.791062,-79.452739,353 | 60 | 960,Eastbound,1,Bus
2915,2915,Midland Ave at Safari St,43.731156,-79.256788,20,Westbound,1,Bus
10241,10241,Maybrook Dr at Newmill Gate,43.825884,-79.261584,130,Southbound,1,Bus
2060,2060,Dufferin St at Holmesdale Rd,43.688777,-79.44751,29 | 329,Southbound,1,Bus
9744,9744,Barber Greene Rd at Overland Dr,43.731026,-79.350865,162,Westbound,1,Bus
4905,4905,Coxwell Ave at Memorial Park Ave South Side,43.691779,-79.327152,322 | 70,Eastbound,1,Bus
7108,7108,Senlac Rd at Sheppard Ave West North Side,43.759497,-79.422696,98,Westbound,1,Bus
8624,8624,Wellesley St West at Bay St,43.664477,-79.386908,94,Westbound,1,Bus
13430,13430,50 Claireport Cres,43.745865,-79.632487,73,Northbound,1,Bus
874,874,Danforth Ave at Caithness Ave,43.681063,-79.334596,300,Westbound,1,Bus
5360,5360,Lawrence Ave West at Dufferin St,43.713907,-79.454938,352 | 400 | 52 | 59 | 952,Eastbound,1,Bus
8588,8588,Warden Ave at Marble Arch Cres,43.73628,-79.29117,68,Southbound,1,Bus
8724,8724,Weston Rd at Flindon Rd,43.720773,-79.537557,165 | 89,Northbound,1,Bus
11050,11050,Humberline Dr at Finch Ave West,43.734711,-79.617763,96,Westbound,1,Bus
8555,8555,Warden Ave at Danforth Rd,43.697015,-79.274631,135 | 69,Northbound,1,Bus
8272,8272,Steeles Ave West at Walkway to Plunkett Rd,43.764965,-79.57122,166 | 60 | 960,Eastbound,1,Bus
8232,8232,3160 Steeles Ave East,43.815179,-79.343803,353 | 53,Eastbound,1,Bus
6604,6604,Mill St at Trinity St,43.650855,-79.359623,121,Westbound,1,Bus
8636,8636,Wellesley St East at Sherbourne St,43.666894,-79.374844,94,Eastbound,1,Bus
9357,9357,Steeles Ave East at Warden Ave,43.819848,-79.324123,17 | 353 | 53 | 953,Northbound,1,Bus
6040,6040,Scarborough Golf Club Rd at Chandler Dr South Side,43.764649,-79.216685,154,Westbound,1,Bus
4247,4247,Kingston Rd at Neilson Ave,43.72337,-79.234227,102 | 12 | 86 | 9,Northbound,1,Bus
6182,6182,The Westway at Brampton Rd,43.684642,-79.561103,52,Eastbound,1,Bus
1504,1504,Rathburn Rd at The West Mall,43.652839,-79.57279,48,Eastbound,1,Bus
7056,7056,Runnymede Rd at Deforest Rd,43.648854,-79.47542,77,Southbound,2,Bus
4961,4961,Danforth Rd at Savarin St,43.743307,-79.245123,16 | 302,Southbound,1,Bus
6675,6675,Pharmacy Ave at Chester Le Blvd (North),43.80194,-79.329852,167,Northbound,1,Bus
9662,9662,156 Duncan Mill Rd,43.761758,-79.355471,122,Westbound,1,Bus
5208,5208,422 Lansdowne Ave,43.655625,-79.441862,47,Southbound,1,Bus
5960,5960,Ossington Ave at Dewson St South Side,43.656601,-79.423646,363 | 63,Southbound,1,Bus
5114,5114,Gulliver Rd at Keele St West Side,43.699213,-79.476584,59,Westbound,1,Bus
9602,9602,120 Nugget Ave,43.793635,-79.255542,131,Westbound,1,Bus
13639,13639,Main St Markham South at James Scott Rd,43.866411,-79.257959,102,Northbound,1,Bus
4258,4258,Kingston Rd at Ravine Dr,43.731626,-79.224812,102 | 12 | 86,Northbound,1,Bus
6226,6226,Albion Rd at Arcot Blvd South Side,43.726504,-79.552023,118 | 73,Southbound,1,Bus
1863,1863,Danforth Rd at Landry Ave,43.694796,-79.276241,113 | 300 | 68,Northbound,2,Bus
11931,11931,New Westminster Dr at Katerina Ave,43.811469,-79.457406,160,Northbound,1,Bus
2559,2559,Finch Ave East at Scottfield Dr,43.8107,-79.253187,339 | 39 | 939,Eastbound,1,Bus
1755,1755,Broadview Ave at Danforth Ave,43.676051,-79.358601,301 | 305 | 504 | 505,Eastbound,2,Streetcar
6019,6019,Rogers Rd at Day Ave,43.685123,-79.448015,161,Westbound,2,Bus
7912,7912,Laurentide Dr at Bushbury Dr,43.754865,-79.340939,191 | 91,Southbound,1,Bus
4097,4097,Kennedy Rd at Linwood Ave South Side,43.793178,-79.29276,343 | 43,Southbound,1,Bus
7731,7731,Elmhurst Dr at Islington Ave,43.722989,-79.559057,396 | 96 | 996,Eastbound,1,Bus
3928,3928,Jane St at St John's Rd,43.661881,-79.489509,335 | 35 | 55,Northbound,1,Bus
8802,8802,Willowdale Ave at Empress Ave,43.771589,-79.402991,98,Westbound,1,Bus
7518,7518,Bathurst St at Davenport Rd,43.677019,-79.416012,307 | 7,Southbound,1,Bus
3741,3741,Hullmar Dr at Ruthmar Cres (North),43.763868,-79.526664,35,Southbound,1,Bus
6838,6838,Queen St West at Gladstone Ave,43.642608,-79.427,301 | 501,Westbound,1,Streetcar
686,686,Burnhamthorpe Rd at Saturn Rd,43.642427,-79.576,50,Eastbound,1,Bus
422,422,Birchmount Rd at Harleyford Gate,43.776799,-79.296002,17,Northbound,1,Bus
4770,4770,Avenue Rd at Douglas Ave North Side,43.723919,-79.416138,61,Northbound,1,Bus
1587,1587,Steeles Ave West at Bathurst St,43.792234,-79.446093,353 | 60 | 960,Eastbound,1,Bus
12605,12605,Markham Rd at Turbina Ave,43.827452,-79.249554,102,Southbound,2,Bus
8777,8777,Weston Rd at Wallasey Ave,43.718479,-79.537597,165,Northbound,1,Bus
14143,14143,2200 Markham Rd,43.808678,-79.24389,102,Southbound,1,Bus
674,674,Burnhamthorpe Rd at The East Mall,43.646462,-79.559669,50,Westbound,1,Bus
6898,6898,The Queensway at Loma Rd,43.624845,-79.508881,80,Eastbound,1,Bus
649,649,876 Broadview Ave,43.679749,-79.358155,100 | 25 | 322 | 62 | 8 | 87,Southbound,1,Bus
8612,8612,Warden Ave at Tower Dr,43.75447,-79.298554,68,Southbound,1,Bus
11859,11859,Ellesmere Rd at Principal Rd,43.76279,-79.294575,395 | 95,Westbound,1,Bus
9160,9160,Leslie St at Cummer Ave,43.801401,-79.370903,51,Southbound,1,Bus
8494,8494,Victoria Park Ave at Pleasant View Dr North Side,43.785985,-79.327909,24,Northbound,1,Bus
6186,6186,The Westway at Celestine Dr West Side,43.685449,-79.557262,52,Westbound,1,Bus
7633,7633,Curity Ave at Hollinger Rd,43.710161,-79.316249,91,Northbound,1,Bus
7318,7318,Sherbourne St at Gerrard St East,43.661074,-79.372083,75,Northbound,1,Bus
180,180,Bathurst St at Nina St,43.679716,-79.416855,307 | 7,Northbound,1,Bus
3095,3095,Richgrove Dr at Martin Grove Rd,43.676703,-79.564492,111,Southbound,1,Bus
5781,5781,Mortimer Ave at Greenwood Ave,43.688544,-79.335631,62,Eastbound,1,Bus
4462,4462,Manse Rd at Hainford St,43.768338,-79.175291,86,Westbound,1,Bus
11388,11388,Danforth Ave at Medford Ave,43.694945,-79.271312,20,Westbound,1,Bus
13623,13623,Jane St at Annette St South Side,43.657966,-79.488096,26 | 335 | 35 | 55,Southbound,1,Bus
11801,11801,McCowan Rd at Highglen Ave,43.845666,-79.278819,129,Northbound,1,Bus
27,27,Annette St at Evelyn Ave,43.661294,-79.474845,26,Westbound,2,Bus
606,606,150 Bridgeland Ave,43.725465,-79.464062,47,Southbound,1,Bus
6198,6198,The Westway at Royal York Rd,43.696,-79.532921,52,Eastbound,1,Bus
6596,6596,Middlefield Rd at Pebblewood Ave,43.823309,-79.263322,130,Southbound,1,Bus
451,451,Birchmount Rd at St Clair Ave East North Side,43.714658,-79.271238,17,Northbound,1,Bus
12093,12093,McCowan Rd at Bridlegrove Dr North Side,43.734657,-79.236305,9,Northbound,1,Bus
3475,3475,Deauville Lane at St Dennis Dr South Side,43.717713,-79.331085,100 | 34 | 403,Southbound,1,Bus
8502,8502,Victoria Park Ave at Southmead Rd,43.720693,-79.300881,24 | 324,Northbound,1,Bus
11581,11581,Davisville Ave at Mt Pleasant Rd West Side,43.700276,-79.38748,11 | 28,Southbound,1,Bus
1688,1688,Albion Rd at Todd Brook Dr,43.738366,-79.571394,73,Northbound,1,Bus
5761,5761,Morning Star Dr at Netherwood Rd,43.715993,-79.645872,52,Westbound,2,Bus
10702,10702,Weston Rd at Ormont Dr,43.76496,-79.545497,989,Southbound,1,Bus
5215,5215,Lansdowne Ave at Dundas St West,43.649963,-79.439556,47,Northbound,1,Bus
9224,9224,Sentinel Rd at Stilecroft Dr (North),43.750357,-79.494043,106 | 108,Eastbound,1,Bus
955,955,Davenport Rd at Shaw St,43.674677,-79.428504,127,Eastbound,1,Bus
11986,11986,Spadina Ave at Nassau St,43.655658,-79.399071,306 | 310 | 506 | 510,Northbound,1,Streetcar
5563,5563,Markham Rd at Greenbrae Circt,43.762388,-79.226409,102,Southbound,1,Bus
2437,2437,Evans Ave at The East Mall,43.612047,-79.543583,15 | 315,Westbound,1,Bus
4233,4233,Kingston Rd at Lakehurst Dr,43.696163,-79.258001,12 | 302,Northbound,1,Bus
2678,2678,Guildwood Pkwy at Guild Park and Gardens East Side,43.748713,-79.193517,116 | 334,Eastbound,1,Bus
11086,11086,160 Carrier Dr,43.741681,-79.613749,96,Westbound,1,Bus
8395,8395,Upper Canada Dr at Lord Seaton Rd (West),43.753351,-79.404778,78,Westbound,1,Bus
12099,12099,Corporate Dr at Lee Centre Dr (West) West Side,43.780521,-79.24748,134 | 903,Southbound,1,Bus
9596,9596,120 McLevin Ave,43.801922,-79.235123,131,Westbound,1,Bus
9243,9243,Shorncliffe Ave at Newbridge Rd,43.625836,-79.541965,123,Northbound,1,Bus
9076,9076,York Mills Rd at Leslie St,43.752788,-79.360219,122 | 395 | 95 | 995 | 996,Eastbound,1,Bus
4781,4781,Avenue Rd at Glenview Ave North Side,43.718374,-79.414483,61,Northbound,2,Bus
4181,4181,King St West at Peter St,43.646161,-79.39201,304 | 504 | 508,Westbound,1,Streetcar
213,213,Bathurst St at Ulster St,43.659869,-79.409188,307 | 511,Southbound,2,Bus
207,207,Bathurst St at Steeles Ave West South Side,43.791465,-79.445601,160,Northbound,1,Bus
9568,9568,Nugget Ave at Transfer Pl,43.797902,-79.244522,131,Eastbound,1,Bus
1473,1473,Rathburn Rd at The East Mall West Side,43.654977,-79.564857,48,Westbound,1,Bus
2181,2181,Dundas St West at Roncesvalles Ave East Side,43.65348,-79.451258,305 | 402 | 505,Southbound,2,Streetcar
13472,13472,Humberline Dr at Viewcrest Cir East Side,43.7322,-79.617339,336 | 37 | 96 | 996,Northbound,1,Bus
11803,11803,McCowan Rd at Highglen Ave South Side,43.846056,-79.279319,129,Northbound,1,Bus
363,363,Bellamy Rd North at Lynnbrook Dr,43.772762,-79.241395,9,Southbound,1,Bus
41,41,Annette St at Runnymede Rd,43.660161,-79.479787,26,Westbound,1,Bus
8643,8643,Wellesworth Dr at Rangoon Rd West Side,43.666198,-79.579569,112,Northbound,1,Bus
9893,9893,Wintermute Blvd at River Grove Dr (South),43.818001,-79.317538,17,Northbound,1,Bus
3821,3821,Islington Ave at New Toronto St,43.60655,-79.506452,110 | 337,Northbound,1,Bus
8435,8435,Victoria Park Ave at Biscayne Blvd North Side,43.729432,-79.304467,24 | 324,Northbound,1,Bus
8258,8258,2215 Steeles Ave West,43.785318,-79.477801,353 | 60,Eastbound,1,Bus
11057,11057,Gooch Ave at Magwood Crt,43.662062,-79.494627,55,Southbound,2,Bus
3222,3222,Yonge St at Dundas St West - TMU Station,43.656505,-79.381074,320 | 882 | 97,Southbound,1,Bus
3770,3770,Islington Ave at Birmingham St,43.603386,-79.506463,110 | 337,Southbound,1,Bus
1984,1984,The Donway East at Lawrence Ave East,43.73801,-79.341171,162,Eastbound,1,Bus
4925,4925,Culford Rd at Gracefield Ave,43.709789,-79.489355,59,Westbound,1,Bus
2389,2389,Eglinton Ave West at Oakwood Ave,43.697418,-79.442561,32 | 332,Westbound,1,Bus
12658,12658,Murray Ross Pkwy at Shoreham Dr North Side - Aviva Centre,43.772235,-79.513864,108,Westbound,1,Bus
9463,9463,Cosburn Ave at Roblin Ave,43.695386,-79.322445,87,Eastbound,1,Bus
5427,5427,Leslie St at Bond Ave,43.743601,-79.357806,51,Northbound,1,Bus
109,109,Bathurst St at Codsell Ave,43.758716,-79.439386,160 | 307 | 7,Northbound,1,Bus
8485,8485,Victoria Park Ave at Morecambe Gate,43.797966,-79.333423,24 | 39,Northbound,1,Bus
5940,5940,O'Connor Dr at Wakunda Pl,43.715734,-79.304903,70,Eastbound,1,Bus
6762,6762,Pharmacy Ave at Walkway to Ecclesfield Dr,43.809041,-79.332875,167,Northbound,1,Bus
8855,8855,Wilson Ave at Epic Lane Rd East Side,43.721239,-79.505763,118 | 119 | 165 | 396 | 96,Northbound,1,Bus
1725,1725,Bayview Ave at Wood Ave,43.727063,-79.382049,11 | 124 | 352,Southbound,1,Bus
9695,9695,Gerrard St East at Clonmore Dr West Side,43.688594,-79.279092,135,Westbound,1,Bus
9999,9999,McCowan Rd at Bullock Dr - Centennial GO Station,43.872507,-79.285637,129,Northbound,1,Bus
3696,3696,High Park Ave at Dundas St West,43.665068,-79.47009,30,Northbound,1,Bus
14262,14262,Weston Rd at Cardell Ave,43.709503,-79.5343,73 | 89,Northbound,1,Bus
10929,10929,Spadina Ave at Bremner Blvd,43.640814,-79.393172,310 | 510,Southbound,1,Streetcar
10141,10141,Port Union Rd at Lawrence Ave East North Side,43.780021,-79.136654,38 | 395,Westbound,1,Bus
8486,8486,Victoria Park Ave at Navaho Dr,43.800463,-79.334556,24 | 39,Northbound,1,Bus
8034,8034,Pharmacy Ave at Gordon Baker Rd,43.811984,-79.33442,167,Northbound,1,Bus
9848,9848,Brenyon Way at Wickson Trail South Side,43.805362,-79.211263,132,Westbound,1,Bus
10659,10659,Finch Ave East at Milliken Blvd,43.801965,-79.294139,339 | 39,Eastbound,1,Bus
13346,13346,Dawes Rd at Park Vista South Side,43.697984,-79.297192,23 | 404,Southbound,2,Bus
6738,6738,Pharmacy Ave at Princeway Dr,43.752997,-79.308447,67,Northbound,1,Bus
464,464,Birchmount Rd at Highway 401 - Walkway North of Rolark,43.771792,-79.294137,17,Southbound,1,Bus
1116,1116,Gerrard St East at Bowmore Rd,43.67819,-79.314912,306 | 506,Westbound,2,Streetcar
3946,3946,Jane St at Yorkwoods Gate,43.750665,-79.515843,335 | 35,Northbound,1,Bus
5365,5365,Lawrence Ave West at Duplex Ave,43.724245,-79.405751,352 | 52,Eastbound,2,Bus
7723,7723,Elmhurst Dr at Albion Rd West Side,43.725017,-79.551193,396 | 96 | 996,Westbound,1,Bus
2304,2304,Eglinton Ave East at Redpath Ave,43.707755,-79.392936,103 | 334 | 34 | 354 | 51 | 54 | 56 | 74,Northbound,1,Bus
13686,13686,251 Consumers Rd,43.77037,-79.330219,167 | 24,Northbound,1,Bus
9409,9409,Neilson Rd at McLevin Ave,43.8091,-79.221269,133 | 334,Northbound,1,Bus
7062,7062,Runnymede Rd at Henrietta St,43.670564,-79.484123,71 | 79,Northbound,2,Bus
14079,14079,709 Milner Ave,43.796035,-79.213776,132,Eastbound,1,Bus
3725,3725,289 Horner Ave,43.606541,-79.523286,110,Northbound,1,Bus
2226,2226,The East Mall at Yarn Rd South Side,43.632002,-79.553379,111,Southbound,1,Bus
2677,2677,Guildwood Pkwy at Forsythia Dr,43.750205,-79.187147,116 | 334,Eastbound,1,Bus
8214,8214,Steeles Ave East at Bluffwood Dr,43.807554,-79.376213,353 | 53,Eastbound,1,Bus
3711,3711,Horner Ave at Beta St,43.603044,-79.538963,110,Northbound,1,Bus
6264,6264,Berry Rd at Stephen Dr,43.637392,-79.487365,66,Southbound,1,Bus
503,503,Bloor St West at Dovercourt Rd,43.661043,-79.429553,300,Eastbound,1,Bus
3038,3038,Queen St East at Carroll St,43.658204,-79.352454,301 | 304 | 503 | 504,Eastbound,2,Streetcar
8440,8440,Victoria Park Ave at Conroy Ave,43.701514,-79.292757,24 | 324,Northbound,1,Bus
3167,3167,Westlake Ave at Hamstead Ave,43.696561,-79.309265,404 | 87,Eastbound,1,Bus
10952,10952,Old Finch Ave at Kengate Dr,43.821434,-79.204264,131 | 39,Eastbound,1,Bus
3047,3047,Queen St East at Empire Ave,43.660216,-79.344102,301 | 501 | 503,Westbound,1,Streetcar
225,225,4600 Bathurst St,43.762602,-79.44037,160 | 307 | 7,Northbound,1,Bus
5559,5559,Markham Rd at Eglinton Ave East,43.743397,-79.219195,102 | 902,Southbound,1,Bus
4874,4874,143 Church St,43.707312,-79.513771,59,Eastbound,2,Bus
3142,3142,Trethewey Dr at Todd Baylis Blvd,43.695244,-79.487345,32,Westbound,1,Bus
4303,4303,Kipling Ave at Dixon Rd North Side,43.694765,-79.558658,45 | 945,Northbound,1,Bus
4567,4567,Rogers Rd at Scott Rd,43.682377,-79.468987,161 | 168 | 341 | 41,Northbound,1,Bus
11546,11546,Crow Trail at Bradstone Sq,43.811065,-79.232681,134,Northbound,1,Bus
2156,2156,Dundas St West at Denison Ave,43.651939,-79.40236,305 | 505,Eastbound,2,Streetcar
2126,2126,Dundas St East at River St,43.661093,-79.358286,301 | 305 | 501 | 505,Eastbound,2,Streetcar
8670,8670,The West Mall at Burnhamthorpe Rd,43.644355,-79.566955,112 | 300,Northbound,1,Bus
6095,6095,Southwood Dr at Glen Ames,43.676086,-79.296881,64,Southbound,2,Bus
7682,7682,Ellesmere Rd at Borough Approach East,43.771587,-79.255056,395 | 95,Westbound,1,Bus
8645,8645,Wellesworth Dr at The West Mall,43.655137,-79.572679,112 | 48,Southbound,1,Bus
4941,4941,Danforth Rd at Eglinton Ave East,43.73687,-79.246243,16,Northbound,1,Bus
13683,13683,Consumers Rd at Sheppard Ave East South Side,43.774466,-79.331542,167 | 24,Northbound,1,Bus
4025,4025,Keele St at Rustic Rd,43.717813,-79.479942,341 | 400 | 41,Northbound,1,Bus
7595,7595,Opposite 38 Carnforth Rd,43.739168,-79.315925,91,Northbound,1,Bus
1222,1222,Lawrence Ave East at Dinnick Cres East Side,43.726421,-79.39552,124 | 162 | 352,Eastbound,2,Bus
3162,3162,682 Warden Ave,43.705852,-79.278599,135 | 69,Southbound,1,Bus
7412,7412,Victoria Park Ave at Esquire Rd,43.77342,-79.321965,167 | 24 | 324,Northbound,1,Bus
5001,5001,Dixon Rd at Royal York Rd East Side,43.699818,-79.533639,52 | 952,Eastbound,2,Bus
943,943,Davenport Rd at Lansdowne Ave,43.671651,-79.448053,127,Westbound,1,Bus
4379,4379,Kipling Ave at Torlake Cres (North),43.614189,-79.523828,44,Southbound,1,Bus
1493,1493,Rathburn Rd at Melbert Rd,43.649836,-79.582788,48,Eastbound,1,Bus
4624,4624,St Clair Ave East at Fermoy Rd,43.72124,-79.239268,102 | 69 | 9,Northbound,1,Bus
6053,6053,Sheppard Ave East at Glen Watford Dr East Side,43.785926,-79.275531,385 | 85,Eastbound,1,Bus
13423,13423,Avon Loop at Weston Rd,43.681365,-79.476844,161 | 168,Southbound,1,Bus
2068,2068,Dufferin St at Lappin Ave South Side,43.666082,-79.438076,29 | 329,Southbound,1,Bus
1000,1000,Dupont St at Christie St,43.671515,-79.421673,26,Eastbound,1,Bus
2574,2574,Finch Ave East at Willowdale Ave,43.781498,-79.407257,339 | 39 | 939,Eastbound,1,Bus
6494,6494,Kingston Rd at Morningside Ave,43.770097,-79.18712,386 | 86 | 986,Eastbound,1,Bus
10576,10576,McCowan Rd at Steeles Ave East,43.830834,-79.274962,129 | 302,Northbound,1,Bus
2149,2149,Dundas St West at East Mall Cres,43.630726,-79.549041,111 | 112 | 123 | 900 | 927,Northbound,1,Bus
75,75,Baldoon Rd at Finch Ave East,43.815102,-79.232194,134 | 339 | 39,Northbound,1,Bus
9830,9830,Steeles Ave East at Walkway to Enchanted Hills Cres,43.830278,-79.27779,353 | 53,Eastbound,1,Bus
5822,5822,Mt Pleasant Rd at Heath St East,43.692142,-79.383921,74,Northbound,1,Bus
7024,7024,Royal York Rd at Romney Rd,43.669159,-79.520846,73,Northbound,2,Bus
4075,4075,Kennedy Rd at Cornwallis Dr North Side,43.752206,-79.275682,343 | 43,Northbound,1,Bus
12058,12058,Progress Ave at Milner Business Crt South Side,43.788208,-79.233484,134,Southbound,1,Bus
448,448,Birchmount Rd at Sheppard Ave East,43.780849,-79.297827,17,Northbound,1,Bus
7347,7347,Spadina Ave at College St North Side,43.658504,-79.400214,310 | 510,Northbound,1,Streetcar
4545,4545,Progress Ave at Cosentino Dr West Side,43.773652,-79.270125,43,Southbound,1,Bus
5525,5525,Lumsden Ave at Oak Park Ave,43.693826,-79.310537,62,Eastbound,1,Bus
7125,7125,Senlac Rd at Park Home Ave North Side,43.766951,-79.425864,98,Westbound,1,Bus
2309,2309,Eglinton Ave East at Rumsey Rd,43.712675,-79.369465,334 | 34 | 354 | 51 | 54 | 56,Northbound,1,Bus
251,251,Bay St at Grosvenor St,43.662647,-79.386557,19,Southbound,1,Bus
8589,8589,Warden Ave at McNicoll Ave North Side,43.806712,-79.321025,324 | 68 | 968,Northbound,1,Bus
5892,5892,Oakdale Rd at Sheppard Ave West,43.737399,-79.524639,119 | 84,Eastbound,1,Bus
29,29,Annette St at Gilmour Ave,43.660716,-79.477294,26,Westbound,1,Bus
1847,1847,Danforth Ave at Eastwood Ave,43.69542,-79.269176,20,Westbound,1,Bus
7541,7541,Bermondsey Rd at Sunrise Ave,43.717074,-79.313476,91,Southbound,1,Bus
287,287,Bayview Ave at Cummer Ave,43.792342,-79.393719,11,Southbound,1,Bus
6072,6072,Sheppard Ave West at Keele St,43.744972,-79.486103,106 | 108 | 384 | 84 | 984,Westbound,1,Bus
6351,6351,Douglas Dr at Douglas Dr - Chorley Park,43.686892,-79.370973,82,Eastbound,1,Bus
1944,1944,Don Mills Rd at Kern Rd North Side,43.75035,-79.346828,25 | 325,Northbound,1,Bus
5894,5894,755 Oakdale Rd,43.753125,-79.526044,84,Westbound,1,Bus
3329,3329,Belfield Rd at C.N. West Spur,43.700268,-79.583103,45,Northbound,1,Bus
1844,1844,Danforth Rd at Birchmount Rd West Side,43.706662,-79.268473,113 | 300,Westbound,1,Bus
6565,6565,Meadowvale Rd at Ellesmere Rd,43.792363,-79.163397,386 | 86 | 986,Eastbound,1,Bus
742,742,Caledonia Rd at Rogers Rd,43.68339,-79.45825,47,Southbound,1,Bus
12056,12056,Progress Ave at Rosebank Dr,43.792455,-79.234239,134,Southbound,1,Bus
3802,3802,Islington Ave at Holgate St,43.684737,-79.541305,337 | 37 | 405,Southbound,1,Bus
698,698,Burnhamthorpe Rd at The West Mall,43.644752,-79.567037,50,Westbound,1,Bus
13368,13368,Bathurst St at Queens Quay West North Side Billy Bishop Airport,43.636011,-79.398844,509,Westbound,1,Streetcar
2318,2318,Eglinton Ave East at Warden Ave,43.72804,-79.28733,334 | 34,Eastbound,1,Bus
2509,2509,Finch Ave East at Estelle Ave,43.783865,-79.396432,339 | 39,Eastbound,1,Bus
10127,10127,Park Lawn Rd at The Queensway South Side,43.628662,-79.490031,66,Southbound,1,Bus
4946,4946,Danforth Rd at Glenshephard Dr (West),43.730593,-79.250791,16 | 300,Northbound,1,Bus
54,54,Avenue Rd at Carmichael Ave,43.73762,-79.420776,61,Northbound,1,Bus
8826,8826,Willowdale Ave at Spring Garden Ave,43.766298,-79.400521,98,Eastbound,1,Bus
1417,1417,O'Connor Dr at Milton Rd,43.697048,-79.332295,8,Northbound,1,Bus
8401,8401,Upper Highland Cres at York Mills Rd,43.745587,-79.396545,78,Westbound,1,Bus
12202,12202,Lawrence West Station,43.715964,-79.444097,352 | 52 | 882 | 952,Eastbound,2,Bus
1327,1327,Midland Ave at Lorraine Ave,43.730662,-79.256386,20,Eastbound,1,Bus
9356,9356,Steeles Ave East at Mountcastle Gate,43.82074,-79.320341,17 | 353 | 53,Northbound,1,Bus
809,809,College St at Augusta Ave,43.65724,-79.403252,306 | 506,Eastbound,2,Streetcar
6243,6243,Bannatyne Dr at Davean Dr,43.760329,-79.368381,115,Eastbound,1,Bus
11559,11559,6655 Airport Rd,43.696429,-79.632365,52,Westbound,2,Bus
10955,10955,Old Finch Ave at Valley Centre Dr (West) West Side,43.821266,-79.20563,131,Westbound,1,Bus
4957,4957,Danforth Rd at Midland Ave,43.725436,-79.253783,16 | 300,Southbound,1,Bus
580,580,Bloor St West at Runnymede Rd,43.650991,-79.476466,149 | 300,Eastbound,1,Bus
4829,4829,Brimley Rd at Danjohn Cres (North),43.812904,-79.280443,21,Northbound,1,Bus
1670,1670,Yonge St at Davisville Ave North Side,43.698675,-79.396563,320 | 97,Northbound,1,Bus
3595,3595,Finch Ave West at Greenview Ave,43.779237,-79.418329,336 | 36,Westbound,1,Bus
4727,4727,St Dennis Dr at Linkwood Lane,43.719209,-79.32776,100,Northbound,1,Bus
8225,8225,Steeles Ave East at Henderson Ave,43.801188,-79.406152,353 | 53,Eastbound,1,Bus
7442,7442,Weston Rd at Dee Ave,43.711287,-79.535271,73 | 89,Southbound,1,Bus
1357,1357,75 Milner Ave,43.784021,-79.25133,132,Eastbound,1,Bus
13631,13631,Markham Rd at Passmore Ave,43.830357,-79.250385,102 | 902,Northbound,1,Bus
3501,3501,Dundas St West at Humberside Ave,43.663295,-79.456935,340 | 40,Eastbound,1,Bus
2519,2519,Finch Ave East at Leslie St - Old Cummer GO Station,43.790162,-79.369075,339 | 39 | 939,Eastbound,1,Bus
266,266,Bay St at Cumberland St - Bay Station,43.670485,-79.389669,19,Northbound,1,Bus
9170,9170,Steeles Ave West Loop at Islington Ave,43.764093,-79.576584,166 | 337 | 37 | 937,Northbound,1,Bus
3895,3895,Jane St at Foxwell St,43.671734,-79.493889,335 | 35 | 935,Southbound,1,Bus
3123,3123,St Regis Cres at Keele St,43.754743,-79.487887,108,Westbound,1,Bus
11538,11538,John Garland Blvd at Kipling Ave,43.735359,-79.578514,96,Eastbound,1,Bus
3880,3880,Jane St at Driftwood Ave North Side,43.766138,-79.519595,335 | 35,Northbound,1,Bus
7822,7822,Hinton Rd at Elmhurst Dr,43.72739,-79.566418,396 | 96,Eastbound,1,Bus
6150,6150,Uphill Ave at Woodward Ave,43.709411,-79.508797,59,Westbound,2,Bus
2838,2838,Longbourne Dr at Willowridge Rd,43.677937,-79.571914,111,Northbound,1,Bus
