stop_id,stop_code,stop_name,stop_lat,stop_lon,Routes,Direction,Accessibility,Type
3283,3283,Albion Rd at Westmore Dr,43.743676,-79.60368,73,Northbound,1,Bus
4785,4785,Avenue Rd at Lawrence Ave West South Side,43.721943,-79.415656,61,Northbound,1,Bus
9085,9085,York Mills Rd at Silverdale Cres,43.756849,-79.341547,395 | 95,Eastbound,1,Bus
5672,5672,McCowan Rd at Lawrence Ave East Scarborough General Hospital,43.755237,-79.245257,16 | 302,Northbound,1,Bus
5871,5871,Opposite 35 Oak St,43.708598,-79.530044,59,Westbound,1,Bus
5172,5172,Lake Shore Blvd West at Seventh St,43.600638,-79.505392,301 | 501 | 507 | 508,Eastbound,1,Streetcar
7068,7068,Runnymede Rd at St Clair Ave West,43.668822,-79.483369,71 | 79,Northbound,1,Bus
9688,9688,Gerrard St East at Rathmore Ave,43.688041,-79.280959,135,Eastbound,1,Bus
8877,8877,Wilson Ave at Northgate Dr,43.730184,-79.468213,101 | 118 | 119 | 120 | 165 | 396 | 96,Northbound,1,Bus
6915,6915,The Queensway at South Kingsway,43.635656,-79.473392,301 | 501 | 508,Westbound,1,Streetcar
627,627,Brimley Rd at Elgar Ave,43.74108,-79.250082,21,Northbound,1,Bus
13697,13697,Park Lawn Rd at Gardiner Expressway WB On Ramp),43.625856,-79.486331,66,Southbound,1,Bus
8297,8297,Steeles Ave West at Pearce Rd,43.769841,-79.54938,165 | 166 | 60 | 960,Northbound,1,Bus
6883,6883,The Queensway at Culnan Ave,43.621659,-79.524124,80,Westbound,1,Bus
3807,3807,Islington Ave at Kingsview Blvd,43.699844,-79.548105,337 | 37,Southbound,1,Bus
1022,1022,Dupont St at Palmerston Ave,43.672509,-79.416844,26,Eastbound,1,Bus
11564,11564,Dynamic Dr at Turbina Ave,43.826754,-79.252028,102 | 42,Southbound,1,Bus
3031,3031,Queen St East at Boulton Ave,43.65966,-79.346553,301 | 501 | 503,Westbound,1,Streetcar
3029,3029,Queen St East at Alton Ave,43.66388,-79.327688,301 | 31 | 501 | 503,Southbound,1,Streetcar
7039,7039,Royal York Rd at Weston Wood Rd,43.69197,-79.531007,405 | 73,Southbound,1,Bus
3193,3193,Wilson Heights Blvd at Waterloo Ave South Side,43.755093,-79.459835,104,Northbound,1,Bus
1955,1955,Don Mills Rd at Moatfield Dr,43.758464,-79.346899,25 | 325,Northbound,1,Bus
2758,2758,Kennedy Rd at Malta St,43.704327,-79.256564,20,Westbound,1,Bus
3237,3237,Opposite 247 Yonge St - Toronto Eaton Centre,43.654934,-79.380414,320 | 97,Southbound,1,Bus
4110,4110,Kennedy Rd at Pently Cres South Side,43.779544,-79.286703,343 | 43,Southbound,1,Bus
8632,8632,Wellesley St East at Parliament St West Side,43.668122,-79.370103,94,Westbound,1,Bus
8881,8881,Wilson Ave at Ridge Rd West Side,43.723931,-79.494594,118 | 119 | 165 | 396 | 96,Northbound,1,Bus
3883,3883,Jane St at East Dr,43.679023,-79.49698,335 | 35,Southbound,1,Bus
2596,2596,Finch Ave West at Duncanwoods Dr,43.748959,-79.557477,336 | 806,Westbound,1,Bus
13320,13320,St Clair Ave West at Mould Ave,43.668068,-79.487241,189 | 340 | 40 | 79,Southbound,1,Bus
6856,6856,Queen St West at Tecumseth St,43.646569,-79.406716,301 | 501,Eastbound,1,Streetcar
2270,2270,Eglinton Ave East at Forman Ave,43.709106,-79.38633,334 | 34 | 354 | 51 | 54 | 56,Northbound,1,Bus
39,39,Annette St at Medland St,43.663412,-79.466527,26,Eastbound,1,Bus
1818,1818,Cummer Ave at Silverview Dr,43.787742,-79.413773,42,Eastbound,1,Bus
1915,1915,Don Mills Rd at Cliffwood Rd (North),43.806959,-79.356619,25 | 325,Northbound,1,Bus
5252,5252,Lawrence Ave East at Collinsgrove Rd,43.769269,-79.182716,354 | 54 | 86 | 954,Eastbound,1,Bus
1279,1279,Martin Ross Ave at Brisbane Rd (West),43.773418,-79.476878,107,Southbound,1,Bus
5560,5560,Markham Rd at Ellesmere Rd,43.776664,-79.232023,102 | 902,Southbound,1,Bus
11074,11074,263 Carrier Dr,43.750876,-79.614251,96,Eastbound,1,Bus
8331,8331,Sutherland Dr at Millwood Rd West Side,43.703319,-79.364532,88,Southbound,1,Bus
944,944,Davenport Rd at Lightbourn Ave,43.672278,-79.443935,127,Eastbound,1,Bus
2094,2094,Dufferin St at St Clair Ave West,43.678395,-79.443316,29 | 329 | 929,Southbound,1,Bus
7684,7684,Ellesmere Rd at Brimley Rd,43.769843,-79.261788,395 | 95 | 995,Eastbound,1,Bus
8990,8990,Yonge St at Florence Ave,43.758337,-79.41031,320 | 97,Southbound,1,Bus
9143,9143,Hullmar Dr at Hisey Cres (North),43.772347,-79.528748,35,Northbound,1,Bus
9366,9366,McCowan Rd at Bridley Dr,43.814517,-79.270578,129 | 302,Northbound,1,Bus
281,281,Bayview Ave at Burleigh Heights Dr South Side,43.779345,-79.390994,11,Southbound,1,Bus
5119,5119,High Park Ave at Dundas St West South Side,43.66514,-79.470272,30,Northbound,1,Bus
1019,1019,Dupont St at Osler St,43.664644,-79.456422,26,Westbound,1,Bus
7543,7543,50 Beth Nealson Dr,43.711282,-79.345763,88,Southbound,2,Bus
591,591,Bloor St West at Sterling Rd,43.65713,-79.448096,300,Eastbound,1,Bus
6026,6026,Rogers Rd at Glenholme Ave,43.686648,-79.441179,161,Westbound,1,Bus
5128,5128,Aukland Rd at Dundas St West North Side,43.638772,-79.538547,300 | 49,Westbound,1,Bus
10724,10724,Finchdene Sq at Finch Ave East,43.815701,-79.2317,134 | 334 | 353,Southbound,1,Bus
5272,5272,Lawrence Ave East at Greenholm Circt,43.760464,-79.222841,154 | 354 | 54 | 954,Eastbound,1,Bus
740,740,Caledonia Rd at Raitherm Rd,43.701758,-79.464121,47,Northbound,1,Bus
3661,3661,Glencairn Ave at Marlee Ave,43.708895,-79.443911,14,Eastbound,1,Bus
9411,9411,279 Rexdale Blvd,43.713344,-79.579382,37,Southbound,1,Bus
3147,3147,Trethewey Dr at Paulson Rd,43.693882,-79.482066,32,Westbound,2,Bus
3813,3813,Islington Ave at Leduc Dr North Side,43.718689,-79.556614,337 | 37 | 937,Northbound,1,Bus
679,679,Burnhamthorpe Rd at Kipling Ave,43.650862,-79.539519,50,Eastbound,2,Bus
7477,7477,Yorkland Blvd (North) at Yorkland Rd,43.773014,-79.335988,167 | 24,Northbound,1,Bus
11927,11927,Promenade Cir at East Promenade North Side - Mall East Entrance,43.807581,-79.450171,160,Northbound,2,Bus
1769,1769,Broadview Ave at Wolfrey Ave,43.674457,-79.357342,301 | 305 | 504 | 505 | 62 | 8,Southbound,2,Streetcar
3032,3032,Queen St East at Broadview Ave,43.658746,-79.35006,301 | 304 | 503 | 504,Eastbound,1,Streetcar
7202,7202,Sheppard Ave East at Lapsley Rd East Side,43.796173,-79.226955,385 | 85 | 985,Eastbound,1,Bus
8434,8434,Victoria Park Ave at Bassett Ave,43.713701,-79.297915,24 | 324,Northbound,1,Bus
2521,2521,Finch Ave East at Liszt Gate,43.790982,-79.362961,339 | 39,Eastbound,1,Bus
1431,1431,Orfus Rd at Dufflaw Rd West Side,43.718769,-79.463735,47,Southbound,1,Bus
248,248,Bay St at Gerrard St West North Side,43.65878,-79.384865,19 | 306 | 506,Northbound,1,Bus
5490,5490,Leslie St at Van Horne Ave,43.783616,-79.366381,51,Northbound,1,Bus
2691,2691,Harold Evans Cres at Gordon Baker Rd East Side,43.80497,-79.344227,39,Eastbound,1,Bus
13530,13530,McCowan Rd at Trail Ridge Lane,43.88768,-79.289637,129,Northbound,1,Bus
2512,2512,Finch Ave East at Heathview Ave,43.786113,-79.386721,339 | 39,Eastbound,1,Bus
110,110,Bathurst St at College St,43.656244,-79.407513,307 | 511,Northbound,2,Bus
8868,8868,Wilson Ave at Keele St,43.726427,-79.48238,118 | 119 | 165 | 396 | 96 | 996,Northbound,1,Bus
9025,9025,Yonge St at Mcglashan Rd South Side,43.741635,-79.40641,320 | 97,Southbound,1,Bus
6328,6328,Craigton Dr at Pharmacy Ave West Side,43.72721,-79.298614,67,Northbound,2,Bus
4729,4729,Opposite 100 Wynford Dr,43.726456,-79.331376,100 | 34,Southbound,2,Bus
1708,1708,Bayview Ave at Millwood Rd,43.704335,-79.374731,11,Southbound,1,Bus
849,849,600 Commissioners St,43.655612,-79.32871,83,Southbound,2,Bus
7086,7086,Scarlett Rd at Edinborough Crt North Side,43.672596,-79.503958,79,Northbound,2,Bus
7211,7211,Sheppard Ave East at McCowan Rd,43.789822,-79.258623,385 | 85 | 985,Eastbound,1,Bus
4788,4788,Avenue Rd at Lytton Blvd,43.714068,-79.411966,61,Northbound,2,Bus
7555,7555,Birchmount Rd at Parnell Ave South Side,43.705135,-79.267462,117,Southbound,1,Bus
2116,2116,Dundas St East at Church St,43.656371,-79.377358,305 | 505,Eastbound,2,Streetcar
5621,5621,Martin Grove Rd at John Garland Blvd,43.732225,-79.589683,396 | 46,Southbound,1,Bus
644,644,Brimley Rd at St Andrews Rd,43.761927,-79.258147,21,Northbound,1,Bus
7178,7178,Sheppard Ave East at Don Mills Rd West Side,43.775075,-79.347844,385,Eastbound,1,Bus
1310,1310,McCowan Rd at Nugget Ave,43.791895,-79.259599,129 | 130 | 169 | 302,Northbound,1,Bus
1127,1127,Gerrard St East at Woodbine Ave,43.680644,-79.310829,306 | 506,Eastbound,2,Streetcar
7360,7360,St Clair Ave West at Britannia Ave,43.669697,-79.480616,189 | 340,Westbound,1,Bus
1928,1928,Don Mills Rd at Esterbrooke Ave,43.779239,-79.348996,10 | 169 | 25 | 325,Southbound,1,Bus
1900,1900,Dawes Rd at Secord Ave,43.693473,-79.297122,23,Northbound,2,Bus
5784,5784,Mortimer Ave at Inwood Ave,43.688147,-79.337457,62,Eastbound,2,Bus
5098,5098,Gary Dr at Dalbeattie Ave,43.7121,-79.513984,59,Eastbound,1,Bus
9032,9032,Yonge St at Norton Ave,43.77215,-79.41347,320 | 97,Northbound,1,Bus
192,192,Bathurst St at Ridge Hill Dr,43.703452,-79.426013,307 | 7,Southbound,1,Bus
3414,3414,Chaplin Cres at Eglinton Ave West,43.70236,-79.416376,14,Westbound,1,Bus
6719,6719,Pharmacy Ave at Kellyvale Rd,43.757372,-79.310275,67,Southbound,1,Bus
4796,4796,Avenue Rd at St Clements Ave,43.710415,-79.411259,61,Northbound,1,Bus
1982,1982,The Donway East at Don Mills Rd,43.732617,-79.341124,162,Westbound,1,Bus
6407,6407,Grantbrook St at Blake Ave,43.779827,-79.432701,98,Eastbound,1,Bus
5712,5712,Midland Ave at Lawrence Ave East,43.751281,-79.264867,57,Northbound,1,Bus
7824,7824,Hollinger Rd at Bermondsey Rd West Side,43.714805,-79.312835,91,Southbound,1,Bus
7995,7995,Norelco Dr at Fenmar Dr,43.760173,-79.532773,84,Eastbound,1,Bus
2696,2696,Highview Ave at Kennedy Rd West Side,43.702459,-79.256133,20,Westbound,1,Bus
9212,9212,Arleta Ave at John Lindsay Crt,43.745646,-79.501779,108,Westbound,2,Bus
7,7,Alness St at Steeles Ave West South Side,43.784228,-79.480914,107,Southbound,2,Bus
5528,5528,MacDonell Ave at Seaforth Ave,43.642144,-79.438522,402 | 47,Northbound,2,Bus
9235,9235,Shorncliffe Ave at Lockport Ave South Side,43.62761,-79.54294,123,Northbound,1,Bus
5539,5539,Main St at Swanwick Ave,43.682461,-79.299637,64,Southbound,1,Bus
13529,13529,McCowan Rd at Bur Oak Ave,43.895058,-79.291414,129,Northbound,1,Bus
8754,8754,Weston Rd at Oxford Dr South Side,43.687777,-79.491894,89,Southbound,1,Bus
7370,7370,Stephen Dr at Berry Rd,43.63738,-79.487062,66,Northbound,1,Bus
5845,5845,Mt Pleasant Rd at St Leonards Ave,43.722398,-79.395822,103,Northbound,1,Bus
6554,6554,Marlee Ave at Viewmount Ave South Side,43.706879,-79.443013,109,Southbound,1,Bus
11113,11113,Sheppard Ave East at Twyn Rivers Dr South Side,43.808624,-79.165526,385 | 85,Eastbound,1,Bus
5251,5251,Lawrence Ave East at Cherryhill Ave,43.776343,-79.150675,354 | 54 | 954,Eastbound,1,Bus
3717,3717,Horner Ave at Edilou Dr,43.604931,-79.531199,110,Southbound,1,Bus
252,252,Bay St at Hagerman St,43.654182,-79.383,19,Northbound,1,Bus
4051,4051,Keele St at Wycombe Rd,43.742976,-79.485841,101 | 341 | 41,Northbound,2,Bus
2095,2095,Dufferin St at Stayner Ave,43.703481,-79.452235,29 | 329,Northbound,2,Bus
5793,5793,Mortimer Ave at Roosevelt Rd,43.68975,-79.329935,62,Eastbound,1,Bus
7263,7263,Sheppard Ave West at Bathurst St,43.755315,-79.438927,384 | 84,Eastbound,1,Bus
3731,3731,Hullmar Dr at Bimini Cres (South),43.765083,-79.527514,35,Northbound,1,Bus
2481,2481,Finch Ave East at Adirondack Gate,43.800369,-79.299752,339 | 39,Eastbound,2,Bus
6334,6334,Crescent Rd at Rosedale Rd East Side,43.677739,-79.384541,82,Eastbound,2,Bus
3905,3905,Jane St at Lambton Ave North Side,43.681333,-79.497643,335 | 35,Northbound,1,Bus
6099,6099,Southwood Dr at Kingston Rd,43.678785,-79.297828,64,Northbound,1,Bus
7038,7038,Royal York Rd at Weston Wood Rd North Side,43.692098,-79.530804,405 | 73,Northbound,1,Bus
5306,5306,Lawrence Ave East at Pharmacy Ave,43.743397,-79.30447,354 | 54,Eastbound,1,Bus
4277,4277,Kipling Ave at Annabelle Dr,43.751045,-79.585973,337 | 45 | 945,Southbound,1,Bus
9326,9326,Industry St at Todd Baylis Blvd,43.693011,-79.486377,171 | 71,Southbound,1,Bus
9972,9972,Lawrence Ave East at Stotts Ter West Side,43.78315,-79.128039,354 | 54 | 954,Eastbound,1,Bus
4757,4757,6900 Airport Rd - International Centre - North Entrance,43.701955,-79.63977,52,Westbound,2,Bus
2628,2628,Finch Ave West at Sentinel Rd,43.760891,-79.500169,336 | 806,Eastbound,1,Bus
63,63,Avenue Rd at Edmund Ave North Side,43.682897,-79.399784,13,Northbound,1,Bus
7864,7864,Humber College Blvd at Lynmont Rd,43.731799,-79.596075,336 | 96,Eastbound,1,Bus
3288,3288,400 Alliance Ave,43.677663,-79.486127,171,Southbound,1,Bus
760,760,Carlton St at Yonge St - College Station,43.66144,-79.382912,306 | 506,Westbound,1,Streetcar
4643,4643,Steeles Ave West at Islington Ave,43.764154,-79.574983,37 | 60 | 937 | 960,Southbound,1,Bus
1325,1325,Midland Ave at Danforth Rd,43.724738,-79.253779,20,Eastbound,1,Bus
11380,11380,Canmore Blvd at Calverley Trail (West) East Side,43.793262,-79.181841,905,Eastbound,1,Bus
2040,2040,Dufferin St at Dufferin Park Ave,43.656933,-79.434122,29 | 329 | 929,Northbound,1,Bus
3418,3418,Chaplin Cres at Oriole Pkwy,43.697933,-79.403071,14,Westbound,1,Bus
6076,6076,Sheppard Ave West at Kodiak Cres (North),43.753967,-79.469364,106 | 108 | 384 | 84,Westbound,1,Bus
4842,4842,Brimorton Dr at Scarborough Golf Club Rd,43.770016,-79.218094,154,Westbound,1,Bus
2759,2759,Kennedy Rd at Merrian Rd South Side,43.727149,-79.265979,113,Westbound,2,Bus
4699,4699,St Albans Rd at West Service Rd,43.639057,-79.534403,44,Northbound,1,Bus
11264,11264,Finch Ave East at Leslie St West Side - Old Cummer GO Station,43.789733,-79.370022,339 | 39,Eastbound,1,Bus
6741,6741,Pharmacy Ave at Rannock St,43.729103,-79.298977,67,Southbound,1,Bus
8396,8396,Upper Canada Dr at Normandale Cres (West),43.756371,-79.401439,78,Eastbound,1,Bus
14284,14284,Sentinel Rd at Cook Rd,43.766939,-79.500977,106 | 341 | 41,Northbound,1,Bus
1112,1112,Gerrard St East at Woodfield Rd,43.671677,-79.324168,306 | 506,Eastbound,2,Streetcar
3676,3676,Greenwood Ave at Felstead Ave,43.678111,-79.331096,31,Southbound,1,Bus
1369,1369,Opposite 44 Milner Ave,43.784944,-79.253717,132,Eastbound,1,Bus
5736,5736,Midland Ave at Prudential Dr,43.74949,-79.264254,57,Northbound,1,Bus
7182,7182,Sheppard Ave East at Grand River Blvd North Side,43.806161,-79.160781,385 | 85,Eastbound,1,Bus
7175,7175,Sheppard Ave East at Consumers Rd East Side,43.774901,-79.330647,167 | 169 | 385 | 85 | 904 | 985,Northbound,1,Bus
5506,5506,Humber Loop at The Queensway,43.631194,-79.478505,301 | 501 | 508,Eastbound,1,Streetcar
3036,3036,Queen St East at Carlaw Ave,43.661142,-79.339954,301 | 501 | 503,Westbound,2,Streetcar
10769,10769,Dovercourt Rd at Northumberland St,43.662283,-79.429754,161,Eastbound,1,Bus
2409,2409,Eglinton Ave West at Richardson Ave,43.691058,-79.471319,32 | 332,Westbound,1,Bus
697,697,Burnhamthorpe Rd at The West Mall,43.644357,-79.567438,50,Eastbound,1,Bus
11851,11851,Humberwood Blvd at Pinecone Dr North Side,43.729041,-79.619904,336 | 37 | 996,Northbound,1,Bus
5920,5920,O'Connor Dr at Bermondsey Rd,43.712699,-79.307406,70 | 91,Southbound,1,Bus
1267,1267,Maniza Rd at Regent Rd,43.732257,-79.463087,184,Westbound,1,Bus
10709,10709,Atkinson Ave at Dundurn Cres (North) East Side,43.818131,-79.446538,160,Northbound,1,Bus
4656,4656,Symington Ave at Wallace Ave,43.661361,-79.449464,168,Southbound,1,Bus
473,473,Bloor St West at Dufferin St,43.659959,-79.43512,300,Westbound,1,Bus
4797,4797,Avenue Rd at Woburn Ave,43.725322,-79.416721,61,Northbound,1,Bus
5524,5524,Lumsden Ave at Gledhill Ave,43.693844,-79.310953,62,Westbound,1,Bus
10282,10282,Bay St at St Joseph St North Side,43.666056,-79.387739,19,Northbound,1,Bus
13954,13954,Underpass Gate at Roywood Dr West Side,43.762551,-79.335751,122,Westbound,1,Bus
5862,5862,Opposite 125 Norfinch Dr,43.763255,-79.529752,84,Eastbound,1,Bus
7531,7531,Bermondsey Rd at Bartley Dr,43.719756,-79.31468,91,Southbound,1,Bus
6422,6422,Hotspur Rd at Neptune Dr,43.732503,-79.435594,109 | 400,Southbound,1,Bus
3743,3743,Hullmar Dr at Ruthmar Cres (South),43.762157,-79.526239,35,Southbound,1,Bus
6570,6570,Meadowvale Rd at Kingston Rd,43.788846,-79.162248,386 | 86 | 986,Westbound,1,Bus
7676,7676,Ellesmere Rd at Bellamy Rd North,43.774149,-79.241959,133 | 38 | 395 | 95 | 995,Northbound,1,Bus
2565,2565,Finch Ave East at Victoria Park Ave,43.792902,-79.331671,339 | 39 | 939,Eastbound,1,Bus
4378,4378,Kipling Ave at Torlake Cres (North),43.614007,-79.523427,44,Northbound,2,Bus
5898,5898,Oakwood Ave at Davenport Rd,43.674783,-79.433978,161 | 363 | 63,Southbound,2,Bus
108,108,Bathurst St at Codsell Ave,43.758401,-79.43901,160 | 307 | 7,Northbound,1,Bus
6979,6979,Royal York Rd at Chapman Rd,43.687475,-79.528699,405 | 73,Northbound,1,Bus
10117,10117,Park Lawn Rd at Lake Shore Blvd West North Side,43.62332,-79.481886,66,Northbound,1,Bus
7252,7252,Sheppard Ave East at Gateforth Dr,43.795461,-79.230553,134 | 385 | 85,Northbound,1,Bus
614,614,Bridgeland Ave at Dufferin St,43.727037,-79.457991,47,Northbound,1,Bus
2748,2748,Kennedy Rd at Corvette Ave,43.725201,-79.264834,113,Eastbound,1,Bus
8374,8374,Tournament Dr at Upper Highland Cres,43.750866,-79.398475,78,Westbound,1,Bus
4129,4129,Kennedy Rd at Treverton Dr North Side,43.73445,-79.268738,343 | 43,Northbound,1,Bus
6136,6136,St Clair Ave East at Presley Ave,43.710524,-79.288479,8,Southbound,2,Bus
4305,4305,Kipling Ave at Eglinton Ave West,43.677377,-79.551153,45 | 945,Southbound,1,Bus
2045,2045,Dufferin St at Dupont St,43.668259,-79.438833,29 | 329 | 929,Northbound,1,Bus
6595,6595,Middlefield Rd at Pebblewood Ave,43.823063,-79.262989,130,Northbound,1,Bus
1998,1998,Driftwood Ave at Driftwood Crt,43.766989,-79.515202,108,Eastbound,1,Bus
10954,10954,Old Finch Ave at Bingley Rd,43.821709,-79.203782,131,Westbound,1,Bus
3080,3080,Queen St West at Augusta Ave,43.648153,-79.399534,301 | 501,Westbound,1,Streetcar
610,610,240 Bridgeland Ave,43.724511,-79.468281,47,Southbound,1,Bus
4951,4951,Danforth Rd at Wolfe Ave,43.727577,-79.25269,16 | 300,Southbound,1,Bus
6397,6397,Foxwell St at Scarlett Rd East Side,43.669452,-79.501108,189 | 79,Southbound,2,Bus
3395,3395,Calvington Dr at Forthbridge Cres,43.728042,-79.503711,120,Westbound,1,Bus
1560,1560,St Clair Ave East at Fermoy Rd,43.721461,-79.239054,102 | 9,Southbound,1,Bus
11710,11710,Bedford Rd at Dupont St,43.676063,-79.400322,26,Westbound,1,Bus
4276,4276,Kipling Ave at Albion Rd,43.739168,-79.579932,45 | 945,Northbound,1,Bus
4349,4349,Kipling Ave at Nugent Rd,43.690331,-79.556664,45,Northbound,1,Bus
6682,6682,Pharmacy Ave at Conroy Ave,43.702832,-79.287997,67,Southbound,1,Bus
2636,2636,Finch Ave West at Tobermory Dr,43.759158,-79.507973,336 | 806,Eastbound,1,Bus
506,506,Bloor St West at Dundas St West,43.656202,-79.452611,300,Eastbound,1,Bus
9532,9532,49 Mabelle Ave,43.645387,-79.528692,40,Eastbound,1,Bus
4706,4706,Washburn Way at Griffen Dr South Side,43.798039,-79.228238,134,Southbound,1,Bus
1424,1424,O'Connor Dr at Wolverton Ave,43.694131,-79.345283,8,Northbound,1,Bus
9801,9801,Keele St at Tilbury Dr,43.730459,-79.483066,101 | 120 | 341 | 41,Southbound,1,Bus
5583,5583,Markham Rd at Sheppard Ave East,43.794082,-79.239147,102 | 902,Southbound,1,Bus
2221,2221,The East Mall at Valhalla Inn Rd,43.641605,-79.557891,111 | 300,Southbound,2,Bus
8291,8291,350 Steeles Ave West,43.795394,-79.432403,353 | 60,Eastbound,2,Bus
3898,3898,Jane St at Gordon Mackay Rd South Side,43.715134,-79.507259,335 | 35 | 935,Southbound,1,Bus
3192,3192,Wilson Heights Blvd at Cocksfield Ave,43.75293,-79.457948,104,Northbound,1,Bus
9824,9824,Steeles Ave West Loop at Martin Grove Rd,43.756665,-79.607838,396 | 46 | 60 | 927 | 960,Northbound,1,Bus
22,22,Annette St at Clendenan Ave,43.662322,-79.472105,26,Westbound,2,Bus
5491,5491,Leslie St at Van Horne Ave,43.78393,-79.366718,51,Southbound,1,Bus
11770,11770,The Queensway at Ellis Ave,43.637601,-79.46663,80,Eastbound,1,Bus
13700,13700,2275 Markham Rd,43.810593,-79.242772,102,Northbound,2,Bus
4298,4298,Kipling Ave at Bywood Dr,43.656484,-79.541568,45 | 46,Northbound,2,Bus
6949,6949,Rexdale Blvd at Tidemore Ave West Side,43.714999,-79.585487,37,Northbound,1,Bus
6291,6291,12 Carlaw Avenue,43.655953,-79.338055,325 | 72,Southbound,1,Bus
8438,8438,Victoria Park Ave at Clydesdale Dr,43.783948,-79.327253,169 | 24,Southbound,1,Bus
4414,4414,Lawrence Ave East at Bennett Rd,43.772716,-79.16665,354 | 54 | 86 | 954,Eastbound,1,Bus
11717,11717,Weston Rd at Mainshep Rd,43.731765,-79.537755,165,Northbound,1,Bus
8464,8464,Victoria Park Ave at Gordon Baker Rd,43.810295,-79.338919,24 | 924,Northbound,1,Bus
2140,2140,Dundas St West at Bathurst St - Toronto Western Hospital,43.652163,-79.406259,305 | 505,Eastbound,2,Streetcar
7156,7156,Sheppard Ave East at Blue Ridge Rd West Side,43.76977,-79.374553,185 | 385,Eastbound,1,Bus
533,533,Bloor St West at The Kingsway,43.649909,-79.499461,149 | 300 | 66,Northbound,1,Bus
8274,8274,Steeles Ave West at Futurity Gate,43.786355,-79.474561,353 | 60,Eastbound,1,Bus
7963,7963,McRae Dr at Sutherland Dr West Side,43.708563,-79.365684,88,Southbound,1,Bus
5696,5696,Midland Ave at Eglinton Ave East North Side,43.735216,-79.258277,57,Northbound,1,Bus
2591,2591,Finch Ave West at Chesswood Dr West Side,43.766502,-79.478024,336 | 36,Westbound,1,Bus
5593,5593,1245 Martin Grove Rd,43.710995,-79.579604,46,Northbound,1,Bus
5993,5993,Pape Ave at Wroxeter Ave,43.675007,-79.343202,325 | 72,Northbound,1,Bus
5205,5205,106 Lansdowne Ave,43.644016,-79.438057,402 | 47,Southbound,1,Bus
8934,8934,Yonge Blvd at Apsley Rd,43.739314,-79.413182,97,Southbound,1,Bus
4312,4312,Kipling Ave at Genthorn Ave North Side,43.723684,-79.57228,45 | 945,Northbound,1,Bus
5723,5723,Midland Ave at Midwest Rd (North),43.766055,-79.270722,57,Southbound,1,Bus
6773,6773,Prince Edward Dr South at Edgemore Dr North Side,43.645529,-79.504023,66,Northbound,1,Bus
2138,2138,Dundas St West at Acorn Ave,43.637518,-79.539041,111 | 112 | 123,Northbound,1,Bus
10564,10564,Warden Ave at Steeles Ave East,43.819799,-79.324712,324 | 68 | 968,Southbound,1,Bus
12120,12120,Colonel Samuel Smith Park Dr,43.594276,-79.51684,44 | 944,Northbound,1,Bus
13636,13636,Markham Rd at Kirkham Dr,43.851046,-79.254243,102,Northbound,1,Bus
8765,8765,Weston Rd at Seneca Ave,43.680368,-79.475653,341 | 41 | 89,Southbound,1,Bus
3503,3503,Dundas St West at Indian Road Cres,43.665156,-79.461274,340 | 40,Eastbound,1,Bus
7025,7025,Royal York Rd at Royaleigh Ave South Side,43.698221,-79.533679,352 | 405 | 73,Southbound,2,Bus
7298,7298,Sheppard Ave West at Wilmington Ave,43.752815,-79.451879,384 | 84 | 984,Westbound,1,Bus
2266,2266,Eglinton Ave East at Don Valley Pkwy West Side,43.722411,-79.332206,334 | 34,Eastbound,1,Bus
1821,1821,Cummer Ave at Snowcrest Ave (East),43.794692,-79.382673,42,Eastbound,1,Bus
5568,5568,Markham Rd at Lawrence Ave East,43.760008,-79.225565,102 | 902,Southbound,1,Bus
3178,3178,Wilmington Ave at Combe Ave,43.759548,-79.45544,104,Northbound,1,Bus
2175,2175,Dundas St West at Ossington Ave,43.64927,-79.420944,305 | 505,Eastbound,2,Streetcar
3437,3437,Cliff St at Alliance Ave North Side,43.678591,-79.483787,171,Northbound,1,Bus
7826,7826,Hollinger Rd at Curity Ave,43.710279,-79.316438,91,Southbound,1,Bus
11873,11873,300 Atkinson Ave,43.815481,-79.443674,160,Northbound,2,Bus
5179,5179,Lake Shore Blvd West at Hillside Ave,43.611265,-79.490136,301 | 501 | 507 | 508,Westbound,1,Streetcar
3812,3812,Islington Ave at Lake Shore Blvd West,43.600902,-79.505422,110 | 337,Southbound,1,Bus
6907,6907,The Queensway at Park Lawn Rd,43.629223,-79.490113,80,Westbound,1,Bus
9302,9302,Attwell Dr at Carlson Crt,43.68919,-79.587189,112 | 927,Northbound,1,Bus
7164,7164,Sheppard Ave East at Brimley Rd,43.787766,-79.268187,385 | 85 | 985,Eastbound,1,Bus
8755,8755,Weston Rd at Oxford Dr,43.687906,-79.491792,171 | 71 | 89,Northbound,1,Bus
2703,2703,Humberline Dr at Claireville Dr (South),43.737127,-79.617723,96,Westbound,1,Bus
330,330,Bayview Ave at York Mills Rd South Side,43.747363,-79.384148,11,Southbound,1,Bus
1423,1423,O'Connor Dr at Warland Ave,43.694117,-79.346018,8,Southbound,1,Bus
5695,5695,Midland Ave at Dorcot Ave,43.758095,-79.267625,57,Southbound,1,Bus
9742,9742,Barber Greene Rd at Southill Dr West Side,43.728757,-79.346279,162,Westbound,1,Bus
3785,3785,Islington Ave at Elmhurst Dr,43.723031,-79.558639,337 | 37 | 937,Northbound,1,Bus
1761,1761,Broadview Ave at Millbrook Cres,43.671897,-79.354734,301 | 305 | 504 | 505 | 62 | 8,Northbound,2,Streetcar
5481,5481,Leslie St at Talwood Dr (North),43.74077,-79.357205,51,Northbound,2,Bus
9721,9721,Dundas St West at Highway 427,43.629242,-79.554797,112 | 123,Northbound,1,Bus
5689,5689,Midland Ave at Broadbent Ave,43.738778,-79.25981,57,Northbound,1,Bus
274,274,Bayview Ave at Argonne Cres,43.794029,-79.393853,11,Northbound,1,Bus
4087,4087,Kennedy Rd at Glamorgan Ave South Side,43.768713,-79.282189,343 | 43,Southbound,1,Bus
5808,5808,Mt Pleasant Rd at Mt Pleasant Cemetery,43.695742,-79.38538,74,Northbound,1,Bus
1813,1813,Cummer Ave at Maxome Ave,43.790632,-79.401142,42,Westbound,1,Bus
1249,1249,Mill Rd at Burnhamthorpe Loop,43.640606,-79.582909,50,Eastbound,1,Bus
6310,6310,Commander Blvd at McCowan Rd West Side,43.796002,-79.262448,169,Westbound,1,Bus
8259,8259,4545 Steeles Ave West,43.771904,-79.538072,166 | 60 | 960,Eastbound,1,Bus
8575,8575,Warden Ave at Hymus Rd,43.719508,-79.284,68,Northbound,1,Bus
1520,1520,Royal York Rd at Tremayne Ave,43.651534,-79.513105,48 | 73,Northbound,1,Bus
4766,4766,Airport Rd at Orlando Dr,43.694887,-79.63023,52,Westbound,2,Bus
284,284,Bayview Ave at Citation Dr North Side,43.774828,-79.38976,11,Northbound,1,Bus
3446,3446,640 Coronation Dr,43.766498,-79.159629,86,Eastbound,1,Bus
1912,1912,Don Mills Rd at Bond Ave,43.746471,-79.346065,25 | 325,Southbound,1,Bus
11267,11267,Arcot Blvd at Albion Rd,43.726996,-79.551708,118,Eastbound,1,Bus
12079,12079,Rexdale Blvd at Queen's Plate Dr (East) East Side,43.716232,-79.592005,37,Southbound,1,Bus
1568,1568,St Clair Ave East at Marsh Rd,43.715953,-79.264399,102 | 16 | 9,Southbound,2,Bus
8134,8134,Spadina Ave at Willcocks St,43.66145,-79.401512,310 | 510,Southbound,1,Streetcar
8675,8675,The West Mall at Eva Rd,43.639441,-79.564959,112,Southbound,1,Bus
