stop_id,stop_code,stop_name,stop_lat,stop_lon,Routes,Direction,Accessibility,Type
662,662,Danforth Rd at Kennedy Rd,43.714379,-79.260939,300,Eastbound,1,Bus
929,929,Davenport Rd at Bedford Rd,43.674448,-79.399659,19,Northbound,1,Bus
940,940,Davenport Rd at Dupont St,43.675511,-79.401938,19,Northbound,2,Bus
1871,1871,Davisville Ave at Cleveland St,43.702088,-79.378112,11 | 28,Northbound,1,Bus
11700,11700,Disco Rd at Attwell Dr,43.701362,-79.594843,112,Northbound,1,Bus
3478,3478,Disco Rd at Attwell Dr,43.701043,-79.595806,45,Southbound,1,Bus
3479,3479,Disco Rd at Carlingview Dr East Side,43.69981,-79.600769,45,Southbound,1,Bus
3480,3480,Disco Rd at Carlingview Dr,43.699929,-79.601176,45,Northbound,1,Bus
14258,14258,Don Mills Rd at Eglinton Ave East,43.720674,-79.339121,25 | 325 | 354 | 403 | 925,Southbound,1,Bus
9125,9125,Don Mills Rd at Eglinton Ave East North Side,43.721373,-79.338926,100 | 25 | 325 | 34 | 354 | 403 | 925,Northbound,1,Bus
14255,14255,Don Mills Rd at Lawrence Ave East South Side,43.736625,-79.343442,191 | 354,Southbound,1,Bus
1950,1950,Don Mills Rd at Leith Hill Rd,43.777291,-79.348163,25 | 325,Southbound,1,Bus
1974,1974,Don Mills Rd at Steeles Ave East,43.81104,-79.360513,25 | 325 | 925,Northbound,1,Bus
1975,1975,Don Mills Rd at Van Horne Ave,43.787246,-79.352783,25 | 325 | 925,Northbound,1,Bus
1977,1977,Don Mills Rd at Wynford Dr,43.722851,-79.339326,25 | 325 | 354 | 403,Northbound,1,Bus
5006,5006,Doncaster Ave at Main St West Side,43.691659,-79.303796,62,Westbound,1,Bus
5007,5007,Doncaster Ave at Main St,43.691607,-79.303525,62,Eastbound,1,Bus
5008,5008,Doncaster Ave at Main St,43.691816,-79.303103,87,Eastbound,1,Bus
9288,9288,Drewry Ave at Gardenia Crt,43.78388,-79.431676,125,Eastbound,1,Bus
9275,9275,Drewry Ave at Grantbrook St,43.783607,-79.433593,125,Westbound,1,Bus
979,979,Dufferin St at Yorkdale Rd,43.726531,-79.457356,29 | 329 | 47,Northbound,1,Bus
9991,9991,Dufferin St at Springhurst Ave,43.634831,-79.425646,29 | 329,Northbound,1,Bus
985,985,Dufferin St at Jane Osler Blvd - Yorkdale Shopping Centre,43.725083,-79.456993,29 | 329 | 47 | 929,Northbound,1,Bus
11630,11630,Dufferin Mall,43.655795,-79.434031,402,Northbound,1,Bus
9856,9856,Dundas St West at Bloor St West,43.656442,-79.452572,304 | 305 | 402 | 504,Southbound,2,Streetcar
9942,9942,Dundas St West at Jane St East Side,43.665583,-79.490433,340,Westbound,2,Bus
9943,9943,Dundas St West at Jane St West Side,43.66578,-79.492146,40 | 55,Northbound,2,Bus
4455,4455,Dundas St West at Runnymede Rd West Side,43.66565,-79.482921,340 | 40,Eastbound,1,Bus
13702,13702,Dundas St West at Dundas West Outer Platform,43.656768,-79.453253,505,Westbound,2,Streetcar
13898,13898,Duplex Ave at Eglinton Ave West,43.70623,-79.400108,103 | 334 | 34 | 354 | 51 | 54 | 56 | 74,Northbound,2,Bus
11651,11651,East York Town Centre,43.705908,-79.347132,403,Northbound,2,Bus
11181,11181,Eastern Ave at Queen St East South Side,43.666788,-79.312738,22 | 31 | 322,Northbound,1,Bus
9855,9855,Edna Ave at Dundas St West,43.657134,-79.453027,168 | 304 | 305 | 340 | 40 | 504 | 505,Northbound,1,Bus
2253,2253,Eglinton Ave East at Brimley Rd West Side,43.736674,-79.248799,12 | 300,Eastbound,1,Bus
3539,3539,Eglinton Ave East at Kennedy Station,43.732292,-79.267117,334 | 34 | 343 | 43,Southbound,1,Bus
5071,5071,Eglinton Ave East at Laird Dr,43.713438,-79.365007,56,Southbound,1,Bus
2288,2288,Eglinton Ave East at Markham Rd West Side,43.743168,-79.219635,116 | 334 | 386 | 86 | 905 | 986,Eastbound,1,Bus
1036,1036,Eglinton Ave East at Midland Ave West Side,43.734493,-79.258911,20,Eastbound,1,Bus
11488,11488,Eglinton Ave West at Avenue Rd East Side,43.704641,-79.407957,13 | 32 | 332 | 61,Northbound,1,Bus
9896,9896,Eglinton Ave West at Everden Rd - Cedarvale Station,43.698565,-79.436704,32 | 332 | 363,Northbound,1,Bus
9895,9895,Eglinton Ave West at Everden Rd - Cedarvale Station,43.698853,-79.435955,164 | 32 | 332 | 363 | 63 | 882 | 90,Southbound,1,Bus
2354,2354,Eglinton Ave West at Glenarden Rd,43.699564,-79.432546,332,Westbound,1,Bus
2366,2366,Eglinton Ave West at Jane St East Side,43.68452,-79.498076,32 | 332 | 73,Northbound,1,Bus
2380,2380,Eglinton Ave West at Marlee Ave,43.698127,-79.439204,32 | 332 | 363 | 63 | 90,Southbound,1,Bus
13440,13440,Eglinton Ave West at Marlee Ave,43.698177,-79.438962,109 | 164,Northbound,1,Bus
2388,2388,Eglinton Ave West at Oakwood Ave,43.697197,-79.442946,32 | 332,Eastbound,1,Bus
9383,9383,Eglinton Ave West at Weston Rd,43.68671,-79.489925,32 | 332 | 73,Northbound,1,Bus
2419,2419,Eglinton Ave West at Weston Rd,43.687153,-79.489369,171 | 32 | 332 | 73,Northbound,1,Bus
9898,9898,Eglinton Ave West at Yonge St West Side,43.706695,-79.398957,103 | 334 | 354 | 74,Northbound,1,Bus
11506,11506,Eighth St at Birmingham St,43.602795,-79.507259,337,Northbound,2,Bus
3543,3543,Eighth St at Lake Shore Blvd West North Side,43.60078,-79.506431,337,Northbound,1,Bus
10904,10904,Ellesmere Rd at Mirrow Crt,43.787289,-79.185159,905,Eastbound,2,Bus
9622,9622,Ellesmere Rd at East Service Rd,43.767379,-79.273102,395 | 95,Eastbound,2,Bus
9619,9619,Ellesmere Rd at East Service Rd,43.767743,-79.272603,395 | 95,Westbound,1,Bus
9604,9604,Ellesmere Rd at McCowan Rd East Side,43.77225,-79.25047,133 | 38 | 395,Northbound,1,Bus
6368,6368,Ellesmere Rd at Pharmacy Ave,43.758847,-79.310443,395 | 95 | 995 | 996,Eastbound,1,Bus
6372,6372,Ellesmere Rd at Victoria Park Ave,43.758123,-79.31474,395 | 95 | 995 | 996,Westbound,1,Bus
9621,9621,Ellesmere Rd at West Service Rd East Side,43.766111,-79.278977,395 | 95,Eastbound,2,Bus
9620,9620,Ellesmere Rd at West Service Rd,43.766455,-79.278682,395 | 95,Westbound,2,Bus
6375,6375,The Esplanade at Lower Jarvis St East Side,43.648249,-79.370453,121,Eastbound,1,Bus
2435,2435,Evans Ave at Brown's Line,43.610792,-79.549007,123 | 15 | 315,Northbound,2,Bus
11202,11202,Farnboro Rd at Attwell Dr East Side,43.691554,-79.58687,927,Southbound,1,Bus
9909,9909,Finch Ave East at Neilson Rd West Side,43.816209,-79.228536,334,Eastbound,1,Bus
9912,9912,Finch Ave East at Yonge St East Side,43.779842,-79.414782,336 | 339 | 39,Eastbound,1,Bus
4750,4750,Airport Rd at Beverley St,43.707577,-79.647762,52,Eastbound,2,Bus
4752,4752,Airport Rd at Bresler Dr West Side,43.685989,-79.609114,52,Westbound,2,Bus
4753,4753,Airport Rd at Bresler Dr,43.686085,-79.606403,52,Westbound,2,Bus
4768,4768,Airport Rd at Victory Cres,43.707589,-79.647215,52,Westbound,2,Bus
6222,6222,Albion Rd at Elmhurst Dr,43.725042,-79.550293,118 | 73,Northbound,1,Bus
13427,13427,Albion Rd at Humberline Dr,43.746942,-79.621692,73,Northbound,1,Bus
6228,6228,Albion Rd at Islington Ave,43.737291,-79.565054,73,Northbound,2,Bus
3300,3300,Attwell Dr at Belfield Rd North Side,43.698444,-79.593272,45,Northbound,1,Bus
3297,3297,Attwell Dr at Disco Rd,43.701039,-79.594894,45,Northbound,1,Bus
3299,3299,Attwell Dr at Marmac Dr South Side,43.695237,-79.589518,927,Southbound,1,Bus
9304,9304,Attwell Dr at McLachlan Dr,43.693656,-79.588761,927,Southbound,1,Bus
14093,14093,Aukland Rd at Dundas St West,43.638954,-79.539233,300,Eastbound,2,Bus
11238,11238,Avenue Rd at Old Orchard Grove,43.731855,-79.419461,61,Northbound,1,Bus
13478,13478,3174 Bathurst St,43.721937,-79.430488,400,Westbound,1,Bus
134,134,Bathurst St at Elm Ridge Dr,43.705395,-79.426541,307 | 7,Southbound,1,Bus
143,143,Bathurst St at Glencairn Ave,43.71225,-79.427979,307 | 7,Northbound,1,Bus
204,204,Bathurst St at St Clair Ave West,43.683275,-79.418455,307 | 7,Southbound,1,Bus
9719,9719,Bathurst St at Steeles Ave West,43.792055,-79.445475,160,Northbound,1,Bus
11641,11641,Baycrest Home For Aged,43.729774,-79.434176,400,Eastbound,2,Bus
11640,11640,Wagman Centre,43.729171,-79.439941,400,Eastbound,2,Bus
9122,9122,Bayview Ave at Valleyanna Dr,43.724229,-79.379437,11 | 124 | 352,Northbound,1,Bus
3325,3325,Belfield Rd at Brockport Dr West Side,43.698945,-79.588836,45 | 927,Northbound,1,Bus
3326,3326,Belfield Rd at Brockport Dr,43.698544,-79.589609,45 | 927,Northbound,1,Bus
11091,11091,Berry Rd at Park Lawn Rd,43.635915,-79.494083,66,Southbound,1,Bus
1740,1740,Birchmount Rd at Finch Ave East,43.799148,-79.306217,17,Southbound,1,Bus
7549,7549,Birchmount Rd at Highview Ave South Side,43.69976,-79.265226,117,Southbound,1,Bus
7550,7550,Birchmount Rd at Highview Ave,43.699574,-79.264956,117,Northbound,1,Bus
9720,9720,Birchmount Rd at Steeles Ave South Side,43.820861,-79.316825,17,Northbound,1,Bus
526,526,Bloor St West at Islington Ave West Side,43.64451,-79.524265,300 | 337 | 37,Southbound,1,Bus
11999,11999,Bloor St West at Islington Ave,43.644845,-79.52317,149 | 300,Westbound,1,Bus
9952,9952,Bloor St West at Jane St,43.649118,-79.484624,149 | 300,Eastbound,1,Bus
11925,11925,Broadview Ave at Erindale Ave,43.677373,-79.358606,25 | 322 | 62 | 8 | 87,Northbound,1,Bus
4886,4886,Church St at Uphill Ave,43.708692,-79.508365,59,Westbound,1,Bus
4908,4908,Coxwell Ave at Mortimer Ave - Michael Garron Hospital,43.690745,-79.326731,322 | 70,Eastbound,1,Bus
4911,4911,Coxwell Ave at Plains Rd,43.696055,-79.328913,70,Westbound,1,Bus
1842,1842,3450 Danforth Ave,43.694178,-79.275031,20 | 300 | 68,Northbound,1,Bus
9955,9955,Danforth Ave at Main St,43.688277,-79.301688,300,Westbound,1,Bus
4003,4003,Keele St at Keelegate Dr,43.73283,-79.483379,101 | 341 | 41,Northbound,1,Bus
11689,11689,Keele St at St Clair Ave West,43.672216,-79.467341,89 | 989,Northbound,1,Bus
7899,7899,Keele St at St Clair Ave West,43.672009,-79.467228,341 | 41 | 941,Northbound,1,Bus
10755,10755,Keele St at Toro Rd,43.75995,-79.490202,101 | 341 | 41,Southbound,1,Bus
9154,9154,Keele St at Wilson Ave North Side,43.72718,-79.481969,341 | 41 | 941,Northbound,1,Bus
14141,14141,Wilson Ave at Keele St North Side,43.727289,-79.481998,101 | 120,Northbound,1,Bus
2752,2752,Kennedy Rd at Eglinton Ave East,43.731911,-79.267673,113,Eastbound,1,Bus
4113,4113,Kennedy Rd at Progress Ave,43.769265,-79.282028,343 | 43,Northbound,1,Bus
13624,13624,King St West at Shaw St East Side,43.641451,-79.414528,363 | 63,Southbound,1,Bus
4187,4187,King St West at Strachan Ave,43.641936,-79.412095,304 | 504 | 508,Eastbound,1,Streetcar
4285,4285,Kipling Ave at Belfield Rd - Etobicoke North GO Station,43.704725,-79.56316,45 | 945,Northbound,1,Bus
4291,4291,Kipling Ave at Bloor St West North Side,43.642305,-79.535426,45 | 46,Northbound,1,Bus
5213,5213,Lansdowne Ave at Davenport Rd South Side,43.671144,-79.44826,47,Southbound,2,Bus
11632,11632,Lansdowne Ave at Dundas St West South Side,43.649559,-79.439653,402,Southbound,2,Bus
11578,11578,Lansdowne Ave at St Clair Ave West,43.676123,-79.450405,47,Northbound,1,Bus
13068,13068,Lawrence Ave East at East Ave - Rouge Hill GO Station,43.780829,-79.131368,354 | 38 | 385 | 395 | 54 | 85 | 954,Eastbound,1,Bus
5299,5299,Lawrence Ave East at Orton Park Rd,43.763877,-79.205766,354 | 54 | 954,Eastbound,1,Bus
5357,5357,Lawrence Ave West at Culford Rd,43.706494,-79.487529,352 | 52 | 952,Westbound,1,Bus
6046,6046,Lawrence Ave West at Scarlett Rd East Side,43.698378,-79.522285,352 | 52 | 952,Eastbound,2,Bus
5410,5410,Lawrence Ave West at Varna Dr West Side,43.717543,-79.437933,352 | 52,Westbound,1,Bus
5415,5415,Lawrence Ave West at Weston Rd - Weston GO Station,43.700276,-79.516006,352 | 52 | 79,Southbound,1,Bus
11638,11638,Lawrence Plaza at Canada Trust,43.719613,-79.432586,400,Eastbound,1,Bus
11637,11637,Lawrence Sq at Northwest Entrance,43.717187,-79.448281,400,Eastbound,1,Bus
11145,11145,Leslie St at Eastern Ave,43.661641,-79.329622,83,Southbound,1,Bus
5451,5451,Leslie St at Kirkwood Rd North Side,43.757087,-79.36075,51,Northbound,1,Bus
5455,5455,Leslie St at Lawrence Ave East,43.734288,-79.355687,54,Eastbound,1,Bus
11377,11377,Leslie St at Queen St East South Side,43.662648,-79.330047,31 | 83,Southbound,1,Bus
1242,1242,Lonsdale Rd at Avenue Rd East Side,43.690834,-79.402303,13,Northbound,1,Bus
13366,13366,Exhibition Loop at Manitoba Dr,43.636511,-79.41471,509,Eastbound,2,Streetcar
12584,12584,Exhibition Loop,43.636331,-79.415373,307 | 363 | 511,Northbound,1,Bus
6528,6528,Toronto Zoo,43.819735,-79.179955,86,Eastbound,1,Bus
6527,6527,Toronto Zoo,43.819606,-79.17988,85,Eastbound,1,Bus
5519,5519,Rouge Hill GO Station Loop,43.780719,-79.130474,385 | 85,Eastbound,1,Bus
6530,6530,Rouge Hill GO Station Loop,43.780905,-79.129822,354 | 54 | 954,Eastbound,1,Bus
6532,6532,Humber Loop at The Queensway,43.631119,-79.478867,66,Northbound,1,Bus
6523,6523,Humber Loop at The Queensway,43.631002,-79.47873,301 | 501 | 508,Eastbound,1,Streetcar
7948,7948,Earlscourt Loop at St Clair Ave West,43.675983,-79.451027,47,Northbound,2,Bus
4435,4435,Long Branch Loop,43.592111,-79.5437,110 | 123 | 315,Northbound,1,Bus
10927,10927,Queens Quay Loop at Lower Spadina Ave,43.638419,-79.39184,510,Northbound,1,Streetcar
14061,14061,Westwood Square Bus Terminal at Morning Star Dr,43.721726,-79.640711,52,Eastbound,2,Bus
2852,2852,Lumsden Ave at Westlake Ave,43.694557,-79.307848,62,Westbound,1,Bus
11364,11364,Progress Ave at Markham Rd East Side,43.781933,-79.233259,102 | 134 | 903,Northbound,1,Bus
11635,11635,Toronto Rehab - Bickle Centre at 130 Dunn Ave,43.635202,-79.432965,402,Northbound,2,Bus
11845,11845,Queen St East at Kingston Rd,43.667029,-79.312948,22 | 301 | 31 | 322 | 501,Southbound,1,Bus
13461,13461,Queen St East at Kingston Rd,43.667119,-79.31289,322 | 503,Eastbound,2,Bus
6051,6051,Queen St West at Shaw St,43.644499,-79.416852,363,Southbound,1,Bus
8038,8038,Queen's Park Cres West at Hoskin Ave,43.665601,-79.393747,94,Westbound,1,Bus
1459,1459,Queen's Park Cres East at St Joseph St North Side,43.66527,-79.391226,13,Northbound,1,Bus
12139,12139,The Queensway at Morgan Ave,43.626433,-79.501779,76,Southbound,1,Bus
6920,6920,The Queensway at Stephen Dr,43.630517,-79.484019,80,Westbound,2,Bus
6923,6923,The Queensway at Windermere Ave West Side,43.637314,-79.470466,77 | 80,Southbound,1,Bus
11631,11631,55 Rankin Cres,43.658448,-79.446615,402,Northbound,2,Bus
6011,6011,Rathburn Rd at Lloyd Manor Rd,43.659201,-79.546369,46,Northbound,1,Bus
8069,8069,Renforth Dr at Eglinton Ave West,43.666096,-79.587166,112,Northbound,1,Bus
11628,11628,Michael Power / St Joseph H.S.,43.659476,-79.582965,112,Southbound,1,Bus
11627,11627,Michael Power / St Joseph H.S.,43.659289,-79.582873,48,Eastbound,1,Bus
6031,6031,Rogers Rd at Keele St,43.68219,-79.471323,161 | 168,Northbound,1,Bus
6991,6991,Royal York Rd at Dixon Rd,43.699615,-79.533986,73,Northbound,2,Bus
8082,8082,Sentinel Rd at Finch Ave West,43.761193,-79.500227,106,Eastbound,1,Bus
4498,4498,Sentinel Rd at The Pond Rd,43.769916,-79.502298,41,Northbound,1,Bus
10870,10870,Sewells Rd at Brenyon Way East Side,43.807953,-79.215028,131,Eastbound,1,Bus
10873,10873,Sewells Rd at Brenyon Way,43.80792,-79.215527,131,Westbound,1,Bus
10871,10871,Sewells Rd at McLevin Ave,43.810308,-79.213775,131,Eastbound,2,Bus
11669,11669,Sheppard Ave East at Meadowvale Rd,43.80818,-79.171104,385 | 85,Eastbound,2,Bus
13918,13918,Sheppard Ave East at Victoria Park Ave East Side,43.775286,-79.322236,904 | 985,Southbound,1,Bus
6069,6069,Sheppard Ave West at Jane St East Side,43.739369,-79.512583,384 | 84 | 984,Eastbound,2,Bus
6087,6087,Sheppard Ave West at Sentinel Rd,43.743786,-79.491659,108 | 384 | 84 | 984,Westbound,1,Bus
4598,4598,Sheppard Ave West at William R Allen Rd West Side,43.750252,-79.463904,106 | 107 | 108 | 384 | 84,Northbound,1,Bus
3117,3117,Sherway Gardens Rd at Sherway Gate (Mall),43.609729,-79.558438,123,Northbound,1,Bus
9108,9108,Sherway Gardens Rd at Sherway Gate Mall West Side,43.610024,-79.558228,80,Eastbound,1,Bus
9109,9109,Sherway Gardens Rd at Sherway Gate Mall,43.609785,-79.558022,123,Northbound,1,Bus
11587,11587,Sherway Gardens Rd at Sherway Gate (Mall),43.609847,-79.557773,123 | 15 | 315,Northbound,1,Bus
1262,1262,Main St at Danforth Ave,43.688037,-79.301635,306 | 506,Eastbound,2,Streetcar
11826,11826,Main St at Danforth Ave,43.687796,-79.301532,135 | 64 | 87,Northbound,1,Bus
2855,2855,Main St at Doncaster Ave,43.691558,-79.303255,87,Eastbound,2,Bus
1264,1264,Main St at Gerrard St East,43.684061,-79.300315,64,Southbound,1,Bus
13923,13923,Main St at Gerrard St East,43.684182,-79.300207,135 | 306 | 506,Eastbound,1,Bus
13900,13900,Markham Rd at Passmore Ave North Side,43.831141,-79.250611,102,Northbound,2,Bus
11331,11331,Martin Grove Rd at Finch Ave West North Side,43.737241,-79.591714,927,Northbound,1,Bus
5620,5620,Martin Grove Rd at John Garland Blvd,43.731919,-79.589166,396 | 46,Northbound,1,Bus
5627,5627,Martin Grove Rd at Mercury Rd,43.726119,-79.586894,46,Southbound,1,Bus
7957,7957,Westhumber Blvd at Martin Grove Rd North Side,43.726355,-79.586705,396 | 96 | 996,Westbound,2,Bus
9993,9993,McCowan Rd at Elson St,43.834965,-79.27602,129,Northbound,1,Bus
9807,9807,McCowan Rd at Steeles Ave East North Side,43.83177,-79.2752,129 | 302,Northbound,1,Bus
10577,10577,McCowan Rd at Steeles Ave East South Side,43.830294,-79.275161,129 | 302,Northbound,1,Bus
2874,2874,1020 McNicoll Ave,43.804303,-79.335709,42,Westbound,1,Bus
12017,12017,McNicoll Ave at Silver Springs Blvd,43.809896,-79.306447,42,Eastbound,1,Bus
12035,12035,McNicoll Ave at Silver Springs Blvd,43.810154,-79.306225,17 | 42,Southbound,1,Bus
9179,9179,McNicoll Ave at Victoria Park Ave,43.803924,-79.336632,39 | 42,Eastbound,1,Bus
6575,6575,Meadowvale Rd at Sheppard Ave East,43.808582,-79.171055,386 | 86 | 986,Westbound,1,Bus
11415,11415,Military Trail at Morningside Ave,43.789009,-79.193257,12 | 905,Eastbound,1,Bus
5753,5753,Millwood Rd at Overlea Blvd North Side,43.702117,-79.353246,56,Northbound,1,Bus
4484,4484,Millwood Rd at Overlea Blvd,43.70187,-79.35243,100 | 72,Northbound,1,Bus
10947,10947,Morningside Ave at Casebridge Crt North Side,43.809256,-79.20275,131,Eastbound,1,Bus
11249,11249,Morningside Ave at John Stoner Dr South Side,43.813037,-79.206022,131,Westbound,1,Bus
13906,13906,Nightstar Rd at Morningside Ave North Side,43.823402,-79.230475,133 | 53 | 939 | 953,Northbound,1,Bus
14104,14104,2851 Morningside Ave Walkway to Raponi Cir,43.826549,-79.232874,133 | 53 | 939 | 953,Northbound,1,Bus
5755,5755,Morning Star Dr at Catalpa Rd,43.719752,-79.643204,52,Westbound,2,Bus
5756,5756,Morning Star Dr at Catalpa Rd,43.720149,-79.643031,52,Eastbound,1,Bus
5758,5758,Morning Star Dr at Airport Rd East Side,43.709985,-79.649766,52,Westbound,2,Bus
5759,5759,Morning Star Dr at Lancaster Ave,43.712757,-79.647418,52,Westbound,2,Bus
5760,5760,Morning Star Dr at Manion Rd,43.71257,-79.647738,52,Eastbound,2,Bus
5763,5763,Morning Star Dr at Reindeer Dr West Side,43.714132,-79.646964,52,Eastbound,2,Bus
5764,5764,Morning Star Dr at Reindeer Dr,43.714642,-79.646501,52,Westbound,2,Bus
5773,5773,Mortimer Ave at Coxwell Ave West Side - Michael Garron Hospital,43.69056,-79.327056,62,Westbound,1,Bus
5813,5813,Mt Pleasant Rd at Eglinton Ave East North Side,43.708909,-79.3902,103,Northbound,1,Bus
1380,1380,Neilson Rd at Finch Ave East South Side,43.81544,-79.227311,133,Southbound,1,Bus
11667,11667,Neilson Rd at Finch Ave East South Side,43.815638,-79.227412,334 | 39,Eastbound,1,Bus
5904,5904,Oakwood Ave at Eglinton Ave West South Side,43.696926,-79.442725,363 | 63 | 90,Southbound,1,Bus
5911,5911,Oakwood Ave at Rogers Rd,43.687031,-79.438568,363 | 63,Northbound,1,Bus
1419,1419,O'Connor Dr at Pape Ave,43.693124,-79.350439,8,Northbound,1,Bus
4509,4509,Old Weston Rd at St Clair Ave West North Side,43.673945,-79.463061,168 | 341 | 41 | 941,Northbound,1,Bus
11583,11583,Old Weston Rd at St Clair Ave West,43.673248,-79.462852,127,Westbound,1,Bus
4508,4508,Old Weston Rd at St Clair Ave West,43.673628,-79.463123,127 | 168,Southbound,1,Bus
8008,8008,Ossington Ave at Bloor St West,43.661821,-79.425454,363 | 63 | 94,Northbound,1,Bus
9857,9857,Ossington Ave at Bloor St West,43.662062,-79.425772,161 | 363 | 63 | 94,Southbound,1,Bus
2979,2979,Overlea Blvd at Millwood Rd East Side,43.702452,-79.35223,25 | 325 | 88,Northbound,2,Bus
8009,8009,Overlea Blvd at Millwood Rd,43.702345,-79.352727,88,Southbound,1,Bus
8011,8011,Overlea Blvd at Thorncliffe Park Dr (East),43.70725,-79.344028,100 | 25 | 925,Northbound,1,Bus
11846,11846,Pape Ave at Lipton Ave North Side,43.679891,-79.345139,325 | 72,Northbound,1,Bus
4501,4501,Pape Ave at O'Connor Dr North Side,43.693657,-79.350372,100 | 25,Northbound,1,Bus
1451,1451,Parliament St at Carlton St,43.663906,-79.36772,306 | 506,Westbound,2,Streetcar
1452,1452,Parliament St at Gerrard St East,43.662048,-79.367169,306 | 506,Eastbound,2,Streetcar
1453,1453,Peter Kaiser Gate at Steeles Ave West,43.774009,-79.526633,35,Northbound,1,Bus
6698,6698,Pharmacy Ave at Ellesmere Rd,43.758892,-79.310043,67,Northbound,1,Bus
9885,9885,Port Union Rd at Adenmore Rd North Side,43.781768,-79.13747,38 | 395,Westbound,1,Bus
3587,3587,Finch Ave West at Dufferin St,43.768624,-79.467298,336 | 36 | 939,Eastbound,1,Bus
12456,12456,Finch Ave West at Rumike Rd East Side,43.749971,-79.551625,119,Eastbound,2,Bus
3613,3613,Finch Ave West at Senlac Rd,43.776326,-79.430344,336 | 36 | 939,Eastbound,1,Bus
3622,3622,Finch Ave West at Wilmington Ave,43.770054,-79.460827,336 | 36,Eastbound,1,Bus
10210,10210,Fleet St at Bathurst St,43.63647,-79.400131,509 | 511,Northbound,1,Streetcar
2646,2646,Freshmeadow Dr at Don Mills Rd,43.809241,-79.358694,25 | 325 | 925,Northbound,1,Bus
9116,9116,Freshmeadow Dr at Don Mills Rd,43.809161,-79.358829,51,Northbound,1,Bus
9536,9536,Front St East at Berkeley St,43.651396,-79.363737,301 | 504,Westbound,1,Streetcar
7480,7480,Lawson Rd at Kingston Rd - Highway 2A Overpass,43.784126,-79.168334,38,Eastbound,1,Bus
6625,6625,Highland Creek Overpass at Kingston Rd,43.784451,-79.168491,386 | 86 | 986,Eastbound,1,Bus
11560,11560,Highland Creek Overpass at Kingston Rd,43.784282,-79.168278,38,Westbound,1,Bus
11504,11504,Highway 27 at Queen's Plate Dr - Woodbine Centre,43.722448,-79.597785,927,Northbound,1,Bus
12196,12196,Humber College Blvd at Humberline Dr South Side,43.731793,-79.608899,927 | 96,Southbound,1,Bus
12064,12064,Humberline Dr at Humber College Blvd West Side,43.731956,-79.609689,336 | 37 | 96 | 996,Southbound,1,Bus
11049,11049,Humberline Dr at Humber College Blvd,43.731861,-79.609562,336 | 37 | 996,Northbound,1,Bus
9901,9901,Islington Ave at Bloor St West North Side,43.64541,-79.523592,110 | 337 | 37 | 50 | 937,Northbound,1,Bus
13363,13363,Islington Ave at Bloor St West,43.644497,-79.523193,337,Northbound,1,Bus
3791,3791,Islington Ave at Finch Ave West,43.745841,-79.568376,337 | 37 | 937,Northbound,1,Bus
13518,13518,Islington Ave at Steeles Ave West,43.763708,-79.574525,166,Westbound,1,Bus
3863,3863,Jane St at Annette St,43.658168,-79.487997,335 | 35 | 55,Northbound,1,Bus
3878,3878,Jane St at Trethewey Dr,43.697819,-79.502577,335 | 35 | 935,Southbound,1,Bus
3891,3891,Jane St at Finch Ave West South Side,43.756377,-79.517646,335 | 35 | 935 | 99,Northbound,1,Bus
3903,3903,Jane St at Heathrow Dr,43.724803,-79.509439,335 | 35,Northbound,1,Bus
10411,10411,Jane St at Hullmar Dr,43.772801,-79.521145,335 | 35,Northbound,1,Bus
3904,3904,Jane St at Hullmar Dr,43.773357,-79.521585,335 | 35,Southbound,1,Bus
11842,11842,Jane St at Lambton Ave,43.68093,-79.497522,171,Northbound,1,Bus
3916,3916,Jane St at Pritchard Ave,43.669731,-79.493013,189 | 335 | 35,Southbound,1,Bus
2740,2740,Jane St at Wright Ave,43.701092,-79.503411,32 | 335 | 35,Southbound,1,Bus
10412,10412,Jane St at Steeles Ave West,43.775288,-79.521497,335 | 35 | 935,Northbound,1,Bus
12146,12146,John Garland Blvd at Finch Ave West South Side,43.73531,-79.594657,336,Westbound,1,Bus
11199,11199,John Garland Blvd at Finch Ave West,43.735579,-79.594631,336,Eastbound,1,Bus
9149,9149,Keele St at Finch Ave West North Side - Finch West Station,43.764093,-79.490996,101 | 107 | 341 | 41 | 941,Northbound,1,Bus
11321,11321,Keele St at Finch Ave West - Finch West Station,43.763952,-79.491402,101 | 336 | 341 | 41 | 806 | 941,Southbound,1,Bus
6338,6338,Crescent Rd at South Dr (West),43.678317,-79.382775,82,Eastbound,1,Bus
1080,1080,Gerrard St East at Blackburn St,43.664667,-79.355383,121 | 306 | 506,Eastbound,2,Bus
5221,5221,Lansdowne Ave at Seaforth Ave,43.642783,-79.437588,402 | 47,Southbound,1,Bus
13313,13313,Scarlett Rd at Foxwell St,43.669109,-79.501269,79,Northbound,2,Bus
2381,2381,Eglinton Ave West at Martin Grove Rd,43.674662,-79.562929,32 | 332,Westbound,1,Bus
6931,6931,Ranee Ave at Varna Dr - Yorkdale Station,43.723727,-79.446059,109,Northbound,1,Bus
4973,4973,950 Dixon Rd,43.686752,-79.598885,332 | 352 | 52,Westbound,1,Bus
1301,1301,McCowan Rd at Kenhatch Blvd,43.801324,-79.263574,129 | 302,Northbound,1,Bus
546,546,Bloor St West at Markland Dr (East) East Side,43.633599,-79.570302,49,Eastbound,1,Bus
3336,3336,Belfield Rd at Kipling Ave - Etobicoke North GO Station,43.704617,-79.563789,45,Southbound,1,Bus
5496,5496,Lloyd Manor Rd at Firwood Cres North Side,43.665826,-79.550934,46,Northbound,2,Bus
9808,9808,McCowan Rd Loop at Steeles Ave East,43.832437,-79.275113,129 | 302,Northbound,2,Bus
10237,10237,Maybrook Dr at Newmill Gate,43.825459,-79.261236,130 | 42,Northbound,1,Bus
3087,3087,Queen St West at Soho St,43.649465,-79.393288,301 | 501,Westbound,1,Streetcar
8215,8215,Steeles Ave East at Don Mills Rd,43.811361,-79.360551,353 | 53 | 953,Eastbound,1,Bus
11251,11251,Midland Ave at Steeles Ave East South Side,43.825426,-79.297157,343 | 43 | 57,Northbound,1,Bus
4241,4241,Kingston Rd at McNab Blvd East Side,43.728894,-79.227864,102 | 12 | 86,Northbound,1,Bus
4353,4353,Kipling Ave at Jutland Rd,43.627059,-79.529279,44,Southbound,2,Bus
5891,5891,Oakdale Rd at Sheppard Ave West North Side,43.737561,-79.524547,119 | 84,Eastbound,1,Bus
11775,11775,Parkside Dr at High Park Blvd,43.644754,-79.456095,80,Eastbound,2,Bus
2683,2683,Guildwood Pkwy at Navarre Cres,43.749505,-79.190293,116 | 334,Eastbound,1,Bus
5688,5688,Midland Ave at Boarhill Dr,43.799936,-79.284552,57,Northbound,1,Bus
2320,2320,Eglinton Ave East at Wynford Dr West Side,43.724363,-79.325724,334 | 34,Eastbound,1,Bus
3407,3407,Chaplin Cres at Avenue Rd,43.698727,-79.405846,13 | 14,Northbound,1,Bus
